"ספר שמואל/שמ""ב א"	0	<noinclude>{{תבנית:טעמי המקרא באינטרנט}}//{{מ:שוליים|5}}//{{תבנית:משתמש:Dovi/טעמי המקרא}}//</noinclude>		
"ספר שמואל/שמ""ב ח"	יא	__	{{מ:פסוק|שמואל ב|ח|יא}}	גַּם־אֹתָ֕ם הִקְדִּ֛ישׁ הַמֶּ֥לֶךְ דָּוִ֖ד לַיהֹוָ֑ה עִם־הַכֶּ֤סֶף וְהַזָּהָב֙ אֲשֶׁ֣ר הִקְדִּ֔ישׁ מִכׇּל־הַגּוֹיִ֖ם אֲשֶׁ֥ר כִּבֵּֽשׁ׃
"ספר שמואל/שמ""ב ח"	יב	__	{{מ:פסוק|שמואל ב|ח|יב}}	מֵאֲרָ֤ם וּמִמּוֹאָב֙ וּמִבְּנֵ֣י עַמּ֔וֹן וּמִפְּלִשְׁתִּ֖ים וּמֵעֲמָלֵ֑ק וּמִשְּׁלַ֛ל הֲדַדְעֶ֥זֶר בֶּן־רְחֹ֖ב מֶ֥לֶךְ צוֹבָֽה׃
"ספר שמואל/שמ""ב ח"	יג	__	{{מ:פסוק|שמואל ב|ח|יג}}	וַיַּ֤עַשׂ דָּוִד֙ שֵׁ֔ם בְּשֻׁב֕וֹ מֵהַכּוֹת֥וֹ אֶת־אֲרָ֖ם בְּגֵיא־מֶ֑לַח שְׁמוֹנָ֥ה עָשָׂ֖ר אָֽלֶף׃
"ספר שמואל/שמ""ב ח"	יד	__	{{מ:פסוק|שמואל ב|ח|יד}}	וַיָּ֨שֶׂם בֶּאֱד֜וֹם נְצִבִ֗ים בְּכׇל־אֱדוֹם֙ שָׂ֣ם נְצִבִ֔ים וַיְהִ֥י כׇל־אֱד֖וֹם עֲבָדִ֣ים לְדָוִ֑ד וַיּ֤וֹשַׁע יְהֹוָה֙ אֶת־דָּוִ֔ד בְּכֹ֖ל אֲשֶׁ֥ר הָלָֽךְ׃
"ספר שמואל/שמ""ב ח"	טו	__	{{מ:פסוק|שמואל ב|ח|טו}}	וַיִּמְלֹ֥ךְ דָּוִ֖ד עַל־כׇּל־יִשְׂרָאֵ֑ל וַיְהִ֣י דָוִ֗ד עֹשֶׂ֛ה מִשְׁפָּ֥ט וּצְדָקָ֖ה לְכׇל־עַמּֽוֹ׃
"ספר שמואל/שמ""ב ח"	טז	__	{{מ:פסוק|שמואל ב|ח|טז}}	"וְיוֹאָ֥ב בֶּן־צְרוּיָ֖ה עַל־הַצָּבָ֑א {{נוסח|וִיהוֹשָׁפָ֥ט|=לק ובדפוסים (וכן הכריעו ברויאר מג""ה)|א=וְיהוֹשָׁפָ֥ט (בשוא)}} בֶּן־אֲחִיל֖וּד מַזְכִּֽיר׃"
"ספר שמואל/שמ""ב ח"	יז	__	{{מ:פסוק|שמואל ב|ח|יז}}	וְצָד֧וֹק בֶּן־אֲחִיט֛וּב וַאֲחִימֶ֥לֶךְ בֶּן־אֶבְיָתָ֖ר כֹּהֲנִ֑ים וּשְׂרָיָ֖ה סוֹפֵֽר׃
"ספר שמואל/שמ""ב ח"	יח	__	{{מ:פסוק|שמואל ב|ח|יח}}	וּבְנָיָ֙הוּ֙ בֶּן־יְה֣וֹיָדָ֔ע וְהַכְּרֵתִ֖י וְהַפְּלֵתִ֑י וּבְנֵ֥י דָוִ֖ד כֹּהֲנִ֥ים הָיֽוּ׃
"ספר שמואל/שמ""ב ח"	תתת	<noinclude>//{{תבנית:משתמש:Dovi/טעמי המקרא-סוף}}//{{מ:שוליים-סוף}}//==הפרק בלי מספרים==//{{תבנית:משתמש:Dovi/טעמי המקרא}}//{{#בלי קטע:{{שם הדף המלא}}|סימן}}//{{תבנית:משתמש:Dovi/טעמי המקרא-סוף}}</noinclude>		
"ספר שמואל/שמ""ב ט"	0	<noinclude>{{תבנית:טעמי המקרא באינטרנט}}//{{מ:שוליים|5}}//{{תבנית:משתמש:Dovi/טעמי המקרא}}//</noinclude>		
"ספר שמואל/שמ""ב ט"	א	{{סס}}	{{מ:פסוק|שמואל ב|ט|א}}	וַיֹּ֣אמֶר דָּוִ֔ד הֲכִ֣י יֶשׁ־ע֔וֹד אֲשֶׁ֥ר נוֹתַ֖ר לְבֵ֣ית שָׁא֑וּל וְאֶעֱשֶׂ֤ה עִמּוֹ֙ חֶ֔סֶד בַּעֲב֖וּר יְהוֹנָתָֽן׃
"ספר שמואל/שמ""ב ט"	ב	__	{{מ:פסוק|שמואל ב|ט|ב}}	וּלְבֵ֨ית שָׁא֥וּל עֶ֙בֶד֙ וּשְׁמ֣וֹ צִיבָ֔א וַיִּקְרְאוּ־ל֖וֹ אֶל־דָּוִ֑ד וַיֹּ֨אמֶר הַמֶּ֧לֶךְ אֵלָ֛יו הַאַתָּ֥ה צִיבָ֖א וַיֹּ֥אמֶר עַבְדֶּֽךָ׃
"ספר שמואל/שמ""ב ט"	ג	__	{{מ:פסוק|שמואל ב|ט|ג}}	וַיֹּ֣אמֶר הַמֶּ֗לֶךְ הַאֶ֨פֶס ע֥וֹד אִישׁ֙ לְבֵ֣ית שָׁא֔וּל וְאֶעֱשֶׂ֥ה עִמּ֖וֹ חֶ֣סֶד אֱלֹהִ֑ים וַיֹּ֤אמֶר צִיבָא֙ אֶל־הַמֶּ֔לֶךְ ע֛וֹד בֵּ֥ן לִיהוֹנָתָ֖ן נְכֵ֥ה רַגְלָֽיִם׃
"ספר שמואל/שמ""ב ט"	ד	__	{{מ:פסוק|שמואל ב|ט|ד}}	וַיֹּֽאמֶר־ל֥וֹ הַמֶּ֖לֶךְ אֵיפֹ֣ה ה֑וּא וַיֹּ֤אמֶר צִיבָא֙ אֶל־הַמֶּ֔לֶךְ הִנֵּה־ה֗וּא בֵּ֛ית מָכִ֥יר בֶּן־עַמִּיאֵ֖ל בְּל֥וֹ דְבָֽר׃
"ספר שמואל/שמ""ב ט"	ה	__	{{מ:פסוק|שמואל ב|ט|ה}}	וַיִּשְׁלַ֖ח הַמֶּ֣לֶךְ דָּוִ֑ד וַיִּקָּחֵ֗הוּ מִבֵּ֛ית מָכִ֥יר בֶּן־עַמִּיאֵ֖ל מִלּ֥וֹ דְבָֽר׃
"ספר שמואל/שמ""ב ט"	ו	__	{{מ:פסוק|שמואל ב|ט|ו}}	וַ֠יָּבֹ֠א מְפִיבֹ֨שֶׁת בֶּן־יְהוֹנָתָ֤ן בֶּן־שָׁאוּל֙ אֶל־דָּוִ֔ד וַיִּפֹּ֥ל עַל־פָּנָ֖יו וַיִּשְׁתָּ֑חוּ וַיֹּ֤אמֶר דָּוִד֙ מְפִיבֹ֔שֶׁת וַיֹּ֖אמֶר הִנֵּ֥ה עַבְדֶּֽךָ׃
"ספר שמואל/שמ""ב ט"	ז	__	{{מ:פסוק|שמואל ב|ט|ז}}	וַיֹּ֩אמֶר֩ ל֨וֹ דָוִ֜ד אַל־תִּירָ֗א כִּ֣י עָשֹׂה֩ אֶעֱשֶׂ֨ה עִמְּךָ֥ חֶ֙סֶד֙ בַּֽעֲבוּר֙ יְהוֹנָתָ֣ן אָבִ֔יךָ וַהֲשִׁבֹתִ֣י לְךָ֔ אֶֽת־כׇּל־שְׂדֵ֖ה שָׁא֣וּל אָבִ֑יךָ וְאַתָּ֗ה תֹּ֥אכַל לֶ֛חֶם עַל־שֻׁלְחָנִ֖י תָּמִֽיד׃
"ספר שמואל/שמ""ב ט"	ח	__	{{מ:פסוק|שמואל ב|ט|ח}}	וַיִּשְׁתַּ֕חוּ וַיֹּ֖אמֶר מֶ֣ה עַבְדֶּ֑ךָ כִּ֣י פָנִ֔יתָ אֶל־הַכֶּ֥לֶב הַמֵּ֖ת אֲשֶׁ֥ר כָּמֽוֹנִי׃
"ספר שמואל/שמ""ב ט"	ט	__	{{מ:פסוק|שמואל ב|ט|ט}}	וַיִּקְרָ֣א הַמֶּ֗לֶךְ אֶל־צִיבָ֛א נַ֥עַר שָׁא֖וּל וַיֹּ֣אמֶר אֵלָ֑יו כֹּל֩ אֲשֶׁ֨ר הָיָ֤ה לְשָׁאוּל֙ וּלְכׇל־בֵּית֔וֹ נָתַ֖תִּי לְבֶן־אֲדֹנֶֽיךָ׃
"ספר שמואל/שמ""ב ט"	י	__	{{מ:פסוק|שמואל ב|ט|י}}	וְעָבַ֣דְתָּ לּ֣וֹ אֶֽת־הָאֲדָמָ֡ה אַתָּה֩ וּבָנֶ֨יךָ וַעֲבָדֶ֜יךָ וְהֵבֵ֗אתָ וְהָיָ֨ה לְבֶן־אֲדֹנֶ֤יךָ לֶּ֙חֶם֙ וַאֲכָל֔וֹ וּמְפִיבֹ֙שֶׁת֙ בֶּן־אֲדֹנֶ֔יךָ יֹאכַ֥ל תָּמִ֛יד לֶ֖חֶם עַל־שֻׁלְחָנִ֑י וּלְצִיבָ֗א חֲמִשָּׁ֥ה עָשָׂ֛ר בָּנִ֖ים וְעֶשְׂרִ֥ים עֲבָדִֽים׃
"ספר שמואל/שמ""ב ט"	יא	__	{{מ:פסוק|שמואל ב|ט|יא}}	וַיֹּ֤אמֶר צִיבָא֙ אֶל־הַמֶּ֔לֶךְ כְּכֹל֩ אֲשֶׁ֨ר יְצַוֶּ֜ה אֲדֹנִ֤י הַמֶּ֙לֶךְ֙ אֶת־עַבְדּ֔וֹ כֵּ֖ן יַעֲשֶׂ֣ה עַבְדֶּ֑ךָ וּמְפִיבֹ֗שֶׁת אֹכֵל֙ עַל־שֻׁלְחָנִ֔י כְּאַחַ֖ד מִבְּנֵ֥י הַמֶּֽלֶךְ׃
"ספר שמואל/שמ""ב ט"	יב	__	{{מ:פסוק|שמואל ב|ט|יב}}	וְלִמְפִיבֹ֥שֶׁת בֵּן־קָטָ֖ן וּשְׁמ֣וֹ מִיכָ֑א וְכֹל֙ מוֹשַׁ֣ב בֵּית־צִיבָ֔א עֲבָדִ֖ים לִמְפִיבֹֽשֶׁת׃
"ספר שמואל/שמ""ב ט"	יג	__	{{מ:פסוק|שמואל ב|ט|יג}}	וּמְפִיבֹ֗שֶׁת יֹשֵׁב֙ בִּיר֣וּשָׁל{{מ:ירושלם|ַ|֔}}ם כִּ֣י עַל־שֻׁלְחַ֥ן הַמֶּ֛לֶךְ תָּמִ֖יד ה֣וּא אֹכֵ֑ל וְה֥וּא פִסֵּ֖חַ שְׁתֵּ֥י רַגְלָֽיו׃
"ספר שמואל/שמ""ב ט"	תתת	<noinclude>//{{תבנית:משתמש:Dovi/טעמי המקרא-סוף}}//{{מ:שוליים-סוף}}//==הפרק בלי מספרים==//{{תבנית:משתמש:Dovi/טעמי המקרא}}//{{#בלי קטע:{{שם הדף המלא}}|סימן}}//{{תבנית:משתמש:Dovi/טעמי המקרא-סוף}}</noinclude>		
"ספר שמואל/שמ""ב י"	0	<noinclude>{{תבנית:טעמי המקרא באינטרנט}}//{{מ:שוליים|5}}//{{תבנית:משתמש:Dovi/טעמי המקרא}}//</noinclude>		
"ספר שמואל/שמ""ב י"	א	{{פפ}}//	{{מ:פסוק|שמואל ב|י|א}}	וַֽיְהִי֙ אַחֲרֵי־כֵ֔ן וַיָּ֕מׇת מֶ֖לֶךְ בְּנֵ֣י עַמּ֑וֹן וַיִּמְלֹ֛ךְ חָנ֥וּן בְּנ֖וֹ תַּחְתָּֽיו׃
"ספר שמואל/שמ""ב י"	ב	__	{{מ:פסוק|שמואל ב|י|ב}}	וַיֹּ֨אמֶר דָּוִ֜ד אֶעֱשֶׂה־חֶ֣סֶד{{מ:לגרמיה}}עִם־חָנ֣וּן בֶּן־נָחָ֗שׁ כַּאֲשֶׁר֩ עָשָׂ֨ה אָבִ֤יו עִמָּדִי֙ חֶ֔סֶד וַיִּשְׁלַ֨ח דָּוִ֧ד לְנַחֲמ֛וֹ בְּיַד־עֲבָדָ֖יו אֶל־אָבִ֑יו וַיָּבֹ֙אוּ֙ עַבְדֵ֣י דָוִ֔ד אֶ֖רֶץ בְּנֵ֥י עַמּֽוֹן׃
"ספר שמואל/שמ""ב י"	ג	__	{{מ:פסוק|שמואל ב|י|ג}}	וַיֹּאמְרוּ֩ שָׂרֵ֨י בְנֵי־עַמּ֜וֹן אֶל־חָנ֣וּן אֲדֹנֵיהֶ֗ם {{נוסח|הַֽמְכַבֵּ֨ד|א=הַֽמֲכַבֵּ֨ד}} דָּוִ֤ד אֶת־אָבִ֙יךָ֙ בְּעֵינֶ֔יךָ כִּֽי־שָׁלַ֥ח לְךָ֖ מְנַחֲמִ֑ים הֲ֠ל֠וֹא בַּעֲב֞וּר חֲקֹ֤ר אֶת־הָעִיר֙ וּלְרַגְּלָ֣הּ וּלְהׇפְכָ֔הּ שָׁלַ֥ח דָּוִ֛ד אֶת־עֲבָדָ֖יו אֵלֶֽיךָ׃
"ספר שמואל/שמ""ב י"	ד	__	{{מ:פסוק|שמואל ב|י|ד}}	וַיִּקַּ֨ח חָנ֜וּן אֶת־עַבְדֵ֣י דָוִ֗ד וַיְגַלַּח֙ אֶת־חֲצִ֣י זְקָנָ֔ם וַיִּכְרֹ֧ת אֶת־מַדְוֵיהֶ֛ם בַּחֵ֖צִי עַ֣ד שְׁתוֹתֵיהֶ֑ם וַֽיְשַׁלְּחֵֽם׃
"ספר שמואל/שמ""ב י"	ה	__	{{מ:פסוק|שמואל ב|י|ה}}	וַיַּגִּ֤דוּ לְדָוִד֙ וַיִּשְׁלַ֣ח לִקְרָאתָ֔ם כִּי־הָי֥וּ הָאֲנָשִׁ֖ים נִכְלָמִ֣ים מְאֹ֑ד וַיֹּ֤אמֶר הַמֶּ֙לֶךְ֙ שְׁב֣וּ בִירֵח֔וֹ עַד־יְצַמַּ֥ח זְקַנְכֶ֖ם וְשַׁבְתֶּֽם׃
"ספר שמואל/שמ""ב י"	ו	__	{{מ:פסוק|שמואל ב|י|ו}}	וַיִּרְאוּ֙ בְּנֵ֣י עַמּ֔וֹן כִּ֥י נִבְאֲשׁ֖וּ בְּדָוִ֑ד וַיִּשְׁלְח֣וּ בְנֵי־עַמּ֡וֹן וַיִּשְׂכְּרוּ֩ אֶת־אֲרַ֨ם בֵּית־רְח֜וֹב וְאֶת־אֲרַ֣ם צוֹבָ֗א עֶשְׂרִ֥ים אֶ֙לֶף֙ רַגְלִ֔י וְאֶת־מֶ֤לֶךְ מַֽעֲכָה֙ אֶ֣לֶף אִ֔ישׁ וְאִ֣ישׁ ט֔וֹב שְׁנֵים־עָשָׂ֥ר אֶ֖לֶף אִֽישׁ׃
"ספר שמואל/שמ""ב י"	ז	__	{{מ:פסוק|שמואל ב|י|ז}}	וַיִּשְׁמַ֖ע דָּוִ֑ד וַיִּשְׁלַח֙ אֶת־יוֹאָ֔ב וְאֵ֥ת כׇּל־הַצָּבָ֖א הַגִּבֹּרִֽים׃
"ספר שמואל/שמ""ב י"	ח	__	{{מ:פסוק|שמואל ב|י|ח}}	וַיֵּֽצְאוּ֙ בְּנֵ֣י עַמּ֔וֹן וַיַּעַרְכ֥וּ מִלְחָמָ֖ה פֶּ֣תַח הַשָּׁ֑עַר וַאֲרַ֨ם צוֹבָ֤א וּרְחוֹב֙ וְאִֽישׁ־ט֣וֹב וּמַעֲכָ֔ה לְבַדָּ֖ם בַּשָּׂדֶֽה׃
"ספר שמואל/שמ""ב י"	ט	__	{{מ:פסוק|שמואל ב|י|ט}}	"וַיַּ֣רְא יוֹאָ֗ב כִּֽי־הָיְתָ֤ה אֵלָיו֙ פְּנֵ֣י הַמִּלְחָמָ֔ה מִפָּנִ֖ים וּמֵאָח֑וֹר וַיִּבְחַ֗ר מִכֹּל֙ בְּחוּרֵ֣י {{כו""ק|בישראל|יִשְׂרָאֵ֔ל}} וַֽיַּעֲרֹ֖ךְ לִקְרַ֥את אֲרָֽם׃"
"ספר שמואל/שמ""ב י"	י	__	{{מ:פסוק|שמואל ב|י|י}}	וְאֵת֙ יֶ֣תֶר הָעָ֔ם נָתַ֕ן בְּיַ֖ד אַבְשַׁ֣י אָחִ֑יו וַיַּעֲרֹ֕ךְ לִקְרַ֖את בְּנֵ֥י עַמּֽוֹן׃
"ספר שמואל/שמ""ב י"	יא	__	{{מ:פסוק|שמואל ב|י|יא}}	וַיֹּ֗אמֶר אִם־תֶּחֱזַ֤ק אֲרָם֙ מִמֶּ֔נִּי וְהָיִ֥תָה לִּ֖י לִישׁוּעָ֑ה וְאִם־בְּנֵ֤י עַמּוֹן֙ יֶחֶזְק֣וּ מִמְּךָ֔ וְהָלַכְתִּ֖י לְהוֹשִׁ֥יעַֽ לָֽךְ׃
"ספר שמואל/שמ""ב י"	יב	__	{{מ:פסוק|שמואל ב|י|יב|סדר=כה}}	חֲזַ֤ק וְנִתְחַזַּק֙ בְּעַד־עַמֵּ֔נוּ וּבְעַ֖ד עָרֵ֣י אֱלֹהֵ֑ינוּ וַֽיהֹוָ֔ה יַעֲשֶׂ֥ה הַטּ֖וֹב בְּעֵינָֽיו׃
"ספר שמואל/שמ""ב י"	יג	__	{{מ:פסוק|שמואל ב|י|יג}}	וַיִּגַּ֣שׁ יוֹאָ֗ב וְהָעָם֙ אֲשֶׁ֣ר עִמּ֔וֹ לַמִּלְחָמָ֖ה בַּאֲרָ֑ם וַיָּנֻ֖סוּ מִפָּנָֽיו׃
"ספר שמואל/שמ""ב י"	יד	__	{{מ:פסוק|שמואל ב|י|יד}}	וּבְנֵ֨י עַמּ֤וֹן רָאוּ֙ כִּֽי־נָ֣ס אֲרָ֔ם וַיָּנֻ֙סוּ֙ מִפְּנֵ֣י אֲבִישַׁ֔י וַיָּבֹ֖אוּ הָעִ֑יר וַיָּ֣שׇׁב יוֹאָ֗ב מֵעַל֙ בְּנֵ֣י עַמּ֔וֹן וַיָּבֹ֖א יְרוּשָׁל{{מ:ירושלם|ָ|ֽ}}ם׃
"ספר שמואל/שמ""ב י"	טו	__	{{מ:פסוק|שמואל ב|י|טו}}	וַיַּ֣רְא אֲרָ֔ם כִּ֥י נִגַּ֖ף לִפְנֵ֣י יִשְׂרָאֵ֑ל וַיֵּאָסְפ֖וּ יָֽחַד׃
"ספר שמואל/שמ""ב י"	טז	__	{{מ:פסוק|שמואל ב|י|טז}}	וַיִּשְׁלַ֣ח הֲדַדְעֶ֗זֶר וַיֹּצֵ֤א אֶת־אֲרָם֙ אֲשֶׁר֙ מֵעֵ֣בֶר הַנָּהָ֔ר וַיָּבֹ֖אוּ חֵילָ֑ם וְשׁוֹבַ֛ךְ שַׂר־צְבָ֥א הֲדַדְעֶ֖זֶר לִפְנֵיהֶֽם׃
"ספר שמואל/שמ""ב י"	יז	//{{סס}}	{{מ:פסוק|שמואל ב|י|יז}}	וַיֻּגַּ֣ד לְדָוִ֗ד וַיֶּאֱסֹ֤ף אֶת־כׇּל־יִשְׂרָאֵל֙ וַיַּעֲבֹ֣ר אֶת־הַיַּרְדֵּ֔ן וַיָּבֹ֖א חֵלָ֑אמָה וַיַּעַרְכ֤וּ אֲרָם֙ לִקְרַ֣את דָּוִ֔ד וַיִּֽלָּחֲמ֖וּ עִמּֽוֹ׃
"ספר שמואל/שמ""ב י"	יח	__	{{מ:פסוק|שמואל ב|י|יח}}	וַיָּ֣נׇס אֲרָם֮ מִפְּנֵ֣י יִשְׂרָאֵל֒ וַיַּהֲרֹ֨ג דָּוִ֜ד מֵאֲרָ֗ם שְׁבַ֤ע מֵאוֹת֙ רֶ֔כֶב וְאַרְבָּעִ֥ים אֶ֖לֶף פָּרָשִׁ֑ים וְאֵ֨ת שׁוֹבַ֧ךְ שַׂר־צְבָא֛וֹ הִכָּ֖ה וַיָּ֥מׇת שָֽׁם׃
"ספר שמואל/שמ""ב י"	יט	__	{{מ:פסוק|שמואל ב|י|יט}}	וַיִּרְא֨וּ כׇֽל־הַמְּלָכִ֜ים עַבְדֵ֣י הֲדַדְעֶ֗זֶר כִּ֤י נִגְּפוּ֙ לִפְנֵ֣י יִשְׂרָאֵ֔ל וַיַּשְׁלִ֥מוּ אֶת־יִשְׂרָאֵ֖ל וַיַּעַבְד֑וּם וַיִּֽרְא֣וּ אֲרָ֔ם לְהוֹשִׁ֥יעַ ע֖וֹד אֶת־בְּנֵ֥י עַמּֽוֹן׃
"ספר שמואל/שמ""ב י"	תתת	<noinclude>//{{תבנית:משתמש:Dovi/טעמי המקרא-סוף}}//{{מ:שוליים-סוף}}//==הפרק בלי מספרים==//{{תבנית:משתמש:Dovi/טעמי המקרא}}//{{#בלי קטע:{{שם הדף המלא}}|סימן}}//{{תבנית:משתמש:Dovi/טעמי המקרא-סוף}}</noinclude>		
"ספר שמואל/שמ""ב יא"	0	<noinclude>{{תבנית:טעמי המקרא באינטרנט}}//{{מ:שוליים|5}}//{{תבנית:משתמש:Dovi/טעמי המקרא}}//</noinclude>		
"ספר שמואל/שמ""ב יא"	א	{{פפ}}//	{{מ:פסוק|שמואל ב|יא|א}}	וַיְהִי֩ לִתְשׁוּבַ֨ת הַשָּׁנָ֜ה לְעֵ֣ת{{מ:לגרמיה}}צֵ֣את הַמְּלָאכִ֗ים וַיִּשְׁלַ֣ח דָּוִ֡ד אֶת־יוֹאָב֩ וְאֶת־עֲבָדָ֨יו עִמּ֜וֹ וְאֶת־כׇּל־יִשְׂרָאֵ֗ל וַיַּשְׁחִ֙תוּ֙ אֶת־בְּנֵ֣י עַמּ֔וֹן וַיָּצֻ֖רוּ עַל־רַבָּ֑ה וְדָוִ֖ד יוֹשֵׁ֥ב בִּירוּשָׁל{{מ:ירושלם|ָ|ֽ}}ם׃
"ספר שמואל/שמ""ב יא"	ב	//{{סס}}	{{מ:פסוק|שמואל ב|יא|ב}}	וַיְהִ֣י{{מ:לגרמיה}}לְעֵ֣ת הָעֶ֗רֶב וַיָּ֨קׇם דָּוִ֜ד מֵעַ֤ל מִשְׁכָּבוֹ֙ וַיִּתְהַלֵּךְ֙ עַל־גַּ֣ג בֵּית־הַמֶּ֔לֶךְ וַיַּ֥רְא אִשָּׁ֛ה רֹחֶ֖צֶת מֵעַ֣ל הַגָּ֑ג וְהָ֣אִשָּׁ֔ה טוֹבַ֥ת מַרְאֶ֖ה מְאֹֽד׃
"ספר שמואל/שמ""ב יא"	ג	__	{{מ:פסוק|שמואל ב|יא|ג}}	וַיִּשְׁלַ֣ח דָּוִ֔ד וַיִּדְרֹ֖שׁ לָאִשָּׁ֑ה וַיֹּ֗אמֶר הֲלוֹא־זֹאת֙ בַּת־שֶׁ֣בַע בַּת־אֱלִיעָ֔ם אֵ֖שֶׁת אוּרִיָּ֥ה הַֽחִתִּֽי׃
"ספר שמואל/שמ""ב יא"	ד	__	{{מ:פסוק|שמואל ב|יא|ד}}	וַיִּשְׁלַח֩ דָּוִ֨ד מַלְאָכִ֜ים וַיִּקָּחֶ֗הָ וַתָּב֤וֹא אֵלָיו֙ וַיִּשְׁכַּ֣ב עִמָּ֔הּ וְהִ֥יא מִתְקַדֶּ֖שֶׁת מִטֻּמְאָתָ֑הּ וַתָּ֖שׇׁב אֶל־בֵּיתָֽהּ׃
"ספר שמואל/שמ""ב יא"	ה	__	{{מ:פסוק|שמואל ב|יא|ה}}	וַתַּ֖הַר הָאִשָּׁ֑ה וַתִּשְׁלַח֙ וַתַּגֵּ֣ד לְדָוִ֔ד וַתֹּ֖אמֶר הָרָ֥ה אָנֹֽכִי׃
"ספר שמואל/שמ""ב יא"	ו	__	{{מ:פסוק|שמואל ב|יא|ו}}	וַיִּשְׁלַ֤ח דָּוִד֙ אֶל־יוֹאָ֔ב שְׁלַ֣ח אֵלַ֔י אֶת־אוּרִיָּ֖ה הַחִתִּ֑י וַיִּשְׁלַ֥ח יוֹאָ֛ב אֶת־אוּרִיָּ֖ה אֶל־דָּוִֽד׃
"ספר שמואל/שמ""ב יא"	ז	__	{{מ:פסוק|שמואל ב|יא|ז}}	וַיָּבֹ֥א אוּרִיָּ֖ה אֵלָ֑יו וַיִּשְׁאַ֣ל דָּוִ֗ד לִשְׁל֤וֹם יוֹאָב֙ וְלִשְׁל֣וֹם הָעָ֔ם וְלִשְׁל֖וֹם הַמִּלְחָמָֽה׃
"ספר שמואל/שמ""ב יא"	ח	__	{{מ:פסוק|שמואל ב|יא|ח}}	וַיֹּ֤אמֶר דָּוִד֙ לְא֣וּרִיָּ֔ה רֵ֥ד לְבֵיתְךָ֖ וּרְחַ֣ץ רַגְלֶ֑יךָ וַיֵּצֵ֤א אֽוּרִיָּה֙ מִבֵּ֣ית הַמֶּ֔לֶךְ וַתֵּצֵ֥א אַחֲרָ֖יו מַשְׂאַ֥ת הַמֶּֽלֶךְ׃
"ספר שמואל/שמ""ב יא"	ט	__	{{מ:פסוק|שמואל ב|יא|ט}}	וַיִּשְׁכַּ֣ב אוּרִיָּ֗ה פֶּ֚תַח בֵּ֣ית הַמֶּ֔לֶךְ אֵ֖ת כׇּל־עַבְדֵ֣י אֲדֹנָ֑יו וְלֹ֥א יָרַ֖ד אֶל־בֵּיתֽוֹ׃
"ספר שמואל/שמ""ב יא"	י	__	{{מ:פסוק|שמואל ב|יא|י}}	וַיַּגִּ֤דוּ לְדָוִד֙ לֵאמֹ֔ר לֹא־יָרַ֥ד אוּרִיָּ֖ה אֶל־בֵּית֑וֹ וַיֹּ֨אמֶר דָּוִ֜ד אֶל־אוּרִיָּ֗ה הֲל֤וֹא מִדֶּ֙רֶךְ֙ אַתָּ֣ה בָ֔א מַדּ֖וּעַ לֹא־יָרַ֥דְתָּ אֶל־בֵּיתֶֽךָ׃
"ספר שמואל/שמ""ב יא"	יא	__	{{מ:פסוק|שמואל ב|יא|יא}}	וַיֹּ֨אמֶר אוּרִיָּ֜ה אֶל־דָּוִ֗ד הָ֠אָר֠וֹן וְיִשְׂרָאֵ֨ל וִיהוּדָ֜ה יֹשְׁבִ֣ים בַּסֻּכּ֗וֹת {{נוסח|וַאדֹנִ֨י|א=וַאֲדֹנִ֨י|=לק ומסורת-א ובדפוסים}} יוֹאָ֜ב וְעַבְדֵ֤י אֲדֹנִי֙ עַל־פְּנֵ֤י הַשָּׂדֶה֙ חֹנִ֔ים וַאֲנִ֞י אָב֧וֹא אֶל־בֵּיתִ֛י לֶאֱכֹ֥ל וְלִשְׁתּ֖וֹת וְלִשְׁכַּ֣ב עִם־אִשְׁתִּ֑י חַיֶּ֙ךָ֙ וְחֵ֣י נַפְשֶׁ֔ךָ אִֽם־אֶעֱשֶׂ֖ה אֶת־הַדָּבָ֥ר הַזֶּֽה׃
"ספר שמואל/שמ""ב יא"	יב	__	{{מ:פסוק|שמואל ב|יא|יב}}	וַיֹּ֨אמֶר דָּוִ֜ד אֶל־אוּרִיָּ֗ה שֵׁ֥ב בָּזֶ֛ה גַּם־הַיּ֖וֹם וּמָחָ֣ר אֲשַׁלְּחֶ֑ךָּ וַיֵּ֨שֶׁב אוּרִיָּ֧ה בִירוּשָׁל{{מ:ירושלם|ַ|֛}}ם בַּיּ֥וֹם הַה֖וּא {{מ:קמץ|ד=וּמִֽמׇּחֳרָֽת|ס=וּמִֽמָּחֳרָֽת}}׃
"ספר שמואל/שמ""ב יא"	יג	__	{{מ:פסוק|שמואל ב|יא|יג}}	וַיִּקְרָא־ל֣וֹ דָוִ֗ד וַיֹּ֧אכַל לְפָנָ֛יו וַיֵּ֖שְׁתְּ וַֽיְשַׁכְּרֵ֑הוּ וַיֵּצֵ֣א בָעֶ֗רֶב לִשְׁכַּ֤ב בְּמִשְׁכָּבוֹ֙ עִם־עַבְדֵ֣י אֲדֹנָ֔יו וְאֶל־בֵּית֖וֹ לֹ֥א יָרָֽד׃
"ספר שמואל/שמ""ב יא"	יד	__	{{מ:פסוק|שמואל ב|יא|יד}}	וַיְהִ֣י בַבֹּ֔קֶר וַיִּכְתֹּ֥ב דָּוִ֛ד סֵ֖פֶר אֶל־יוֹאָ֑ב וַיִּשְׁלַ֖ח בְּיַ֥ד אוּרִיָּֽה׃
"ספר שמואל/שמ""ב יא"	טו	__	{{מ:פסוק|שמואל ב|יא|טו}}	וַיִּכְתֹּ֥ב בַּסֵּ֖פֶר לֵאמֹ֑ר הָב֣וּ אֶת־אוּרִיָּ֗ה אֶל־מוּל֙ פְּנֵ֤י הַמִּלְחָמָה֙ הַחֲזָקָ֔ה וְשַׁבְתֶּ֥ם מֵאַחֲרָ֖יו וְנִכָּ֥ה וָמֵֽת׃
"ספר שמואל/שמ""ב יא"	טז	//{{סס}}	{{מ:פסוק|שמואל ב|יא|טז}}	וַיְהִ֕י בִּשְׁמ֥וֹר יוֹאָ֖ב אֶל־הָעִ֑יר וַיִּתֵּן֙ אֶת־א֣וּרִיָּ֔ה אֶל־הַמָּקוֹם֙ אֲשֶׁ֣ר יָדַ֔ע כִּ֥י אַנְשֵׁי־חַ֖יִל שָֽׁם׃
"ספר שמואל/שמ""ב יא"	יז	__	{{מ:פסוק|שמואל ב|יא|יז}}	וַיֵּ֨צְא֜וּ אַנְשֵׁ֤י הָעִיר֙ וַיִּלָּֽחֲמ֣וּ אֶת־יוֹאָ֔ב וַיִּפֹּ֥ל מִן־הָעָ֖ם מֵעַבְדֵ֣י דָוִ֑ד וַיָּ֕מׇת גַּ֖ם אוּרִיָּ֥ה הַחִתִּֽי׃
"ספר שמואל/שמ""ב יא"	יח	__	{{מ:פסוק|שמואל ב|יא|יח}}	וַיִּשְׁלַ֖ח יוֹאָ֑ב וַיַּגֵּ֣ד לְדָוִ֔ד אֶת־כׇּל־דִּבְרֵ֖י הַמִּלְחָמָֽה׃
"ספר שמואל/שמ""ב יא"	יט	__	{{מ:פסוק|שמואל ב|יא|יט}}	וַיְצַ֥ו אֶת־הַמַּלְאָ֖ךְ לֵאמֹ֑ר כְּכַלּוֹתְךָ֗ אֵ֛ת כׇּל־דִּבְרֵ֥י הַמִּלְחָמָ֖ה לְדַבֵּ֥ר אֶל־הַמֶּֽלֶךְ׃
"ספר שמואל/שמ""ב יא"	כ	__	{{מ:פסוק|שמואל ב|יא|כ}}	וְהָיָ֗ה אִֽם־תַּעֲלֶה֙ חֲמַ֣ת הַמֶּ֔לֶךְ וְאָמַ֣ר לְךָ֔ מַדּ֛וּעַ נִגַּשְׁתֶּ֥ם אֶל־הָעִ֖יר לְהִלָּחֵ֑ם הֲל֣וֹא יְדַעְתֶּ֔ם אֵ֥ת אֲשֶׁר־יֹר֖וּ מֵעַ֥ל הַחוֹמָֽה׃
"ספר שמואל/שמ""ב יא"	כא	__	{{מ:פסוק|שמואל ב|יא|כא}}	מִֽי־הִכָּ֞ה אֶת־אֲבִימֶ֣לֶךְ בֶּן־יְרֻבֶּ֗שֶׁת הֲלֽוֹא־אִשָּׁ֡ה הִשְׁלִ֣יכָה עָלָיו֩ פֶּ֨לַח רֶ֜כֶב מֵעַ֤ל הַחוֹמָה֙ וַיָּ֣מׇת בְּתֵבֵ֔ץ לָ֥מָּה נִגַּשְׁתֶּ֖ם אֶל־הַחוֹמָ֑ה וְאָ֣מַרְתָּ֔ גַּ֗ם עַבְדְּךָ֛ אוּרִיָּ֥ה הַחִתִּ֖י מֵֽת׃
"ספר שמואל/שמ""ב יא"	כב	__	{{מ:פסוק|שמואל ב|יא|כב}}	וַיֵּ֖לֶךְ הַמַּלְאָ֑ךְ וַיָּבֹא֙ וַיַּגֵּ֣ד לְדָוִ֔ד אֵ֛ת כׇּל־אֲשֶׁ֥ר שְׁלָח֖וֹ יוֹאָֽב׃
"ספר שמואל/שמ""ב יא"	כג	__	{{מ:פסוק|שמואל ב|יא|כג}}	וַיֹּ֤אמֶר הַמַּלְאָךְ֙ אֶל־דָּוִ֔ד כִּֽי־גָבְר֤וּ עָלֵ֙ינוּ֙ הָאֲנָשִׁ֔ים וַיֵּצְא֥וּ אֵלֵ֖ינוּ הַשָּׂדֶ֑ה וַנִּהְיֶ֥ה עֲלֵיהֶ֖ם עַד־פֶּ֥תַח הַשָּֽׁעַר׃
"ספר שמואל/שמ""ב יא"	כד	__	{{מ:פסוק|שמואל ב|יא|כד}}	וַיֹּר֨אוּ הַמּוֹרִ֤אים אֶל־עֲבָדֶ֙יךָ֙ מֵעַ֣ל הַחוֹמָ֔ה וַיָּמ֖וּתוּ מֵעַבְדֵ֣י הַמֶּ֑לֶךְ וְגַ֗ם עַבְדְּךָ֛ אוּרִיָּ֥ה הַחִתִּ֖י מֵֽת׃
"ספר שמואל/שמ""ב יא"	כה	//{{סס}}	{{מ:פסוק|שמואל ב|יא|כה}}	"וַיֹּ֨אמֶר דָּוִ֜ד אֶל־הַמַּלְאָ֗ךְ כֹּֽה־תֹאמַ֤ר אֶל־יוֹאָב֙ אַל־יֵרַ֤ע {{נוסח|בְּעֵינֶ֙יךָ֙|=מנהג-א (וכן ברויאר ומג""ה)|א=בְּעֵינֶיךָ֙ (חסר פשטא מלעיל)}} אֶת־הַדָּבָ֣ר הַזֶּ֔ה כִּֽי־כָזֹ֥ה וְכָזֶ֖ה תֹּאכַ֣ל הֶחָ֑רֶב הַחֲזֵ֨ק מִלְחַמְתְּךָ֧ אֶל־הָעִ֛יר וְהׇרְסָ֖הּ וְחַזְּקֵֽהוּ׃"
