"ספר שמואל/שמ""ב א"	0	<noinclude>{{תבנית:טעמי המקרא באינטרנט}}//{{מ:שוליים|5}}//{{תבנית:משתמש:Dovi/טעמי המקרא}}//</noinclude>		
"ספר שמואל/שמ""ב יט"	כה	//{{סס}}	{{מ:פסוק|שמואל ב|יט|כה}}	וּמְפִבֹ֙שֶׁת֙ בֶּן־שָׁא֔וּל יָרַ֖ד לִקְרַ֣את הַמֶּ֑לֶךְ וְלֹא־עָשָׂ֨ה רַגְלָ֜יו וְלֹא־עָשָׂ֣ה שְׂפָמ֗וֹ וְאֶת־בְּגָדָיו֙ לֹ֣א כִבֵּ֔ס לְמִן־הַיּוֹם֙ לֶ֣כֶת הַמֶּ֔לֶךְ עַד־הַיּ֖וֹם אֲשֶׁר־בָּ֥א בְשָׁלֽוֹם׃
"ספר שמואל/שמ""ב יט"	כו	__	{{מ:פסוק|שמואל ב|יט|כו}}	וַיְהִ֛י כִּי־בָ֥א יְרוּשָׁל{{מ:ירושלם|ַ|֖}}ם לִקְרַ֣את הַמֶּ֑לֶךְ וַיֹּ֤אמֶר לוֹ֙ הַמֶּ֔לֶךְ לָ֛מָּה לֹא־הָלַ֥כְתָּ עִמִּ֖י מְפִיבֹֽשֶׁת׃
"ספר שמואל/שמ""ב יט"	כז	__	{{מ:פסוק|שמואל ב|יט|כז}}	וַיֹּאמַ֕ר אֲדֹנִ֥י הַמֶּ֖לֶךְ עַבְדִּ֣י רִמָּ֑נִי כִּי־אָמַ֨ר עַבְדְּךָ֜ אֶחְבְּשָׁה־לִּי֩ הַחֲמ֨וֹר וְאֶרְכַּ֤ב עָלֶ֙יהָ֙ וְאֵלֵ֣ךְ אֶת־הַמֶּ֔לֶךְ כִּ֥י פִסֵּ֖חַ עַבְדֶּֽךָ׃
"ספר שמואל/שמ""ב יט"	כח	__	{{מ:פסוק|שמואל ב|יט|כח}}	וַיְרַגֵּ֣ל בְּעַבְדְּךָ֔ אֶל־אֲדֹנִ֖י הַמֶּ֑לֶךְ וַֽאדֹנִ֤י הַמֶּ֙לֶךְ֙ כְּמַלְאַ֣ךְ הָאֱלֹהִ֔ים וַעֲשֵׂ֥ה הַטּ֖וֹב בְּעֵינֶֽיךָ׃
"ספר שמואל/שמ""ב יט"	כט	__	{{מ:פסוק|שמואל ב|יט|כט}}	כִּי֩ לֹ֨א הָיָ֜ה כׇּל־בֵּ֣ית אָבִ֗י כִּ֤י אִם־אַנְשֵׁי־מָ֙וֶת֙ לַאדֹנִ֣י הַמֶּ֔לֶךְ וַתָּ֙שֶׁת֙ אֶֽת־עַבְדְּךָ֔ בְּאֹכְלֵ֖י שֻׁלְחָנֶ֑ךָ וּמַה־יֶּשׁ־לִ֥י עוֹד֙ צְדָקָ֔ה וְלִזְעֹ֥ק ע֖וֹד אֶל־הַמֶּֽלֶךְ׃
"ספר שמואל/שמ""ב יט"	ל	//{{פפ}}//	{{מ:פסוק|שמואל ב|יט|ל}}	וַיֹּ֤אמֶר לוֹ֙ הַמֶּ֔לֶךְ לָ֛מָּה תְּדַבֵּ֥ר ע֖וֹד דְּבָרֶ֑יךָ אָמַ֕רְתִּי אַתָּ֣ה וְצִיבָ֔א תַּחְלְק֖וּ אֶת־הַשָּׂדֶֽה׃
"ספר שמואל/שמ""ב יט"	לא	__	{{מ:פסוק|שמואל ב|יט|לא}}	וַיֹּ֤אמֶר מְפִיבֹ֙שֶׁת֙ אֶל־הַמֶּ֔לֶךְ גַּ֥ם אֶת־הַכֹּ֖ל יִקָּ֑ח אַ֠חֲרֵי אֲשֶׁר־בָּ֞א אֲדֹנִ֥י הַמֶּ֛לֶךְ בְּשָׁל֖וֹם אֶל־בֵּיתֽוֹ׃
"ספר שמואל/שמ""ב יט"	לב	//{{סס}}	{{מ:פסוק|שמואל ב|יט|לב}}	"וּבַרְזִלַּי֙ הַגִּלְעָדִ֔י יָרַ֖ד מֵרֹֽגְלִ֑ים וַיַּֽעֲבֹ֤ר אֶת־הַמֶּ֙לֶךְ֙ הַיַּרְדֵּ֔ן לְשַׁלְּח֖וֹ אֶת־{{קו""כ|בירדן|הַיַּרְדֵּֽן}}׃"
"ספר שמואל/שמ""ב יט"	לג	__	{{מ:פסוק|שמואל ב|יט|לג}}	וּבַרְזִלַּי֙ זָקֵ֣ן מְאֹ֔ד בֶּן־שְׁמֹנִ֖ים שָׁנָ֑ה וְהֽוּא־כִלְכַּ֤ל אֶת־הַמֶּ֙לֶךְ֙ בְשִׁיבָת֣וֹ בְמַחֲנַ֔יִם כִּי־אִ֛ישׁ גָּד֥וֹל ה֖וּא מְאֹֽד׃
"ספר שמואל/שמ""ב יט"	לד	__	{{מ:פסוק|שמואל ב|יט|לד}}	וַיֹּ֥אמֶר הַמֶּ֖לֶךְ אֶל־בַּרְזִלָּ֑י אַתָּה֙ עֲבֹ֣ר אִתִּ֔י וְכִלְכַּלְתִּ֥י אֹתְךָ֛ עִמָּדִ֖י בִּירוּשָׁל{{מ:ירושלם|ָ|ֽ}}ם׃
"ספר שמואל/שמ""ב יט"	לה	__	{{מ:פסוק|שמואל ב|יט|לה}}	וַיֹּ֥אמֶר בַּרְזִלַּ֖י אֶל־הַמֶּ֑לֶךְ כַּמָּ֗ה יְמֵי֙ שְׁנֵ֣י חַיַּ֔י כִּי־אֶעֱלֶ֥ה אֶת־הַמֶּ֖לֶךְ יְרֽוּשָׁל{{מ:ירושלם|ָ|ֽ}}ם׃
"ספר שמואל/שמ""ב יט"	לו	__	{{מ:פסוק|שמואל ב|יט|לו}}	בֶּן־שְׁמֹנִ֣ים שָׁנָה֩ אָנֹכִ֨י הַיּ֜וֹם הַאֵדַ֣ע{{מ:לגרמיה}}בֵּֽין־ט֣וֹב לְרָ֗ע אִם־יִטְעַ֤ם עַבְדְּךָ֙ אֶת־אֲשֶׁ֤ר אֹכַל֙ וְאֶת־אֲשֶׁ֣ר אֶשְׁתֶּ֔ה אִם־אֶשְׁמַ֣ע ע֔וֹד בְּק֖וֹל שָׁרִ֣ים וְשָׁר֑וֹת וְלָ֩מָּה֩ יִֽהְיֶ֨ה עַבְדְּךָ֥ עוֹד֙ לְמַשָּׂ֔א אֶל־אֲדֹנִ֖י הַמֶּֽלֶךְ׃
"ספר שמואל/שמ""ב יט"	לז	__	{{מ:פסוק|שמואל ב|יט|לז}}	כִּמְעַ֞ט יַעֲבֹ֧ר עַבְדְּךָ֛ אֶת־הַיַּרְדֵּ֖ן אֶת־הַמֶּ֑לֶךְ וְלָ֙מָּה֙ יִגְמְלֵ֣נִי הַמֶּ֔לֶךְ הַגְּמוּלָ֖ה הַזֹּֽאת׃
"ספר שמואל/שמ""ב יט"	לח	__	{{מ:פסוק|שמואל ב|יט|לח}}	יָשׇׁב־נָ֤א עַבְדְּךָ֙ וְאָמֻ֣ת בְּעִירִ֔י עִ֛ם קֶ֥בֶר אָבִ֖י וְאִמִּ֑י וְהִנֵּ֣ה{{מ:לגרמיה}}עַבְדְּךָ֣ כִמְהָ֗ם יַֽעֲבֹר֙ עִם־אֲדֹנִ֣י הַמֶּ֔לֶךְ וַעֲשֵׂה־ל֕וֹ אֵ֥ת אֲשֶׁר־ט֖וֹב בְּעֵינֶֽיךָ׃
"ספר שמואל/שמ""ב יט"	לט	//{{סס}}	{{מ:פסוק|שמואל ב|יט|לט}}	וַיֹּ֣אמֶר הַמֶּ֗לֶךְ אִתִּי֙ יַעֲבֹ֣ר כִּמְהָ֔ם וַאֲנִי֙ אֶֽעֱשֶׂה־לּ֔וֹ אֶת־הַטּ֖וֹב בְּעֵינֶ֑יךָ וְכֹ֛ל אֲשֶׁר־תִּבְחַ֥ר עָלַ֖י אֶעֱשֶׂה־לָּֽךְ׃
"ספר שמואל/שמ""ב יט"	מ	__	{{מ:פסוק|שמואל ב|יט|מ|סדר=לב}}	וַיַּעֲבֹ֧ר כׇּל־הָעָ֛ם אֶת־הַיַּרְדֵּ֖ן וְהַמֶּ֣לֶךְ עָבָ֑ר וַיִּשַּׁ֨ק הַמֶּ֤לֶךְ לְבַרְזִלַּי֙ {{נוסח|וַיְבָ֣רְכֵ֔הוּ|א=וַיְבָ֣רֲכֵ֔הוּ}} וַיָּ֖שׇׁב לִמְקֹמֽוֹ׃
"ספר שמואל/שמ""ב יט"	מא	//{{סס}}	{{מ:פסוק|שמואל ב|יט|מא}}	"וַיַּעֲבֹ֤ר הַמֶּ֙לֶךְ֙ הַגִּלְגָּ֔לָה וְכִמְהָ֖ן עָבַ֣ר עִמּ֑וֹ וְכׇל־עַ֤ם יְהוּדָה֙ {{כו""ק|ויעברו|הֶעֱבִ֣רוּ}} אֶת־הַמֶּ֔לֶךְ וְגַ֕ם חֲצִ֖י עַ֥ם יִשְׂרָאֵֽל׃"
"ספר שמואל/שמ""ב יט"	מב	__	{{מ:פסוק|שמואל ב|יט|מב}}	"וְהִנֵּ֛ה כׇּל־אִ֥ישׁ יִשְׂרָאֵ֖ל בָּאִ֣ים אֶל־הַמֶּ֑לֶךְ וַיֹּאמְר֣וּ אֶל־הַמֶּ֡לֶךְ מַדּ֩וּעַ֩ גְּנָב֨וּךָ אַחֵ֜ינוּ אִ֣ישׁ יְהוּדָ֗ה וַיַּעֲבִ֨רוּ אֶת־הַמֶּ֤לֶךְ {{נוסח|וְאֶת־בֵּיתוֹ֙|=לק ובדפוסים (וכן ברויאר ומג""ה)|א=וְאֵת־בֵּיתוֹ֙}} אֶת־הַיַּרְדֵּ֔ן וְכׇל־אַנְשֵׁ֥י דָוִ֖ד עִמּֽוֹ׃"
"ספר שמואל/שמ""ב יט"	מג	//{{סס}}	{{מ:פסוק|שמואל ב|יט|מג}}	וַיַּ֩עַן֩ כׇּל־אִ֨ישׁ יְהוּדָ֜ה עַל־אִ֣ישׁ יִשְׂרָאֵ֗ל כִּֽי־קָר֤וֹב הַמֶּ֙לֶךְ֙ אֵלַ֔י וְלָ֤מָּה זֶּה֙ חָרָ֣ה לְךָ֔ עַל־הַדָּבָ֖ר הַזֶּ֑ה הֶאָכ֤וֹל אָכַ֙לְנוּ֙ מִן־הַמֶּ֔לֶךְ אִם־נִשֵּׂ֥את נִשָּׂ֖א לָֽנוּ׃
"ספר שמואל/שמ""ב יט"	מד	//{{סס}}	{{מ:פסוק|שמואל ב|יט|מד}}	וַיַּ֣עַן אִֽישׁ־יִשְׂרָאֵל֩ אֶת־אִ֨ישׁ יְהוּדָ֜ה וַיֹּ֗אמֶר עֶשֶׂר־יָד֨וֹת לִ֣י בַמֶּ֘לֶךְ֮ וְגַם־בְּדָוִד֮ אֲנִ֣י מִמְּךָ֒ וּמַדּ֙וּעַ֙ הֱקִלֹּתַ֔נִי וְלֹא־הָיָ֨ה דְבָרִ֥י רִאשׁ֛וֹן לִ֖י לְהָשִׁ֣יב אֶת־מַלְכִּ֑י וַיִּ֙קֶשׁ֙ דְּבַר־אִ֣ישׁ יְהוּדָ֔ה מִדְּבַ֖ר אִ֥ישׁ יִשְׂרָאֵֽל׃
"ספר שמואל/שמ""ב יט"	תתת	<noinclude>//{{תבנית:משתמש:Dovi/טעמי המקרא-סוף}}//{{מ:שוליים-סוף}}//==הפרק בלי מספרים==//{{תבנית:משתמש:Dovi/טעמי המקרא}}//{{#בלי קטע:{{שם הדף המלא}}|סימן}}//{{תבנית:משתמש:Dovi/טעמי המקרא-סוף}}</noinclude>		
"ספר שמואל/שמ""ב כ"	0	<noinclude>{{תבנית:טעמי המקרא באינטרנט}}//{{מ:שוליים|5}}//{{תבנית:משתמש:Dovi/טעמי המקרא}}//</noinclude>		
"ספר שמואל/שמ""ב כ"	א	{{סס}}	{{מ:פסוק|שמואל ב|כ|א}}	וְשָׁ֨ם נִקְרָ֜א אִ֣ישׁ בְּלִיַּ֗עַל וּשְׁמ֛וֹ שֶׁ֥בַע בֶּן־בִּכְרִ֖י אִ֣ישׁ יְמִינִ֑י וַיִּתְקַ֣ע בַּשֹּׁפָ֗ר וַ֠יֹּ֠אמֶר אֵֽין־לָ֨נוּ חֵ֜לֶק בְּדָוִ֗ד וְלֹ֤א נַחֲלָה־לָ֙נוּ֙ בְּבֶן־יִשַׁ֔י אִ֥ישׁ לְאֹהָלָ֖יו יִשְׂרָאֵֽל׃
"ספר שמואל/שמ""ב כ"	ב	__	{{מ:פסוק|שמואל ב|כ|ב}}	וַיַּ֜עַל כׇּל־אִ֤ישׁ יִשְׂרָאֵל֙ מֵאַחֲרֵ֣י דָוִ֔ד אַחֲרֵ֖י שֶׁ֣בַע בֶּן־בִּכְרִ֑י וְאִ֤ישׁ יְהוּדָה֙ דָּבְק֣וּ בְמַלְכָּ֔ם מִן־הַיַּרְדֵּ֖ן וְעַד־יְרוּשָׁל{{מ:ירושלם|ָ|ֽ}}ם׃
"ספר שמואל/שמ""ב כ"	ג	__	{{מ:פסוק|שמואל ב|כ|ג}}	וַיָּבֹ֨א דָוִ֣ד אֶל־בֵּיתוֹ֮ יְרוּשָׁל{{מ:ירושלם|ַ|֒}}ם֒ וַיִּקַּ֣ח הַמֶּ֡לֶךְ אֵ֣ת עֶשֶׂר־נָשִׁ֣ים{{מ:פסק}}פִּלַגְשִׁ֡ים אֲשֶׁ֣ר הִנִּ֩יחַ֩ לִשְׁמֹ֨ר הַבַּ֜יִת וַֽיִּתְּנֵ֤ם בֵּית־מִשְׁמֶ֙רֶת֙ וַֽיְכַלְכְּלֵ֔ם וַאֲלֵיהֶ֖ם לֹא־בָ֑א וַתִּהְיֶ֧ינָה צְרֻר֛וֹת עַד־י֥וֹם מֻתָ֖ן אַלְמְנ֥וּת חַיּֽוּת׃
"ספר שמואל/שמ""ב כ"	ד	//{{סס}}	{{מ:פסוק|שמואל ב|כ|ד}}	וַיֹּ֤אמֶר הַמֶּ֙לֶךְ֙ אֶל־עֲמָשָׂ֔א הַזְעֶק־לִ֥י אֶת־אִישׁ־יְהוּדָ֖ה שְׁלֹ֣שֶׁת יָמִ֑ים וְאַתָּ֖ה פֹּ֥ה עֲמֹֽד׃
"ספר שמואל/שמ""ב כ"	ה	__	{{מ:פסוק|שמואל ב|כ|ה}}	"וַיֵּ֥לֶךְ עֲמָשָׂ֖א לְהַזְעִ֣יק אֶת־יְהוּדָ֑ה {{כו""ק|וייחר|וַיּ֕וֹחֶר}} מִן־הַמּוֹעֵ֖ד אֲשֶׁ֥ר יְעָדֽוֹ׃"
"ספר שמואל/שמ""ב כ"	ו	//{{סס}}	{{מ:פסוק|שמואל ב|כ|ו}}	וַיֹּ֤אמֶר דָּוִד֙ אֶל־אֲבִישַׁ֔י עַתָּ֗ה יֵ֧רַֽע לָ֛נוּ שֶׁ֥בַע בֶּן־בִּכְרִ֖י מִן־אַבְשָׁל֑וֹם אַ֠תָּ֠ה קַ֞ח אֶת־עַבְדֵ֤י אֲדֹנֶ֙יךָ֙ וּרְדֹ֣ף אַחֲרָ֔יו פֶּן־מָ֥צָא ל֛וֹ עָרִ֥ים בְּצֻר֖וֹת וְהִצִּ֥יל עֵינֵֽנוּ׃
"ספר שמואל/שמ""ב כ"	ז	__	{{מ:פסוק|שמואל ב|כ|ז}}	וַיֵּצְא֤וּ אַחֲרָיו֙ אַנְשֵׁ֣י יוֹאָ֔ב וְהַכְּרֵתִ֥י וְהַפְּלֵתִ֖י וְכׇל־הַגִּבֹּרִ֑ים וַיֵּֽצְאוּ֙ מִיר֣וּשָׁל{{מ:ירושלם|ַ|֔}}ם לִרְדֹּ֕ף אַחֲרֵ֖י שֶׁ֥בַע בֶּן־בִּכְרִֽי׃
"ספר שמואל/שמ""ב כ"	ח	__	{{מ:פסוק|שמואל ב|כ|ח}}	"הֵ֗ם עִם־הָאֶ֤בֶן הַגְּדוֹלָה֙ אֲשֶׁ֣ר בְּגִבְע֔וֹן וַעֲמָשָׂ֖א בָּ֣א לִפְנֵיהֶ֑ם וְיוֹאָ֞ב חָג֣וּר{{מ:לגרמיה}}מִדּ֣וֹ לְבֻשׁ֗וֹ {{קו""כ-אם|וְעָלָ֞ו|א-קרי=וְעָלָ֞יו}} חֲג֥וֹר חֶ֙רֶב֙ מְצֻמֶּ֤דֶת עַל־מׇתְנָיו֙ בְּתַעְרָ֔הּ וְה֥וּא יָצָ֖א וַתִּפֹּֽל׃"
"ספר שמואל/שמ""ב כ"	ט	//{{סס}}	{{מ:פסוק|שמואל ב|כ|ט}}	וַיֹּ֤אמֶר יוֹאָב֙ לַעֲמָשָׂ֔א הֲשָׁל֥וֹם אַתָּ֖ה אָחִ֑י וַתֹּ֜חֶז יַד־יְמִ֥ין יוֹאָ֛ב בִּזְקַ֥ן עֲמָשָׂ֖א לִנְשׇׁק־לֽוֹ׃
"ספר שמואל/שמ""ב כ"	י	__	{{מ:פסוק|שמואל ב|כ|י}}	וַעֲמָשָׂ֨א לֹא־נִשְׁמַ֜ר בַּחֶ֣רֶב{{מ:לגרמיה}}אֲשֶׁ֣ר בְּיַד־יוֹאָ֗ב וַיַּכֵּ֩הוּ֩ בָ֨הּ אֶל־הַחֹ֜מֶשׁ וַיִּשְׁפֹּ֨ךְ מֵעָ֥יו אַ֛רְצָה וְלֹא־שָׁ֥נָה ל֖וֹ וַיָּמֹ֑ת וְיוֹאָב֙ וַאֲבִישַׁ֣י אָחִ֔יו רָדַ֕ף אַחֲרֵ֖י שֶׁ֥בַע בֶּן־בִּכְרִֽי׃
"ספר שמואל/שמ""ב כ"	יא	__	{{מ:פסוק|שמואל ב|כ|יא}}	וְאִישׁ֙ עָמַ֣ד עָלָ֔יו מִֽנַּעֲרֵ֖י יוֹאָ֑ב וַיֹּ֗אמֶר מִי֩ אֲשֶׁ֨ר חָפֵ֧ץ בְּיוֹאָ֛ב וּמִ֥י אֲשֶׁר־לְדָוִ֖ד אַחֲרֵ֥י יוֹאָֽב׃
"ספר שמואל/שמ""ב כ"	יב	__	{{מ:פסוק|שמואל ב|כ|יב}}	וַעֲמָשָׂ֛א מִתְגֹּלֵ֥ל בַּדָּ֖ם בְּת֣וֹךְ {{נוסח|הַֽמְסִלָּ֑ה|א=הַֽמֲסִלָּ֑ה}} וַיַּ֨רְא הָאִ֜ישׁ כִּֽי־עָמַ֣ד כׇּל־הָעָ֗ם וַיַּסֵּב֩ אֶת־עֲמָשָׂ֨א {{נוסח|מִן־הַֽמְסִלָּ֤ה|א=מִן־הַֽמֲסִלָּ֤ה}} הַשָּׂדֶה֙ וַיַּשְׁלֵ֤ךְ עָלָיו֙ בֶּ֔גֶד כַּאֲשֶׁ֣ר רָאָ֔ה כׇּל־הַבָּ֥א עָלָ֖יו וְעָמָֽד׃
"ספר שמואל/שמ""ב כ"	יג	__	{{מ:פסוק|שמואל ב|כ|יג}}	כַּאֲשֶׁ֥ר הֹגָ֖ה {{נוסח|מִן־הַֽמְסִלָּ֑ה|א=מִן־הַֽמֲסִלָּ֑ה (ברויאר לא העיר)}} עָבַ֤ר כׇּל־אִישׁ֙ אַחֲרֵ֣י יוֹאָ֔ב לִרְדֹּ֕ף אַחֲרֵ֖י שֶׁ֥בַע בֶּן־בִּכְרִֽי׃
"ספר שמואל/שמ""ב כ"	יד	__	{{מ:פסוק|שמואל ב|כ|יד}}	"וַֽיַּעֲבֹ֞ר בְּכׇל־שִׁבְטֵ֣י יִשְׂרָאֵ֗ל אָבֵ֛לָה וּבֵ֥ית מַעֲכָ֖ה וְכׇל־הַבֵּרִ֑ים{{פסקא באמצע פסוק|{{סס}}|שמואל ב כ יד}}{{נוסח|{{כו""ק|ויקלהו|וַיִּקָּ֣הֲל֔וּ}}|א-כתיב=וַיִּקָּ֣ל֔הֲוּ}} וַיָּבֹ֖אוּ אַף־אַחֲרָֽיו׃"
"ספר שמואל/שמ""ב כ"	טו	__	{{מ:פסוק|שמואל ב|כ|טו}}	וַיָּבֹ֜אוּ וַיָּצֻ֣רוּ עָלָ֗יו בְּאָבֵ֙לָה֙ בֵּ֣ית הַֽמַּעֲכָ֔ה וַיִּשְׁפְּכ֤וּ {{נוסח|סֹֽלְלָה֙|א=סֹֽלֲלָה֙}} אֶל־הָעִ֔יר וַֽתַּעֲמֹ֖ד בַּחֵ֑ל וְכׇל־הָעָם֙ אֲשֶׁ֣ר אֶת־יוֹאָ֔ב מַשְׁחִיתִ֖ם לְהַפִּ֥יל הַחוֹמָֽה׃
"ספר שמואל/שמ""ב כ"	טז	__	{{מ:פסוק|שמואל ב|כ|טז}}	וַתִּקְרָ֛א אִשָּׁ֥ה חֲכָמָ֖ה מִן־הָעִ֑יר שִׁמְע֤וּ שִׁמְעוּ֙ אִמְרוּ־נָ֣א אֶל־יוֹאָ֔ב קְרַ֣ב עַד־הֵ֔נָּה וַאֲדַבְּרָ֖ה אֵלֶֽיךָ׃
"ספר שמואל/שמ""ב כ"	יז	__	{{מ:פסוק|שמואל ב|כ|יז}}	וַיִּקְרַ֣ב אֵלֶ֔יהָ וַתֹּ֧אמֶר הָאִשָּׁ֛ה הַאַתָּ֥ה יוֹאָ֖ב וַיֹּ֣אמֶר אָ֑נִי וַתֹּ֣אמֶר ל֗וֹ שְׁמַע֙ דִּבְרֵ֣י אֲמָתֶ֔ךָ וַיֹּ֖אמֶר שֹׁמֵ֥עַ אָנֹֽכִי׃
"ספר שמואל/שמ""ב כ"	יח	__	{{מ:פסוק|שמואל ב|כ|יח}}	וַתֹּ֖אמֶר לֵאמֹ֑ר דַּבֵּ֨ר יְדַבְּר֤וּ בָרִֽאשֹׁנָה֙ לֵאמֹ֔ר שָׁא֧וֹל יְשָׁאֲל֛וּ בְּאָבֵ֖ל וְכֵ֥ן הֵתַֽמּוּ׃
"ספר שמואל/שמ""ב כ"	יט	__	{{מ:פסוק|שמואל ב|כ|יט}}	אָנֹכִ֕י שְׁלֻמֵ֖י אֱמוּנֵ֣י יִשְׂרָאֵ֑ל אַתָּ֣ה מְבַקֵּ֗שׁ לְהָמִ֨ית עִ֤יר וְאֵם֙ בְּיִשְׂרָאֵ֔ל לָ֥מָּה תְבַלַּ֖ע נַחֲלַ֥ת יְהֹוָֽה׃
"ספר שמואל/שמ""ב כ"	כ	//{{פפ}}//	{{מ:פסוק|שמואל ב|כ|כ}}	וַיַּ֥עַן יוֹאָ֖ב וַיֹּאמַ֑ר חָלִ֤ילָה חָלִ֙ילָה֙ לִ֔י אִם־אֲבַלַּ֖ע וְאִם־אַשְׁחִֽית׃
"ספר שמואל/שמ""ב כ"	כא	__	{{מ:פסוק|שמואל ב|כ|כא}}	לֹא־כֵ֣ן הַדָּבָ֗ר כִּ֡י אִישׁ֩ מֵהַ֨ר אֶפְרַ֜יִם שֶׁ֧בַע בֶּן־בִּכְרִ֣י שְׁמ֗וֹ נָשָׂ֤א יָדוֹ֙ בַּמֶּ֣לֶךְ בְּדָוִ֔ד תְּנוּ־אֹת֣וֹ לְבַדּ֔וֹ וְאֵלְכָ֖ה מֵעַ֣ל הָעִ֑יר וַתֹּ֤אמֶר הָאִשָּׁה֙ אֶל־יוֹאָ֔ב הִנֵּ֥ה רֹאשׁ֛וֹ מֻשְׁלָ֥ךְ אֵלֶ֖יךָ בְּעַ֥ד הַחוֹמָֽה׃
"ספר שמואל/שמ""ב כ"	כב	__	{{מ:פסוק|שמואל ב|כ|כב}}	וַתָּבוֹא֩ הָאִשָּׁ֨ה אֶל־כׇּל־הָעָ֜ם בְּחׇכְמָתָ֗הּ וַֽיִּכְרְת֞וּ אֶת־רֹ֨אשׁ שֶׁ֤בַע בֶּן־בִּכְרִי֙ וַיַּשְׁלִ֣כוּ אֶל־יוֹאָ֔ב וַיִּתְקַע֙ בַּשֹּׁפָ֔ר וַיָּפֻ֥צוּ מֵעַל־הָעִ֖יר אִ֣ישׁ לְאֹהָלָ֑יו וְיוֹאָ֛ב שָׁ֥ב יְרוּשָׁל{{מ:ירושלם|ַ|֖}}ם אֶל־הַמֶּֽלֶךְ׃
"ספר שמואל/שמ""ב כ"	כג	//{{סס}}	{{מ:פסוק|שמואל ב|כ|כג}}	"וְיוֹאָ֕ב אֶ֥ל כׇּל־הַצָּבָ֖א יִשְׂרָאֵ֑ל וּבְנָיָה֙ בֶּן־יְה֣וֹיָדָ֔ע עַל־{{כו""ק|הכרי|הַכְּרֵתִ֖י}} וְעַל־הַפְּלֵתִֽי׃"
"ספר שמואל/שמ""ב כ"	כד	__	{{מ:פסוק|שמואל ב|כ|כד}}	וַאֲדֹרָ֖ם עַל־הַמַּ֑ס וִיהוֹשָׁפָ֥ט בֶּן־אֲחִיל֖וּד הַמַּזְכִּֽיר׃
"ספר שמואל/שמ""ב כ"	כה	__	{{מ:פסוק|שמואל ב|כ|כה}}	"{{כו""ק|ושיא|וּשְׁוָ֖א}} סֹפֵ֑ר וְצָד֥וֹק וְאֶבְיָתָ֖ר כֹּהֲנִֽים׃"
"ספר שמואל/שמ""ב כ"	כו	__	{{מ:פסוק|שמואל ב|כ|כו}}	וְגַ֗ם עִירָא֙ הַיָּ֣אִרִ֔י הָיָ֥ה כֹהֵ֖ן לְדָוִֽד׃
"ספר שמואל/שמ""ב כ"	תתת	<noinclude>//{{תבנית:משתמש:Dovi/טעמי המקרא-סוף}}//{{מ:שוליים-סוף}}//==הפרק בלי מספרים==//{{תבנית:משתמש:Dovi/טעמי המקרא}}//{{#בלי קטע:{{שם הדף המלא}}|סימן}}//{{תבנית:משתמש:Dovi/טעמי המקרא-סוף}}</noinclude>		
"ספר שמואל/שמ""ב כא"	0	<noinclude>{{תבנית:טעמי המקרא באינטרנט}}//{{מ:שוליים|5}}//{{תבנית:משתמש:Dovi/טעמי המקרא}}//</noinclude>		
"ספר שמואל/שמ""ב כא"	א	{{סס}}	{{מ:פסוק|שמואל ב|כא|א}}	וַיְהִ֣י רָעָב֩ בִּימֵ֨י דָוִ֜ד שָׁלֹ֣שׁ שָׁנִ֗ים שָׁנָה֙ אַחֲרֵ֣י שָׁנָ֔ה וַיְבַקֵּ֥שׁ דָּוִ֖ד אֶת־פְּנֵ֣י יְהֹוָ֑ה{{פסקא באמצע פסוק|{{סס}}|שמואל ב כא א}}וַיֹּ֣אמֶר יְהֹוָ֗ה אֶל־שָׁאוּל֙ וְאֶל־בֵּ֣ית הַדָּמִ֔ים עַל־אֲשֶׁר־הֵמִ֖ית אֶת־הַגִּבְעֹנִֽים׃
"ספר שמואל/שמ""ב כא"	ב	__	{{מ:פסוק|שמואל ב|כא|ב}}	וַיִּקְרָ֥א הַמֶּ֛לֶךְ לַגִּבְעֹנִ֖ים וַיֹּ֣אמֶר אֲלֵיהֶ֑ם וְהַגִּבְעֹנִ֞ים לֹ֣א מִבְּנֵ֧י יִשְׂרָאֵ֣ל הֵ֗מָּה כִּ֚י אִם־מִיֶּ֣תֶר הָאֱמֹרִ֔י וּבְנֵ֤י יִשְׂרָאֵל֙ נִשְׁבְּע֣וּ לָהֶ֔ם וַיְבַקֵּ֤שׁ שָׁאוּל֙ לְהַכֹּתָ֔ם בְּקַנֹּאת֥וֹ לִבְנֵֽי־יִשְׂרָאֵ֖ל וִיהוּדָֽה׃
"ספר שמואל/שמ""ב כא"	ג	__	{{מ:פסוק|שמואל ב|כא|ג}}	וַיֹּ֤אמֶר דָּוִד֙ אֶל־הַגִּבְעֹנִ֔ים מָ֥ה אֶעֱשֶׂ֖ה לָכֶ֑ם וּבַמָּ֣ה אֲכַפֵּ֔ר {{נוסח|וּבָרְכ֖וּ|א=וּבָרֲכ֖וּ}} אֶת־נַחֲלַ֥ת יְהֹוָֽה׃
"ספר שמואל/שמ""ב כא"	ד	__	{{מ:פסוק|שמואל ב|כא|ד}}	"וַיֹּ֧אמְרוּ ל֣וֹ הַגִּבְעֹנִ֗ים אֵֽין־{{קו""כ|לי|לָ֜נוּ}} כֶּ֤סֶף וְזָהָב֙ עִם־שָׁא֣וּל וְעִם־בֵּית֔וֹ וְאֵֽין־לָ֥נוּ אִ֖ישׁ לְהָמִ֣ית בְּיִשְׂרָאֵ֑ל וַיֹּ֛אמֶר מָה־אַתֶּ֥ם אֹמְרִ֖ים אֶעֱשֶׂ֥ה לָכֶֽם׃"
"ספר שמואל/שמ""ב כא"	ה	__	{{מ:פסוק|שמואל ב|כא|ה}}	וַיֹּֽאמְרוּ֙ אֶל־הַמֶּ֔לֶךְ הָאִישׁ֙ אֲשֶׁ֣ר כִּלָּ֔נוּ וַאֲשֶׁ֖ר דִּמָּה־לָ֑נוּ נִשְׁמַ֕דְנוּ מֵהִתְיַצֵּ֖ב בְּכׇל־גְּבֻ֥ל יִשְׂרָאֵֽל׃
"ספר שמואל/שמ""ב כא"	ו	__	{{מ:פסוק|שמואל ב|כא|ו}}	"{{כו""ק|ינתן|יֻתַּן־}}לָ֜נוּ שִׁבְעָ֤ה אֲנָשִׁים֙ מִבָּנָ֔יו וְהוֹקַֽעֲנוּם֙ לַיהֹוָ֔ה בְּגִבְעַ֥ת שָׁא֖וּל בְּחִ֣יר יְהֹוָ֑ה{{פסקא באמצע פסוק|{{פפפ}}|שמואל ב כא ו}}וַיֹּ֥אמֶר הַמֶּ֖לֶךְ אֲנִ֥י אֶתֵּֽן׃"
"ספר שמואל/שמ""ב כא"	ז	__	{{מ:פסוק|שמואל ב|כא|ז|סדר=לג}}	וַיַּחְמֹ֣ל הַמֶּ֔לֶךְ עַל־מְפִיבֹ֖שֶׁת בֶּן־יְהוֹנָתָ֣ן בֶּן־שָׁא֑וּל עַל־שְׁבֻעַ֤ת יְהֹוָה֙ אֲשֶׁ֣ר בֵּינֹתָ֔ם בֵּ֣ין דָּוִ֔ד וּבֵ֖ין יְהוֹנָתָ֥ן בֶּן־שָׁאֽוּל׃
"ספר שמואל/שמ""ב כא"	ח	__	{{מ:פסוק|שמואל ב|כא|ח}}	וַיִּקַּ֣ח הַמֶּ֡לֶךְ אֶת־שְׁ֠נֵ֠י בְּנֵ֨י רִצְפָּ֤ה בַת־אַיָּה֙ אֲשֶׁ֣ר יָלְדָ֣ה לְשָׁא֔וּל אֶת־אַרְמֹנִ֖י וְאֶת־מְפִבֹ֑שֶׁת וְאֶת־חֲמֵ֗שֶׁת בְּנֵי֙ מִיכַ֣ל בַּת־שָׁא֔וּל אֲשֶׁ֥ר יָלְדָ֛ה לְעַדְרִיאֵ֥ל בֶּן־בַּרְזִלַּ֖י הַמְּחֹלָתִֽי׃
"ספר שמואל/שמ""ב כא"	ט	__	{{מ:פסוק|שמואל ב|כא|ט}}	"וַֽיִּתְּנֵ֞ם בְּיַ֣ד הַגִּבְעֹנִ֗ים וַיֹּקִיעֻ֤ם בָּהָר֙ לִפְנֵ֣י יְהֹוָ֔ה וַיִּפְּל֥וּ {{כו""ק|שבעתים|שְׁבַעְתָּ֖ם}} יָ֑חַד {{כו""ק|והם|וְהֵ֨מָּה}} הֻמְת֜וּ בִּימֵ֤י קָצִיר֙ בָּרִ֣אשֹׁנִ֔ים {{כו""ק|תחלת|בִּתְחִלַּ֖ת}} קְצִ֥יר שְׂעֹרִֽים׃"
"ספר שמואל/שמ""ב כא"	י	__	{{מ:פסוק|שמואל ב|כא|י}}	וַתִּקַּ֣ח רִצְפָּה֩ בַת־אַיָּ֨ה אֶת־הַשַּׂ֜ק וַתַּטֵּ֨הוּ לָ֤הּ אֶל־הַצּוּר֙ מִתְּחִלַּ֣ת קָצִ֔יר עַ֛ד נִתַּךְ־מַ֥יִם עֲלֵיהֶ֖ם מִן־הַשָּׁמָ֑יִם וְלֹֽא־נָתְנָה֩ ע֨וֹף הַשָּׁמַ֜יִם לָנ֤וּחַ עֲלֵיהֶם֙ יוֹמָ֔ם וְאֶת־חַיַּ֥ת הַשָּׂדֶ֖ה לָֽיְלָה׃
"ספר שמואל/שמ""ב כא"	יא	__	{{מ:פסוק|שמואל ב|כא|יא}}	וַיֻּגַּ֖ד לְדָוִ֑ד אֵ֧ת אֲשֶׁר־עָשְׂתָ֛ה רִצְפָּ֥ה בַת־אַיָּ֖ה פִּלֶ֥גֶשׁ שָׁאֽוּל׃
"ספר שמואל/שמ""ב כא"	יב	__	{{מ:פסוק|שמואל ב|כא|יב}}	"וַיֵּ֣לֶךְ דָּוִ֗ד וַיִּקַּ֞ח אֶת־עַצְמ֤וֹת שָׁאוּל֙ וְאֶת־עַצְמוֹת֙ יְהוֹנָתָ֣ן בְּנ֔וֹ מֵאֵ֕ת בַּעֲלֵ֖י יָבֵ֣ישׁ גִּלְעָ֑ד אֲשֶׁר֩ גָּנְב֨וּ אֹתָ֜ם מֵרְחֹ֣ב בֵּֽית־שַׁ֗ן אֲשֶׁ֨ר {{נוסח|{{כו""ק|תלום|תְּלָא֥וּם}}|א-כתיב=תְּלָוֻ֥ם}} {{נוסח|{{מ:כו""ק של שתי מילים בהערה אחת|שם הפלשתים|שָׁ֙מָּה֙ פְּלִשְׁתִּ֔ים}}|א-כתיב=שָׁםָּ ה֙פְּלִשְׁתִּ֔ים (הערת קרי אחת לשתי המלים)}} בְּי֨וֹם הַכּ֧וֹת פְּלִשְׁתִּ֛ים אֶת־שָׁא֖וּל בַּגִּלְבֹּֽעַ׃"
"ספר שמואל/שמ""ב כא"	יג	__	{{מ:פסוק|שמואל ב|כא|יג}}	וַיַּ֤עַל מִשָּׁם֙ אֶת־עַצְמ֣וֹת שָׁא֔וּל וְאֶת־עַצְמ֖וֹת יְהוֹנָתָ֣ן בְּנ֑וֹ וַיַּ֣אַסְפ֔וּ אֶת־עַצְמ֖וֹת הַמּוּקָעִֽים׃
