ספר בראשית/לז	0	<noinclude>{{תבנית:טעמי המקרא באינטרנט}}//{{מ:שוליים|5}}//{{תבנית:משתמש:Dovi/טעמי המקרא}}//</noinclude>		
ספר בראשית/מא	לא	__	{{מ:פסוק|בראשית|מא|לא}}	וְלֹֽא־יִוָּדַ֤ע הַשָּׂבָע֙ בָּאָ֔רֶץ מִפְּנֵ֛י הָרָעָ֥ב הַה֖וּא אַחֲרֵי־כֵ֑ן כִּֽי־כָבֵ֥ד ה֖וּא מְאֹֽד׃
ספר בראשית/מא	לב	__	{{מ:פסוק|בראשית|מא|לב}}	וְעַ֨ל הִשָּׁנ֧וֹת הַחֲל֛וֹם אֶל־פַּרְעֹ֖ה פַּעֲמָ֑יִם כִּֽי־נָכ֤וֹן הַדָּבָר֙ מֵעִ֣ם הָאֱלֹהִ֔ים וּמְמַהֵ֥ר הָאֱלֹהִ֖ים לַעֲשֹׂתֽוֹ׃
ספר בראשית/מא	לג	__	{{מ:פסוק|בראשית|מא|לג}}	וְעַתָּה֙ {{נוסח|יֵרֶ֣א|=א(ס)ל <צֵרי? אינו כן אלא בסגול ונמסר על ה'>}} פַרְעֹ֔ה אִ֖ישׁ נָב֣וֹן וְחָכָ֑ם וִישִׁיתֵ֖הוּ עַל־אֶ֥רֶץ מִצְרָֽיִם׃
ספר בראשית/מא	לד	__	{{מ:פסוק|בראשית|מא|לד}}	יַעֲשֶׂ֣ה פַרְעֹ֔ה וְיַפְקֵ֥ד פְּקִדִ֖ים עַל־הָאָ֑רֶץ וְחִמֵּשׁ֙ אֶת־אֶ֣רֶץ מִצְרַ֔יִם בְּשֶׁ֖בַע שְׁנֵ֥י הַשָּׂבָֽע׃
ספר בראשית/מא	לה	__	{{מ:פסוק|בראשית|מא|לה}}	"וְיִקְבְּצ֗וּ אֶת־כׇּל־אֹ֙כֶל֙ הַשָּׁנִ֣ים {{נוסח|הַטֹּב֔וֹת|=שש1 ומסורת-ל וטברנית ורמ""ה|ל=הַטֹּבֹ֔ת (כתיב חסר וי""ו בסוף)|הערת ברויאר}} הַבָּאֹ֖ת הָאֵ֑לֶּה וְיִצְבְּרוּ־בָ֞ר תַּ֧חַת יַד־פַּרְעֹ֛ה אֹ֥כֶל בֶּעָרִ֖ים וְשָׁמָֽרוּ׃"
ספר בראשית/מא	לו	__	{{מ:פסוק|בראשית|מא|לו}}	וְהָיָ֨ה הָאֹ֤כֶל לְפִקָּדוֹן֙ לָאָ֔רֶץ לְשֶׁ֙בַע֙ שְׁנֵ֣י הָרָעָ֔ב אֲשֶׁ֥ר תִּהְיֶ֖יןָ בְּאֶ֣רֶץ מִצְרָ֑יִם וְלֹֽא־תִכָּרֵ֥ת הָאָ֖רֶץ בָּרָעָֽב׃
ספר בראשית/מא	לז	__	{{מ:פסוק|בראשית|מא|לז}}	וַיִּיטַ֥ב הַדָּבָ֖ר בְּעֵינֵ֣י פַרְעֹ֑ה וּבְעֵינֵ֖י כׇּל־עֲבָדָֽיו׃
ספר בראשית/מא	לח	__	{{מ:פסוק|בראשית|מא|לח|סדר=לז}}	וַיֹּ֥אמֶר פַּרְעֹ֖ה אֶל־עֲבָדָ֑יו הֲנִמְצָ֣א כָזֶ֔ה אִ֕ישׁ אֲשֶׁ֛ר ר֥וּחַ אֱלֹהִ֖ים בּֽוֹ׃
ספר בראשית/מא	לט	__	{{מ:פסוק|בראשית|מא|לט|עלייה=שלישי}}	וַיֹּ֤אמֶר פַּרְעֹה֙ אֶל־יוֹסֵ֔ף אַחֲרֵ֨י הוֹדִ֧יעַ אֱלֹהִ֛ים אוֹתְךָ֖ אֶת־כׇּל־זֹ֑את אֵין־נָב֥וֹן וְחָכָ֖ם כָּמֽוֹךָ׃
ספר בראשית/מא	מ	__	{{מ:פסוק|בראשית|מא|מ}}	אַתָּה֙ תִּהְיֶ֣ה עַל־בֵּיתִ֔י וְעַל־פִּ֖יךָ יִשַּׁ֣ק כׇּל־עַמִּ֑י רַ֥ק הַכִּסֵּ֖א אֶגְדַּ֥ל מִמֶּֽךָּ׃
ספר בראשית/מא	מא	__	{{מ:פסוק|בראשית|מא|מא}}	וַיֹּ֥אמֶר פַּרְעֹ֖ה אֶל־יוֹסֵ֑ף רְאֵה֙ נָתַ֣תִּי אֹֽתְךָ֔ עַ֖ל כׇּל־אֶ֥רֶץ מִצְרָֽיִם׃
ספר בראשית/מא	מב	__	{{מ:פסוק|בראשית|מא|מב}}	וַיָּ֨סַר פַּרְעֹ֤ה אֶת־טַבַּעְתּוֹ֙ מֵעַ֣ל יָד֔וֹ וַיִּתֵּ֥ן אֹתָ֖הּ עַל־יַ֣ד יוֹסֵ֑ף וַיַּלְבֵּ֤שׁ אֹתוֹ֙ בִּגְדֵי־שֵׁ֔שׁ וַיָּ֛שֶׂם רְבִ֥ד הַזָּהָ֖ב עַל־צַוָּארֽוֹ׃
ספר בראשית/מא	מג	__	{{מ:פסוק|בראשית|מא|מג}}	וַיַּרְכֵּ֣ב אֹת֗וֹ בְּמִרְכֶּ֤בֶת הַמִּשְׁנֶה֙ אֲשֶׁר־ל֔וֹ וַיִּקְרְא֥וּ לְפָנָ֖יו אַבְרֵ֑ךְ וְנָת֣וֹן אֹת֔וֹ עַ֖ל כׇּל־אֶ֥רֶץ מִצְרָֽיִם׃
ספר בראשית/מא	מד	__	{{מ:פסוק|בראשית|מא|מד}}	וַיֹּ֧אמֶר פַּרְעֹ֛ה אֶל־יוֹסֵ֖ף אֲנִ֣י פַרְעֹ֑ה וּבִלְעָדֶ֗יךָ לֹֽא־יָרִ֨ים אִ֧ישׁ אֶת־יָד֛וֹ וְאֶת־רַגְל֖וֹ בְּכׇל־אֶ֥רֶץ מִצְרָֽיִם׃
ספר בראשית/מא	מה	__	{{מ:פסוק|בראשית|מא|מה}}	וַיִּקְרָ֨א פַרְעֹ֣ה שֵׁם־יוֹסֵף֮ צָֽפְנַ֣ת פַּעְנֵ֒חַ֒ וַיִּתֶּן־ל֣וֹ אֶת־אָֽסְנַ֗ת בַּת־{{נוסח|פּ֥וֹטִי פֶ֛רַע|=א(ס)ל ומסורת-א(ס)ל <ב מלות בלי מקף? כן ומסר עליו תרתין מלין> וטברניות, וכן בספרי ספרד ואשכנז ובדפוסים}}{{מ:הערה|בספרי תימן פּֽוֹטִיפֶ֛רַע בתיבה אחת}} כֹּהֵ֥ן אֹ֖ן לְאִשָּׁ֑ה וַיֵּצֵ֥א יוֹסֵ֖ף עַל־אֶ֥רֶץ מִצְרָֽיִם׃
ספר בראשית/מא	מו	__	{{מ:פסוק|בראשית|מא|מו}}	וְיוֹסֵף֙ בֶּן־שְׁלֹשִׁ֣ים שָׁנָ֔ה בְּעׇמְד֕וֹ לִפְנֵ֖י פַּרְעֹ֣ה מֶֽלֶךְ־מִצְרָ֑יִם וַיֵּצֵ֤א יוֹסֵף֙ מִלִּפְנֵ֣י פַרְעֹ֔ה {{נוסח|וַֽיַּעֲבֹ֖ר|=שש1 ובדפוסים|ל=וַֽיַּעְבֹ֖ר (שווא במקום חטף!)|הערות ברויאר ודותן}} בְּכׇל־אֶ֥רֶץ מִצְרָֽיִם׃
ספר בראשית/מא	מז	__	{{מ:פסוק|בראשית|מא|מז}}	וַתַּ֣עַשׂ הָאָ֔רֶץ בְּשֶׁ֖בַע שְׁנֵ֣י הַשָּׂבָ֑ע לִקְמָצִֽים׃
ספר בראשית/מא	מח	__	{{מ:פסוק|בראשית|מא|מח}}	וַיִּקְבֹּ֞ץ אֶת־כׇּל־אֹ֣כֶל{{מ:לגרמיה}}שֶׁ֣בַע שָׁנִ֗ים אֲשֶׁ֤ר הָיוּ֙ בְּאֶ֣רֶץ מִצְרַ֔יִם וַיִּתֶּן־אֹ֖כֶל בֶּעָרִ֑ים אֹ֧כֶל שְׂדֵה־הָעִ֛יר אֲשֶׁ֥ר סְבִיבֹתֶ֖יהָ נָתַ֥ן בְּתוֹכָֽהּ׃
ספר בראשית/מא	מט	__	{{מ:פסוק|בראשית|מא|מט}}	וַיִּצְבֹּ֨ר יוֹסֵ֥ף בָּ֛ר כְּח֥וֹל הַיָּ֖ם הַרְבֵּ֣ה מְאֹ֑ד עַ֛ד כִּי־חָדַ֥ל לִסְפֹּ֖ר כִּי־אֵ֥ין מִסְפָּֽר׃
ספר בראשית/מא	נ	__	{{מ:פסוק|בראשית|מא|נ}}	"וּלְיוֹסֵ֤ף {{נוסח|יֻלַּד֙|=א(ס)ל <קמץ? אינו כן אלא בפתח ומסר עליו מבחוץ פתח> ובן־אשר בחילופים|מ""ג דפוס ונציה ובדפוסים=יֻלׇּד֙ (בקמץ) ובן־נפתלי בחילופים}} שְׁנֵ֣י בָנִ֔ים בְּטֶ֥רֶם תָּב֖וֹא שְׁנַ֣ת הָרָעָ֑ב אֲשֶׁ֤ר יָֽלְדָה־לּוֹ֙ אָֽסְנַ֔ת בַּת־{{נוסח|פּ֥וֹטִי פֶ֖רַע|ראו הערה בפסוק מ""ה}}{{מ:הערה|בספרי תימן פּֽוֹטִיפֶ֖רַע בתיבה אחת}} כֹּהֵ֥ן אֽוֹן׃"
ספר בראשית/מא	נא	__	{{מ:פסוק|בראשית|מא|נא}}	וַיִּקְרָ֥א יוֹסֵ֛ף אֶת־שֵׁ֥ם הַבְּכ֖וֹר מְנַשֶּׁ֑ה כִּֽי־נַשַּׁ֤נִי אֱלֹהִים֙ אֶת־כׇּל־עֲמָלִ֔י וְאֵ֖ת כׇּל־בֵּ֥ית אָבִֽי׃
ספר בראשית/מא	נב	__	{{מ:פסוק|בראשית|מא|נב}}	וְאֵ֛ת שֵׁ֥ם הַשֵּׁנִ֖י קָרָ֣א אֶפְרָ֑יִם כִּֽי־הִפְרַ֥נִי אֱלֹהִ֖ים בְּאֶ֥רֶץ עׇנְיִֽי׃
ספר בראשית/מא	נג	__	{{מ:פסוק|בראשית|מא|נג|עלייה=רביעי}}	וַתִּכְלֶ֕ינָה שֶׁ֖בַע שְׁנֵ֣י הַשָּׂבָ֑ע אֲשֶׁ֥ר הָיָ֖ה בְּאֶ֥רֶץ מִצְרָֽיִם׃
ספר בראשית/מא	נד	__	{{מ:פסוק|בראשית|מא|נד}}	וַתְּחִלֶּ֜ינָה שֶׁ֣בַע שְׁנֵ֤י הָרָעָב֙ לָב֔וֹא כַּאֲשֶׁ֖ר אָמַ֣ר יוֹסֵ֑ף וַיְהִ֤י רָעָב֙ בְּכׇל־הָ֣אֲרָצ֔וֹת וּבְכׇל־אֶ֥רֶץ מִצְרַ֖יִם הָ֥יָה לָֽחֶם׃
ספר בראשית/מא	נה	__	{{מ:פסוק|בראשית|מא|נה}}	וַתִּרְעַב֙ כׇּל־אֶ֣רֶץ מִצְרַ֔יִם וַיִּצְעַ֥ק הָעָ֛ם אֶל־פַּרְעֹ֖ה לַלָּ֑חֶם וַיֹּ֨אמֶר פַּרְעֹ֤ה לְכׇל־מִצְרַ֙יִם֙ לְכ֣וּ אֶל־יוֹסֵ֔ף אֲשֶׁר־יֹאמַ֥ר לָכֶ֖ם תַּעֲשֽׂוּ׃
ספר בראשית/מא	נו	__	{{מ:פסוק|בראשית|מא|נו}}	וְהָרָעָ֣ב הָיָ֔ה עַ֖ל כׇּל־פְּנֵ֣י הָאָ֑רֶץ וַיִּפְתַּ֨ח יוֹסֵ֜ף אֶֽת־כׇּל־אֲשֶׁ֤ר בָּהֶם֙ וַיִּשְׁבֹּ֣ר לְמִצְרַ֔יִם וַיֶּחֱזַ֥ק הָֽרָעָ֖ב בְּאֶ֥רֶץ מִצְרָֽיִם׃
ספר בראשית/מא	נז	__	{{מ:פסוק|בראשית|מא|נז}}	וְכׇל־הָאָ֙רֶץ֙ בָּ֣אוּ מִצְרַ֔יְמָה לִשְׁבֹּ֖ר אֶל־יוֹסֵ֑ף כִּֽי־חָזַ֥ק הָרָעָ֖ב בְּכׇל־הָאָֽרֶץ׃
ספר בראשית/מא	תתת	<noinclude>//{{תבנית:משתמש:Dovi/טעמי המקרא-סוף}}//{{מ:שוליים-סוף}}//==הפרק בלי מספרים==//{{תבנית:משתמש:Dovi/טעמי המקרא}}//{{#בלי קטע:{{שם הדף המלא}}|סימן}}//{{תבנית:משתמש:Dovi/טעמי המקרא-סוף}}//==הערות==//{{תבנית:משתמש:Dovi/טעמי המקרא}}//<references/>//{{תבנית:משתמש:Dovi/טעמי המקרא-סוף}}</noinclude>		
ספר בראשית/מב	0	<noinclude>{{תבנית:טעמי המקרא באינטרנט}}//{{מ:שוליים|5}}//{{תבנית:משתמש:Dovi/טעמי המקרא}}//</noinclude>		
ספר בראשית/מב	א	{{מ:אין פרשה בתחילת פרק}}	{{מ:פסוק|בראשית|מב|א}}	וַיַּ֣רְא יַעֲקֹ֔ב כִּ֥י יֶשׁ־שֶׁ֖בֶר בְּמִצְרָ֑יִם וַיֹּ֤אמֶר יַעֲקֹב֙ לְבָנָ֔יו לָ֖מָּה תִּתְרָאֽוּ׃
ספר בראשית/מב	ב	__	{{מ:פסוק|בראשית|מב|ב}}	וַיֹּ֕אמֶר הִנֵּ֣ה שָׁמַ֔עְתִּי כִּ֥י יֶשׁ־שֶׁ֖בֶר בְּמִצְרָ֑יִם רְדוּ־שָׁ֙מָּה֙ וְשִׁבְרוּ־לָ֣נוּ מִשָּׁ֔ם וְנִחְיֶ֖ה וְלֹ֥א נָמֽוּת׃
ספר בראשית/מב	ג	__	{{מ:פסוק|בראשית|מב|ג}}	וַיֵּרְד֥וּ אֲחֵֽי־יוֹסֵ֖ף עֲשָׂרָ֑ה לִשְׁבֹּ֥ר בָּ֖ר מִמִּצְרָֽיִם׃
ספר בראשית/מב	ד	__	{{מ:פסוק|בראשית|מב|ד}}	וְאֶת־בִּנְיָמִין֙ אֲחִ֣י יוֹסֵ֔ף לֹא־שָׁלַ֥ח יַעֲקֹ֖ב אֶת־אֶחָ֑יו כִּ֣י אָמַ֔ר פֶּן־יִקְרָאֶ֖נּוּ אָסֽוֹן׃
ספר בראשית/מב	ה	__	{{מ:פסוק|בראשית|מב|ה}}	וַיָּבֹ֙אוּ֙ בְּנֵ֣י יִשְׂרָאֵ֔ל לִשְׁבֹּ֖ר בְּת֣וֹךְ הַבָּאִ֑ים כִּֽי־הָיָ֥ה הָרָעָ֖ב בְּאֶ֥רֶץ כְּנָֽעַן׃
ספר בראשית/מב	ו	__	{{מ:פסוק|בראשית|מב|ו}}	"וְיוֹסֵ֗ף ה֚וּא הַשַּׁלִּ֣יט עַל־הָאָ֔רֶץ ה֥וּא הַמַּשְׁבִּ֖יר לְכׇל־עַ֣ם הָאָ֑רֶץ וַיָּבֹ֙אוּ֙ אֲחֵ֣י יוֹסֵ֔ף {{נוסח|וַיִּשְׁתַּֽחֲווּ־ל֥וֹ|=ל?שש1 ובדפוסים|ל=וַיִּשְׁתַּֽחֲוּוּ־ל֥וֹ? (דגש בוי""ו עיצורית?)|יש נקודה ממטושטשת בוי""ו הראשונה, אבל לפי דותן ל=<וַיִּשְׁתַּֽחֲווּ>|הערת ברויאר}} אַפַּ֖יִם אָֽרְצָה׃"
ספר בראשית/מב	ז	__	{{מ:פסוק|בראשית|מב|ז}}	וַיַּ֥רְא יוֹסֵ֛ף אֶת־אֶחָ֖יו וַיַּכִּרֵ֑ם וַיִּתְנַכֵּ֨ר אֲלֵיהֶ֜ם וַיְדַבֵּ֧ר אִתָּ֣ם קָשׁ֗וֹת וַיֹּ֤אמֶר אֲלֵהֶם֙ מֵאַ֣יִן בָּאתֶ֔ם וַיֹּ֣אמְר֔וּ מֵאֶ֥רֶץ כְּנַ֖עַן לִשְׁבׇּר־אֹֽכֶל׃
ספר בראשית/מב	ח	__	{{מ:פסוק|בראשית|מב|ח}}	וַיַּכֵּ֥ר יוֹסֵ֖ף אֶת־אֶחָ֑יו וְהֵ֖ם לֹ֥א הִכִּרֻֽהוּ׃
ספר בראשית/מב	ט	__	{{מ:פסוק|בראשית|מב|ט}}	וַיִּזְכֹּ֣ר יוֹסֵ֔ף אֵ֚ת הַחֲלֹמ֔וֹת אֲשֶׁ֥ר חָלַ֖ם לָהֶ֑ם וַיֹּ֤אמֶר אֲלֵהֶם֙ מְרַגְּלִ֣ים אַתֶּ֔ם לִרְא֛וֹת אֶת־עֶרְוַ֥ת הָאָ֖רֶץ בָּאתֶֽם׃
ספר בראשית/מב	י	__	{{מ:פסוק|בראשית|מב|י}}	וַיֹּאמְר֥וּ אֵלָ֖יו לֹ֣א אֲדֹנִ֑י וַעֲבָדֶ֥יךָ בָּ֖אוּ לִשְׁבׇּר־אֹֽכֶל׃
ספר בראשית/מב	יא	__	{{מ:פסוק|בראשית|מב|יא}}	כֻּלָּ֕נוּ בְּנֵ֥י אִישׁ־אֶחָ֖ד נָ֑חְנוּ כֵּנִ֣ים אֲנַ֔חְנוּ לֹא־הָי֥וּ עֲבָדֶ֖יךָ מְרַגְּלִֽים׃
ספר בראשית/מב	יב	__	{{מ:פסוק|בראשית|מב|יב}}	וַיֹּ֖אמֶר אֲלֵהֶ֑ם לֹ֕א כִּֽי־עֶרְוַ֥ת הָאָ֖רֶץ בָּאתֶ֥ם לִרְאֽוֹת׃
ספר בראשית/מב	יג	__	{{מ:פסוק|בראשית|מב|יג}}	וַיֹּאמְר֗וּ שְׁנֵ֣ים עָשָׂר֩ עֲבָדֶ֨יךָ אַחִ֧ים{{מ:פסק}}אֲנַ֛חְנוּ בְּנֵ֥י אִישׁ־אֶחָ֖ד בְּאֶ֣רֶץ כְּנָ֑עַן וְהִנֵּ֨ה הַקָּטֹ֤ן אֶת־אָבִ֙ינוּ֙ הַיּ֔וֹם וְהָאֶחָ֖ד אֵינֶֽנּוּ׃
ספר בראשית/מב	יד	__	{{מ:פסוק|בראשית|מב|יד}}	וַיֹּ֥אמֶר אֲלֵהֶ֖ם יוֹסֵ֑ף ה֗וּא אֲשֶׁ֨ר דִּבַּ֧רְתִּי אֲלֵכֶ֛ם לֵאמֹ֖ר מְרַגְּלִ֥ים אַתֶּֽם׃
ספר בראשית/מב	טו	__	{{מ:פסוק|בראשית|מב|טו}}	בְּזֹ֖את תִּבָּחֵ֑נוּ חֵ֤י פַרְעֹה֙ אִם־תֵּצְא֣וּ מִזֶּ֔ה כִּ֧י אִם־בְּב֛וֹא אֲחִיכֶ֥ם הַקָּטֹ֖ן הֵֽנָּה׃
ספר בראשית/מב	טז	__	{{מ:פסוק|בראשית|מב|טז}}	שִׁלְח֨וּ מִכֶּ֣ם אֶחָד֮ וְיִקַּ֣ח אֶת־אֲחִיכֶם֒ וְאַתֶּם֙ הֵאָ֣סְר֔וּ וְיִבָּֽחֲנוּ֙ דִּבְרֵיכֶ֔ם הַֽאֱמֶ֖ת אִתְּכֶ֑ם וְאִם־לֹ֕א חֵ֣י פַרְעֹ֔ה כִּ֥י מְרַגְּלִ֖ים אַתֶּֽם׃
ספר בראשית/מב	יז	__	{{מ:פסוק|בראשית|מב|יז}}	וַיֶּאֱסֹ֥ף אֹתָ֛ם אֶל־מִשְׁמָ֖ר שְׁלֹ֥שֶׁת יָמִֽים׃
ספר בראשית/מב	יח	__	{{מ:פסוק|בראשית|מב|יח|סדר=לח}}	וַיֹּ֨אמֶר אֲלֵהֶ֤ם יוֹסֵף֙ בַּיּ֣וֹם הַשְּׁלִישִׁ֔י זֹ֥את עֲשׂ֖וּ וִֽחְי֑וּ אֶת־הָאֱלֹהִ֖ים אֲנִ֥י יָרֵֽא׃
ספר בראשית/מב	יט	__	{{מ:פסוק|בראשית|מב|יט|עלייה=חמישי}}	אִם־כֵּנִ֣ים אַתֶּ֔ם אֲחִיכֶ֣ם אֶחָ֔ד יֵאָסֵ֖ר בְּבֵ֣ית מִשְׁמַרְכֶ֑ם וְאַתֶּם֙ לְכ֣וּ הָבִ֔יאוּ שֶׁ֖בֶר רַעֲב֥וֹן בָּתֵּיכֶֽם׃
ספר בראשית/מב	כ	__	{{מ:פסוק|בראשית|מב|כ}}	וְאֶת־אֲחִיכֶ֤ם הַקָּטֹן֙ תָּבִ֣יאוּ אֵלַ֔י וְיֵאָמְנ֥וּ דִבְרֵיכֶ֖ם וְלֹ֣א תָמ֑וּתוּ וַיַּעֲשׂוּ־כֵֽן׃
ספר בראשית/מב	כא	__	{{מ:פסוק|בראשית|מב|כא}}	וַיֹּאמְר֞וּ אִ֣ישׁ אֶל־אָחִ֗יו אֲבָל֮ אֲשֵׁמִ֣ים{{מ:פסק}}אֲנַ֘חְנוּ֮ עַל־אָחִ֒ינוּ֒ אֲשֶׁ֨ר רָאִ֜ינוּ צָרַ֥ת נַפְשׁ֛וֹ בְּהִתְחַֽנְנ֥וֹ אֵלֵ֖ינוּ וְלֹ֣א שָׁמָ֑עְנוּ עַל־כֵּן֙ בָּ֣אָה אֵלֵ֔ינוּ הַצָּרָ֖ה הַזֹּֽאת׃
ספר בראשית/מב	כב	__	{{מ:פסוק|בראשית|מב|כב}}	וַיַּ֩עַן֩ רְאוּבֵ֨ן אֹתָ֜ם לֵאמֹ֗ר הֲלוֹא֩ אָמַ֨רְתִּי אֲלֵיכֶ֧ם{{מ:פסק}}לֵאמֹ֛ר אַל־תֶּחֶטְא֥וּ בַיֶּ֖לֶד וְלֹ֣א שְׁמַעְתֶּ֑ם וְגַם־דָּמ֖וֹ הִנֵּ֥ה נִדְרָֽשׁ׃
ספר בראשית/מב	כג	__	{{מ:פסוק|בראשית|מב|כג}}	וְהֵם֙ לֹ֣א {{נוסח|יָֽדְע֔וּ|ל=יָֽדְע֔וּ בגעיה ימנית}} כִּ֥י שֹׁמֵ֖עַ יוֹסֵ֑ף כִּ֥י הַמֵּלִ֖יץ בֵּינֹתָֽם׃
ספר בראשית/מב	כד	__	{{מ:פסוק|בראשית|מב|כד}}	וַיִּסֹּ֥ב מֵֽעֲלֵיהֶ֖ם וַיֵּ֑בְךְּ וַיָּ֤שׇׁב אֲלֵהֶם֙ וַיְדַבֵּ֣ר אֲלֵהֶ֔ם וַיִּקַּ֤ח מֵֽאִתָּם֙ אֶת־שִׁמְע֔וֹן וַיֶּאֱסֹ֥ר אֹת֖וֹ לְעֵינֵיהֶֽם׃
ספר בראשית/מב	כה	__	{{מ:פסוק|בראשית|מב|כה}}	וַיְצַ֣ו יוֹסֵ֗ף וַיְמַלְא֣וּ אֶת־כְּלֵיהֶם֮ בָּר֒ וּלְהָשִׁ֤יב כַּסְפֵּיהֶם֙ אִ֣ישׁ אֶל־שַׂקּ֔וֹ וְלָתֵ֥ת לָהֶ֛ם צֵדָ֖ה לַדָּ֑רֶךְ וַיַּ֥עַשׂ לָהֶ֖ם כֵּֽן׃
ספר בראשית/מב	כו	__	{{מ:פסוק|בראשית|מב|כו}}	וַיִּשְׂא֥וּ אֶת־שִׁבְרָ֖ם עַל־חֲמֹרֵיהֶ֑ם וַיֵּלְכ֖וּ מִשָּֽׁם׃
ספר בראשית/מב	כז	__	{{מ:פסוק|בראשית|מב|כז}}	וַיִּפְתַּ֨ח הָאֶחָ֜ד אֶת־שַׂקּ֗וֹ לָתֵ֥ת מִסְפּ֛וֹא לַחֲמֹר֖וֹ בַּמָּל֑וֹן וַיַּרְא֙ אֶת־כַּסְפּ֔וֹ וְהִנֵּה־ה֖וּא בְּפִ֥י אַמְתַּחְתּֽוֹ׃
ספר בראשית/מב	כח	__	{{מ:פסוק|בראשית|מב|כח}}	וַיֹּ֤אמֶר אֶל־אֶחָיו֙ הוּשַׁ֣ב כַּסְפִּ֔י וְגַ֖ם הִנֵּ֣ה בְאַמְתַּחְתִּ֑י וַיֵּצֵ֣א לִבָּ֗ם וַיֶּֽחֶרְד֞וּ אִ֤ישׁ אֶל־אָחִיו֙ לֵאמֹ֔ר מַה־זֹּ֛את עָשָׂ֥ה אֱלֹהִ֖ים לָֽנוּ׃
ספר בראשית/מב	כט	__	{{מ:פסוק|בראשית|מב|כט}}	וַיָּבֹ֛אוּ אֶל־יַעֲקֹ֥ב אֲבִיהֶ֖ם אַ֣רְצָה כְּנָ֑עַן וַיַּגִּ֣ידוּ ל֔וֹ אֵ֛ת כׇּל־הַקֹּרֹ֥ת אֹתָ֖ם לֵאמֹֽר׃
ספר בראשית/מב	ל	__	{{מ:פסוק|בראשית|מב|ל}}	דִּ֠בֶּ֠ר הָאִ֨ישׁ אֲדֹנֵ֥י הָאָ֛רֶץ אִתָּ֖נוּ קָשׁ֑וֹת וַיִּתֵּ֣ן אֹתָ֔נוּ כִּֽמְרַגְּלִ֖ים אֶת־הָאָֽרֶץ׃
ספר בראשית/מב	לא	__	{{מ:פסוק|בראשית|מב|לא}}	וַנֹּ֥אמֶר אֵלָ֖יו כֵּנִ֣ים אֲנָ֑חְנוּ לֹ֥א הָיִ֖ינוּ מְרַגְּלִֽים׃
ספר בראשית/מב	לב	__	{{מ:פסוק|בראשית|מב|לב}}	שְׁנֵים־עָשָׂ֥ר אֲנַ֛חְנוּ אַחִ֖ים בְּנֵ֣י אָבִ֑ינוּ הָאֶחָ֣ד אֵינֶ֔נּוּ וְהַקָּטֹ֥ן הַיּ֛וֹם אֶת־אָבִ֖ינוּ בְּאֶ֥רֶץ כְּנָֽעַן׃
ספר בראשית/מב	לג	__	{{מ:פסוק|בראשית|מב|לג}}	וַיֹּ֣אמֶר אֵלֵ֗ינוּ הָאִישׁ֙ אֲדֹנֵ֣י הָאָ֔רֶץ בְּזֹ֣את אֵדַ֔ע כִּ֥י כֵנִ֖ים אַתֶּ֑ם אֲחִיכֶ֤ם הָֽאֶחָד֙ הַנִּ֣יחוּ אִתִּ֔י וְאֶת־רַעֲב֥וֹן בָּתֵּיכֶ֖ם קְח֥וּ וָלֵֽכוּ׃
ספר בראשית/מב	לד	__	{{מ:פסוק|בראשית|מב|לד}}	וְ֠הָבִ֠יאוּ אֶת־אֲחִיכֶ֣ם הַקָּטֹן֮ אֵלַי֒ וְאֵֽדְעָ֗ה כִּ֣י לֹ֤א מְרַגְּלִים֙ אַתֶּ֔ם כִּ֥י כֵנִ֖ים אַתֶּ֑ם אֶת־אֲחִיכֶם֙ אֶתֵּ֣ן לָכֶ֔ם וְאֶת־הָאָ֖רֶץ תִּסְחָֽרוּ׃
ספר בראשית/מב	לה	__	{{מ:פסוק|בראשית|מב|לה}}	וַיְהִ֗י הֵ֚ם מְרִיקִ֣ים שַׂקֵּיהֶ֔ם וְהִנֵּה־אִ֥ישׁ צְרוֹר־כַּסְפּ֖וֹ בְּשַׂקּ֑וֹ וַיִּרְא֞וּ אֶת־צְרֹר֧וֹת כַּסְפֵּיהֶ֛ם הֵ֥מָּה וַאֲבִיהֶ֖ם וַיִּירָֽאוּ׃
ספר בראשית/מב	לו	__	{{מ:פסוק|בראשית|מב|לו}}	"וַיֹּ֤אמֶר אֲלֵהֶם֙ יַעֲקֹ֣ב אֲבִיהֶ֔ם אֹתִ֖י שִׁכַּלְתֶּ֑ם יוֹסֵ֤ף {{נוסח|אֵינֶ֙נּוּ֙|=שש1 ובדפוסים|ל=אֵינֶּ֙נּוּ֙ (נו""ן ראשונה דגושה) והמקליד תיקן בלי להעיר|הערות ברויאר ודותן}} וְשִׁמְע֣וֹן אֵינֶ֔נּוּ וְאֶת־בִּנְיָמִ֣ן תִּקָּ֔חוּ עָלַ֖י הָי֥וּ כֻלָּֽנָה׃"
ספר בראשית/מב	לז	__	{{מ:פסוק|בראשית|מב|לז}}	וַיֹּ֤אמֶר רְאוּבֵן֙ אֶל־אָבִ֣יו לֵאמֹ֔ר אֶת־שְׁנֵ֤י בָנַי֙ תָּמִ֔ית אִם־לֹ֥א אֲבִיאֶ֖נּוּ אֵלֶ֑יךָ תְּנָ֤ה אֹתוֹ֙ עַל־יָדִ֔י וַאֲנִ֖י אֲשִׁיבֶ֥נּוּ אֵלֶֽיךָ׃
ספר בראשית/מב	לח	__	{{מ:פסוק|בראשית|מב|לח}}	וַיֹּ֕אמֶר לֹֽא־יֵרֵ֥ד בְּנִ֖י עִמָּכֶ֑ם כִּֽי־אָחִ֨יו מֵ֜ת וְה֧וּא לְבַדּ֣וֹ נִשְׁאָ֗ר וּקְרָאָ֤הוּ אָסוֹן֙ בַּדֶּ֙רֶךְ֙ אֲשֶׁ֣ר תֵּֽלְכוּ־בָ֔הּ וְהוֹרַדְתֶּ֧ם אֶת־שֵׂיבָתִ֛י בְּיָג֖וֹן שְׁאֽוֹלָה׃
ספר בראשית/מב	תתת	<noinclude>//{{תבנית:משתמש:Dovi/טעמי המקרא-סוף}}//{{מ:שוליים-סוף}}//==הפרק בלי מספרים==//{{תבנית:משתמש:Dovi/טעמי המקרא}}//{{#בלי קטע:{{שם הדף המלא}}|סימן}}//{{תבנית:משתמש:Dovi/טעמי המקרא-סוף}}</noinclude>		
ספר בראשית/מג	0	<noinclude>{{תבנית:טעמי המקרא באינטרנט}}//{{מ:שוליים|5}}//{{תבנית:משתמש:Dovi/טעמי המקרא}}//</noinclude>		
ספר בראשית/מג	א	{{מ:אין פרשה בתחילת פרק}}	{{מ:פסוק|בראשית|מג|א}}	וְהָרָעָ֖ב כָּבֵ֥ד בָּאָֽרֶץ׃
ספר בראשית/מג	ב	__	{{מ:פסוק|בראשית|מג|ב}}	וַיְהִ֗י כַּאֲשֶׁ֤ר כִּלּוּ֙ לֶאֱכֹ֣ל אֶת־הַשֶּׁ֔בֶר אֲשֶׁ֥ר הֵבִ֖יאוּ מִמִּצְרָ֑יִם וַיֹּ֤אמֶר אֲלֵיהֶם֙ אֲבִיהֶ֔ם שֻׁ֖בוּ שִׁבְרוּ־לָ֥נוּ מְעַט־אֹֽכֶל׃
ספר בראשית/מג	ג	__	{{מ:פסוק|בראשית|מג|ג}}	וַיֹּ֧אמֶר אֵלָ֛יו יְהוּדָ֖ה לֵאמֹ֑ר {{נוסח|הָעֵ֣ד|=לש ובדפוסים|ברויאר במהדורתו הראשון ציין ל=הַעֵ֣ד (בפתח) אבל הקמץ ברור.}} הֵעִד֩ בָּ֨נוּ הָאִ֤ישׁ לֵאמֹר֙ לֹֽא־תִרְא֣וּ פָנַ֔י בִּלְתִּ֖י אֲחִיכֶ֥ם אִתְּכֶֽם׃
ספר בראשית/מג	ד	__	{{מ:פסוק|בראשית|מג|ד}}	אִם־יֶשְׁךָ֛ מְשַׁלֵּ֥חַ אֶת־אָחִ֖ינוּ אִתָּ֑נוּ נֵרְדָ֕ה וְנִשְׁבְּרָ֥ה לְךָ֖ אֹֽכֶל׃
ספר בראשית/מג	ה	__	{{מ:פסוק|בראשית|מג|ה}}	וְאִם־אֵינְךָ֥ מְשַׁלֵּ֖חַ לֹ֣א נֵרֵ֑ד כִּֽי־הָאִ֞ישׁ אָמַ֤ר אֵלֵ֙ינוּ֙ לֹֽא־תִרְא֣וּ פָנַ֔י בִּלְתִּ֖י אֲחִיכֶ֥ם אִתְּכֶֽם׃
ספר בראשית/מג	ו	__	{{מ:פסוק|בראשית|מג|ו}}	וַיֹּ֙אמֶר֙ יִשְׂרָאֵ֔ל לָמָ֥ה הֲרֵעֹתֶ֖ם לִ֑י לְהַגִּ֣יד לָאִ֔ישׁ הַע֥וֹד לָכֶ֖ם אָֽח׃
ספר בראשית/מג	ז	__	{{מ:פסוק|בראשית|מג|ז}}	"וַיֹּאמְר֡וּ שָׁא֣וֹל שָֽׁאַל־הָ֠אִ֠ישׁ לָ֣נוּ וּלְמֽוֹלַדְתֵּ֜נוּ לֵאמֹ֗ר הַע֨וֹד אֲבִיכֶ֥ם חַי֙ הֲיֵ֣שׁ לָכֶ֣ם אָ֔ח {{נוסח|וַנַּ֨גֶּד־ל֔וֹ|=ש ובדפוסים|ל=וַנַ֨גֶּד־ל֔וֹ (חסר דגש) ודותן תיקן בלי להעיר (אמנם יתכן שהדגש נבלע בתוך הנו""ן)|הערת המקליד}} עַל־פִּ֖י הַדְּבָרִ֣ים הָאֵ֑לֶּה הֲיָד֣וֹעַ נֵדַ֔ע כִּ֣י יֹאמַ֔ר הוֹרִ֖ידוּ אֶת־אֲחִיכֶֽם׃"
