ספר בראשית/לז	0	<noinclude>{{תבנית:טעמי המקרא באינטרנט}}//{{מ:שוליים|5}}//{{תבנית:משתמש:Dovi/טעמי המקרא}}//</noinclude>		
ספר בראשית/מג	ח	__	{{מ:פסוק|בראשית|מג|ח}}	וַיֹּ֨אמֶר יְהוּדָ֜ה אֶל־יִשְׂרָאֵ֣ל אָבִ֗יו שִׁלְחָ֥ה הַנַּ֛עַר אִתִּ֖י וְנָק֣וּמָה וְנֵלֵ֑כָה וְנִֽחְיֶה֙ וְלֹ֣א נָמ֔וּת גַּם־אֲנַ֥חְנוּ גַם־אַתָּ֖ה גַּם־טַפֵּֽנוּ׃
ספר בראשית/מג	ט	__	{{מ:פסוק|בראשית|מג|ט}}	אָֽנֹכִי֙ אֶֽעֶרְבֶ֔נּוּ מִיָּדִ֖י תְּבַקְשֶׁ֑נּוּ אִם־לֹ֨א הֲבִיאֹתִ֤יו אֵלֶ֙יךָ֙ וְהִצַּגְתִּ֣יו לְפָנֶ֔יךָ וְחָטָ֥אתִֽי לְךָ֖ כׇּל־הַיָּמִֽים׃
ספר בראשית/מג	י	__	{{מ:פסוק|בראשית|מג|י}}	כִּ֖י לוּלֵ֣א הִתְמַהְמָ֑הְנוּ כִּֽי־עַתָּ֥ה שַׁ֖בְנוּ זֶ֥ה פַעֲמָֽיִם׃
ספר בראשית/מג	יא	__	{{מ:פסוק|בראשית|מג|יא}}	וַיֹּ֨אמֶר אֲלֵהֶ֜ם יִשְׂרָאֵ֣ל אֲבִיהֶ֗ם אִם־כֵּ֣ן{{מ:פסק}}אֵפוֹא֮ זֹ֣את עֲשׂוּ֒ קְח֞וּ מִזִּמְרַ֤ת הָאָ֙רֶץ֙ בִּכְלֵיכֶ֔ם וְהוֹרִ֥ידוּ לָאִ֖ישׁ מִנְחָ֑ה מְעַ֤ט צֳרִי֙ וּמְעַ֣ט דְּבַ֔שׁ נְכֹ֣את וָלֹ֔ט בׇּטְנִ֖ים וּשְׁקֵדִֽים׃
ספר בראשית/מג	יב	__	{{מ:פסוק|בראשית|מג|יב}}	וְכֶ֥סֶף מִשְׁנֶ֖ה קְח֣וּ בְיֶדְכֶ֑ם וְאֶת־הַכֶּ֜סֶף {{נוסח|הַמּוּשָׁ֨ב|=א(ס)ל <פתח? אינו כן אלא בקמץ ונמסר עליו ג''>|דפוסים=הַמּוּשַׁ֨ב (בפתח)}} בְּפִ֤י אַמְתְּחֹֽתֵיכֶם֙ תָּשִׁ֣יבוּ בְיֶדְכֶ֔ם אוּלַ֥י מִשְׁגֶּ֖ה הֽוּא׃
ספר בראשית/מג	יג	__	{{מ:פסוק|בראשית|מג|יג}}	וְאֶת־אֲחִיכֶ֖ם קָ֑חוּ וְק֖וּמוּ שׁ֥וּבוּ אֶל־הָאִֽישׁ׃
ספר בראשית/מג	יד	__	{{מ:פסוק|בראשית|מג|יד|סדר=לט}}	וְאֵ֣ל שַׁדַּ֗י יִתֵּ֨ן לָכֶ֤ם רַחֲמִים֙ לִפְנֵ֣י הָאִ֔ישׁ וְשִׁלַּ֥ח לָכֶ֛ם אֶת־אֲחִיכֶ֥ם אַחֵ֖ר וְאֶת־בִּנְיָמִ֑ין וַאֲנִ֕י כַּאֲשֶׁ֥ר שָׁכֹ֖לְתִּי שָׁכָֽלְתִּי׃
ספר בראשית/מג	טו	__	{{מ:פסוק|בראשית|מג|טו}}	וַיִּקְח֤וּ הָֽאֲנָשִׁים֙ אֶת־הַמִּנְחָ֣ה הַזֹּ֔את וּמִשְׁנֶה־כֶּ֛סֶף לָקְח֥וּ בְיָדָ֖ם וְאֶת־בִּנְיָמִ֑ן וַיָּקֻ֙מוּ֙ וַיֵּרְד֣וּ מִצְרַ֔יִם וַיַּֽעַמְד֖וּ לִפְנֵ֥י יוֹסֵֽף׃
ספר בראשית/מג	טז	__	{{מ:פסוק|בראשית|מג|טז|עלייה=ששי}}	וַיַּ֨רְא יוֹסֵ֣ף אִתָּם֮ אֶת־בִּנְיָמִין֒ וַיֹּ֙אמֶר֙ לַֽאֲשֶׁ֣ר עַל־בֵּית֔וֹ הָבֵ֥א אֶת־הָאֲנָשִׁ֖ים הַבָּ֑יְתָה וּטְבֹ֤חַ טֶ֙בַח֙ וְהָכֵ֔ן כִּ֥י אִתִּ֛י יֹאכְל֥וּ הָאֲנָשִׁ֖ים {{מ:קמץ|ד=בַּֽצׇּהֳרָֽיִם|ס=בַּֽצָּהֳרָֽיִם}}׃
ספר בראשית/מג	יז	__	{{מ:פסוק|בראשית|מג|יז}}	וַיַּ֣עַשׂ הָאִ֔ישׁ כַּֽאֲשֶׁ֖ר אָמַ֣ר יוֹסֵ֑ף וַיָּבֵ֥א הָאִ֛ישׁ אֶת־הָאֲנָשִׁ֖ים בֵּ֥יתָה יוֹסֵֽף׃
ספר בראשית/מג	יח	__	{{מ:פסוק|בראשית|מג|יח}}	וַיִּֽירְא֣וּ הָֽאֲנָשִׁ֗ים כִּ֣י הֽוּבְאוּ֮ בֵּ֣ית יוֹסֵף֒ וַיֹּאמְר֗וּ עַל־דְּבַ֤ר הַכֶּ֙סֶף֙ הַשָּׁ֤ב בְּאַמְתְּחֹתֵ֙ינוּ֙ בַּתְּחִלָּ֔ה אֲנַ֖חְנוּ מֽוּבָאִ֑ים לְהִתְגֹּלֵ֤ל עָלֵ֙ינוּ֙ וּלְהִתְנַפֵּ֣ל עָלֵ֔ינוּ וְלָקַ֧חַת אֹתָ֛נוּ לַעֲבָדִ֖ים וְאֶת־חֲמֹרֵֽינוּ׃
ספר בראשית/מג	יט	__	{{מ:פסוק|בראשית|מג|יט}}	וַֽיִּגְּשׁוּ֙ אֶל־הָאִ֔ישׁ אֲשֶׁ֖ר עַל־בֵּ֣ית יוֹסֵ֑ף וַיְדַבְּר֥וּ אֵלָ֖יו פֶּ֥תַח הַבָּֽיִת׃
ספר בראשית/מג	כ	__	{{מ:פסוק|בראשית|מג|כ}}	וַיֹּאמְר֖וּ בִּ֣י אֲדֹנִ֑י יָרֹ֥ד יָרַ֛דְנוּ בַּתְּחִלָּ֖ה לִשְׁבׇּר־אֹֽכֶל׃
ספר בראשית/מג	כא	__	{{מ:פסוק|בראשית|מג|כא}}	{{נוסח|וַֽיְהִ֞י|=ל (בגעיה)|ל1=וַיְהִ֞י (אין געיה) וברויאר תיקן על פיו}} כִּי־בָ֣אנוּ אֶל־הַמָּל֗וֹן וַֽנִּפְתְּחָה֙ אֶת־אַמְתְּחֹתֵ֔ינוּ וְהִנֵּ֤ה כֶֽסֶף־אִישׁ֙ בְּפִ֣י אַמְתַּחְתּ֔וֹ כַּסְפֵּ֖נוּ בְּמִשְׁקָל֑וֹ וַנָּ֥שֶׁב אֹת֖וֹ בְּיָדֵֽנוּ׃
ספר בראשית/מג	כב	__	{{מ:פסוק|בראשית|מג|כב}}	וְכֶ֧סֶף אַחֵ֛ר הוֹרַ֥דְנוּ בְיָדֵ֖נוּ לִשְׁבׇּר־אֹ֑כֶל לֹ֣א יָדַ֔עְנוּ מִי־שָׂ֥ם כַּסְפֵּ֖נוּ בְּאַמְתְּחֹתֵֽינוּ׃
ספר בראשית/מג	כג	__	{{מ:פסוק|בראשית|מג|כג}}	וַיֹּ֩אמֶר֩ שָׁל֨וֹם לָכֶ֜ם אַל־תִּירָ֗אוּ אֱלֹ֨הֵיכֶ֜ם {{נוסח|וֵֽאלֹהֵ֤י|ל=וֵֽאלֹהֵ֤י בגעיה ימנית}} אֲבִיכֶם֙ נָתַ֨ן לָכֶ֤ם מַטְמוֹן֙ בְּאַמְתְּחֹ֣תֵיכֶ֔ם כַּסְפְּכֶ֖ם בָּ֣א אֵלָ֑י וַיּוֹצֵ֥א אֲלֵהֶ֖ם אֶת־שִׁמְעֽוֹן׃
ספר בראשית/מג	כד	__	{{מ:פסוק|בראשית|מג|כד}}	וַיָּבֵ֥א הָאִ֛ישׁ אֶת־הָאֲנָשִׁ֖ים בֵּ֣יתָה יוֹסֵ֑ף וַיִּתֶּן־מַ֙יִם֙ וַיִּרְחֲצ֣וּ רַגְלֵיהֶ֔ם וַיִּתֵּ֥ן מִסְפּ֖וֹא לַחֲמֹֽרֵיהֶֽם׃
ספר בראשית/מג	כה	__	{{מ:פסוק|בראשית|מג|כה}}	וַיָּכִ֙ינוּ֙ אֶת־הַמִּנְחָ֔ה עַד־בּ֥וֹא יוֹסֵ֖ף {{מ:קמץ|ד=בַּֽצׇּהֳרָ֑יִם|ס=בַּֽצָּהֳרָ֑יִם}} כִּ֣י שָֽׁמְע֔וּ כִּי־שָׁ֖ם יֹ֥אכְלוּ לָֽחֶם׃
ספר בראשית/מג	כו	__	{{מ:פסוק|בראשית|מג|כו}}	וַיָּבֹ֤א יוֹסֵף֙ הַבַּ֔יְתָה וַיָּבִ֥יאּוּ ל֛וֹ אֶת־הַמִּנְחָ֥ה אֲשֶׁר־בְּיָדָ֖ם הַבָּ֑יְתָה וַיִּשְׁתַּחֲווּ־ל֖וֹ אָֽרְצָה׃
ספר בראשית/מג	כז	__	{{מ:פסוק|בראשית|מג|כז}}	וַיִּשְׁאַ֤ל לָהֶם֙ לְשָׁל֔וֹם וַיֹּ֗אמֶר הֲשָׁל֛וֹם אֲבִיכֶ֥ם הַזָּקֵ֖ן אֲשֶׁ֣ר אֲמַרְתֶּ֑ם הַעוֹדֶ֖נּוּ חָֽי׃
ספר בראשית/מג	כח	__	{{מ:פסוק|בראשית|מג|כח}}	"וַיֹּאמְר֗וּ שָׁל֛וֹם לְעַבְדְּךָ֥ לְאָבִ֖ינוּ עוֹדֶ֣נּוּ חָ֑י וַֽיִּקְּד֖וּ {{נוסח|{{כו""ק|וישתחו|וַיִּֽשְׁתַּחֲוֽוּ}}|=שש1 ובדפוסים|ל-קרי=וַיִּֽשְׁתַּחֲוּֽוּ (דגש בוי""ו עיצורית)|הערות ברויאר ודותן והמקליד}}׃"
ספר בראשית/מג	כט	__	{{מ:פסוק|בראשית|מג|כט}}	וַיִּשָּׂ֣א עֵינָ֗יו וַיַּ֞רְא אֶת־בִּנְיָמִ֣ין אָחִיו֮ בֶּן־אִמּוֹ֒ וַיֹּ֗אמֶר הֲזֶה֙ אֲחִיכֶ֣ם הַקָּטֹ֔ן אֲשֶׁ֥ר אֲמַרְתֶּ֖ם אֵלָ֑י וַיֹּאמַ֕ר אֱלֹהִ֥ים יׇחְנְךָ֖ בְּנִֽי׃
ספר בראשית/מג	ל	__	{{מ:פסוק|בראשית|מג|ל|עלייה=שביעי}}	וַיְמַהֵ֣ר יוֹסֵ֗ף כִּֽי־נִכְמְר֤וּ רַחֲמָיו֙ אֶל־אָחִ֔יו וַיְבַקֵּ֖שׁ לִבְכּ֑וֹת וַיָּבֹ֥א הַחַ֖דְרָה וַיֵּ֥בְךְּ שָֽׁמָּה׃
ספר בראשית/מג	לא	__	{{מ:פסוק|בראשית|מג|לא}}	וַיִּרְחַ֥ץ פָּנָ֖יו וַיֵּצֵ֑א וַיִּ֨תְאַפַּ֔ק וַיֹּ֖אמֶר שִׂ֥ימוּ לָֽחֶם׃
ספר בראשית/מג	לב	__	{{מ:פסוק|בראשית|מג|לב}}	וַיָּשִׂ֥ימוּ ל֛וֹ לְבַדּ֖וֹ וְלָהֶ֣ם לְבַדָּ֑ם וְלַמִּצְרִ֞ים הָאֹכְלִ֤ים אִתּוֹ֙ לְבַדָּ֔ם כִּי֩ לֹ֨א יוּכְל֜וּן הַמִּצְרִ֗ים לֶאֱכֹ֤ל אֶת־הָֽעִבְרִים֙ לֶ֔חֶם כִּי־תוֹעֵבָ֥ה הִ֖וא לְמִצְרָֽיִם׃
ספר בראשית/מג	לג	__	{{מ:פסוק|בראשית|מג|לג}}	וַיֵּשְׁב֣וּ לְפָנָ֔יו הַבְּכֹר֙ כִּבְכֹ֣רָת֔וֹ וְהַצָּעִ֖יר כִּצְעִרָת֑וֹ וַיִּתְמְה֥וּ הָאֲנָשִׁ֖ים אִ֥ישׁ אֶל־רֵעֵֽהוּ׃
ספר בראשית/מג	לד	__	{{מ:פסוק|בראשית|מג|לד}}	וַיִּשָּׂ֨א מַשְׂאֹ֜ת מֵאֵ֣ת פָּנָיו֮ אֲלֵהֶם֒ וַתֵּ֜רֶב מַשְׂאַ֧ת בִּנְיָמִ֛ן מִמַּשְׂאֹ֥ת כֻּלָּ֖ם חָמֵ֣שׁ יָד֑וֹת וַיִּשְׁתּ֥וּ וַֽיִּשְׁכְּר֖וּ עִמּֽוֹ׃
ספר בראשית/מג	תתת	<noinclude>//{{תבנית:משתמש:Dovi/טעמי המקרא-סוף}}//{{מ:שוליים-סוף}}//==הפרק בלי מספרים==//{{תבנית:משתמש:Dovi/טעמי המקרא}}//{{#בלי קטע:{{שם הדף המלא}}|סימן}}//{{תבנית:משתמש:Dovi/טעמי המקרא-סוף}}</noinclude>		
ספר בראשית/מד	0	<noinclude>{{תבנית:טעמי המקרא באינטרנט}}//{{מ:שוליים|5}}//{{תבנית:משתמש:Dovi/טעמי המקרא}}//</noinclude>		
ספר בראשית/מד	א	{{מ:אין פרשה בתחילת פרק}}	{{מ:פסוק|בראשית|מד|א}}	וַיְצַ֞ו אֶת־אֲשֶׁ֣ר עַל־בֵּיתוֹ֮ לֵאמֹר֒ מַלֵּ֞א אֶת־אַמְתְּחֹ֤ת הָֽאֲנָשִׁים֙ אֹ֔כֶל כַּאֲשֶׁ֥ר יוּכְל֖וּן שְׂאֵ֑ת וְשִׂ֥ים כֶּֽסֶף־אִ֖ישׁ בְּפִ֥י אַמְתַּחְתּֽוֹ׃
ספר בראשית/מד	ב	__	{{מ:פסוק|בראשית|מד|ב}}	וְאֶת־גְּבִיעִ֞י גְּבִ֣יעַ הַכֶּ֗סֶף תָּשִׂים֙ בְּפִי֙ אַמְתַּ֣חַת הַקָּטֹ֔ן וְאֵ֖ת כֶּ֣סֶף שִׁבְר֑וֹ וַיַּ֕עַשׂ כִּדְבַ֥ר יוֹסֵ֖ף אֲשֶׁ֥ר דִּבֵּֽר׃
ספר בראשית/מד	ג	__	{{מ:פסוק|בראשית|מד|ג}}	הַבֹּ֖קֶר א֑וֹר וְהָאֲנָשִׁ֣ים שֻׁלְּח֔וּ הֵ֖מָּה וַחֲמֹרֵיהֶֽם׃
ספר בראשית/מד	ד	__	{{מ:פסוק|בראשית|מד|ד}}	הֵ֠ם יָֽצְא֣וּ אֶת־הָעִיר֮ לֹ֣א הִרְחִ֒יקוּ֒ וְיוֹסֵ֤ף אָמַר֙ לַֽאֲשֶׁ֣ר עַל־בֵּית֔וֹ ק֥וּם רְדֹ֖ף אַחֲרֵ֣י הָֽאֲנָשִׁ֑ים וְהִשַּׂגְתָּם֙ וְאָמַרְתָּ֣ אֲלֵהֶ֔ם לָ֛מָּה שִׁלַּמְתֶּ֥ם רָעָ֖ה תַּ֥חַת טוֹבָֽה׃
ספר בראשית/מד	ה	__	{{מ:פסוק|בראשית|מד|ה}}	הֲל֣וֹא זֶ֗ה אֲשֶׁ֨ר יִשְׁתֶּ֤ה אֲדֹנִי֙ בּ֔וֹ וְה֕וּא נַחֵ֥שׁ יְנַחֵ֖שׁ בּ֑וֹ הֲרֵעֹתֶ֖ם אֲשֶׁ֥ר עֲשִׂיתֶֽם׃
ספר בראשית/מד	ו	__	{{מ:פסוק|בראשית|מד|ו}}	וַֽיַּשִּׂגֵ֑ם וַיְדַבֵּ֣ר אֲלֵהֶ֔ם אֶת־הַדְּבָרִ֖ים הָאֵֽלֶּה׃
ספר בראשית/מד	ז	__	{{מ:פסוק|בראשית|מד|ז}}	וַיֹּאמְר֣וּ אֵלָ֔יו לָ֚מָּה יְדַבֵּ֣ר אֲדֹנִ֔י כַּדְּבָרִ֖ים הָאֵ֑לֶּה חָלִ֙ילָה֙ לַעֲבָדֶ֔יךָ מֵעֲשׂ֖וֹת כַּדָּבָ֥ר הַזֶּֽה׃
ספר בראשית/מד	ח	__	{{מ:פסוק|בראשית|מד|ח}}	הֵ֣ן כֶּ֗סֶף אֲשֶׁ֤ר מָצָ֙אנוּ֙ בְּפִ֣י אַמְתְּחֹתֵ֔ינוּ הֱשִׁיבֹ֥נוּ אֵלֶ֖יךָ מֵאֶ֣רֶץ כְּנָ֑עַן וְאֵ֗יךְ נִגְנֹב֙ מִבֵּ֣ית אֲדֹנֶ֔יךָ כֶּ֖סֶף א֥וֹ זָהָֽב׃
ספר בראשית/מד	ט	__	{{מ:פסוק|בראשית|מד|ט}}	אֲשֶׁ֨ר יִמָּצֵ֥א אִתּ֛וֹ מֵעֲבָדֶ֖יךָ וָמֵ֑ת וְגַם־אֲנַ֕חְנוּ נִֽהְיֶ֥ה לַֽאדֹנִ֖י לַעֲבָדִֽים׃
ספר בראשית/מד	י	__	{{מ:פסוק|בראשית|מד|י}}	וַיֹּ֕אמֶר גַּם־עַתָּ֥ה כְדִבְרֵיכֶ֖ם כֶּן־ה֑וּא אֲשֶׁ֨ר יִמָּצֵ֤א אִתּוֹ֙ יִהְיֶה־לִּ֣י עָ֔בֶד וְאַתֶּ֖ם תִּהְי֥וּ נְקִיִּֽם׃
ספר בראשית/מד	יא	__	{{מ:פסוק|בראשית|מד|יא}}	{{נוסח|וַֽיְמַהֲר֗וּ|ל=וַֽיְמַהֲר֗וּ בגעיה ימנית}} וַיּוֹרִ֛דוּ אִ֥ישׁ אֶת־אַמְתַּחְתּ֖וֹ אָ֑רְצָה וַֽיִּפְתְּח֖וּ אִ֥ישׁ אַמְתַּחְתּֽוֹ׃
ספר בראשית/מד	יב	__	{{מ:פסוק|בראשית|מד|יב}}	וַיְחַפֵּ֕שׂ בַּגָּד֣וֹל הֵחֵ֔ל וּבַקָּטֹ֖ן כִּלָּ֑ה וַיִּמָּצֵא֙ הַגָּבִ֔יעַ בְּאַמְתַּ֖חַת בִּנְיָמִֽן׃
ספר בראשית/מד	יג	__	{{מ:פסוק|בראשית|מד|יג}}	{{נוסח|וַֽיִּקְרְע֖וּ|ל=וַֽיִּקְרְע֖וּ בגעיה ימנית}} שִׂמְלֹתָ֑ם וַֽיַּעֲמֹס֙ אִ֣ישׁ עַל־חֲמֹר֔וֹ וַיָּשֻׁ֖בוּ הָעִֽירָה׃
ספר בראשית/מד	יד	__	{{מ:פסוק|בראשית|מד|יד|עלייה=מפטיר}}	וַיָּבֹ֨א יְהוּדָ֤ה וְאֶחָיו֙ בֵּ֣יתָה יוֹסֵ֔ף וְה֖וּא עוֹדֶ֣נּוּ שָׁ֑ם וַיִּפְּל֥וּ לְפָנָ֖יו אָֽרְצָה׃
ספר בראשית/מד	טו	__	{{מ:פסוק|בראשית|מד|טו}}	וַיֹּ֤אמֶר לָהֶם֙ יוֹסֵ֔ף מָֽה־הַמַּעֲשֶׂ֥ה הַזֶּ֖ה אֲשֶׁ֣ר עֲשִׂיתֶ֑ם הֲל֣וֹא יְדַעְתֶּ֔ם כִּֽי־נַחֵ֧שׁ יְנַחֵ֛שׁ אִ֖ישׁ אֲשֶׁ֥ר כָּמֹֽנִי׃
ספר בראשית/מד	טז	__	{{מ:פסוק|בראשית|מד|טז}}	וַיֹּ֣אמֶר יְהוּדָ֗ה מַה־נֹּאמַר֙ לַֽאדֹנִ֔י מַה־נְּדַבֵּ֖ר וּמַה־נִּצְטַדָּ֑ק הָאֱלֹהִ֗ים מָצָא֙ אֶת־עֲוֺ֣ן עֲבָדֶ֔יךָ {{נוסח|הִנֶּ֤נּוּ|=ל|הקלדה=הִנֶּנּ֤וּ טעות בעקבות BHS}} עֲבָדִים֙ לַֽאדֹנִ֔י גַּם־אֲנַ֕חְנוּ גַּ֛ם אֲשֶׁר־נִמְצָ֥א הַגָּבִ֖יעַ בְּיָדֽוֹ׃
ספר בראשית/מד	יז	__	{{מ:פסוק|בראשית|מד|יז}}	וַיֹּ֕אמֶר חָלִ֣ילָה לִּ֔י מֵעֲשׂ֖וֹת זֹ֑את הָאִ֡ישׁ אֲשֶׁר֩ נִמְצָ֨א הַגָּבִ֜יעַ בְּיָד֗וֹ ה֚וּא יִהְיֶה־לִּ֣י עָ֔בֶד וְאַתֶּ֕ם עֲל֥וּ לְשָׁל֖וֹם אֶל־אֲבִיכֶֽם׃
ספר בראשית/מד	יח	"//{{נוסח|{{סס}}|=רמב""ם וכתי""ל (ובעקבות כתי""ל פרשה סתומה גם בדותן)|הקלדה=פרשה פתוחה (!) כנראה בטעות}}"	{{מ:פסוק|בראשית|מד|יח|סדר=מ|עלייה='''ויגש'''|עלייה ראשונה=כן}}	וַיִּגַּ֨שׁ אֵלָ֜יו יְהוּדָ֗ה וַיֹּ֘אמֶר֮ בִּ֣י אֲדֹנִי֒ יְדַבֶּר־נָ֨א עַבְדְּךָ֤ דָבָר֙ בְּאׇזְנֵ֣י אֲדֹנִ֔י וְאַל־יִ֥חַר אַפְּךָ֖ בְּעַבְדֶּ֑ךָ כִּ֥י כָמ֖וֹךָ כְּפַרְעֹֽה׃
ספר בראשית/מד	יט	__	{{מ:פסוק|בראשית|מד|יט}}	"אֲדֹנִ֣י שָׁאַ֔ל אֶת־עֲבָדָ֖יו לֵאמֹ֑ר {{נוסח|הֲיֵשׁ־לָכֶ֥ם|=א(ס)ל <צֵרי ומקף? כן אבל ""יש לנו"" בסגול שמלה שאחריה מלעיל> ובדפוסים}} אָ֖ב אוֹ־אָֽח׃"
ספר בראשית/מד	כ	__	{{מ:פסוק|בראשית|מד|כ}}	וַנֹּ֙אמֶר֙ אֶל־אֲדֹנִ֔י {{נוסח|יֶשׁ־לָ֙נוּ֙|=א(ס)ל ובדפוסים (ראו בהערה בפסוק הקודם)}} אָ֣ב זָקֵ֔ן וְיֶ֥לֶד זְקֻנִ֖ים קָטָ֑ן {{נוסח|וְאָחִ֣יו מֵ֔ת|=שש1 ובדפוסים|ל=וְאָחִ֨יו מֵ֜ת (בטעמים קדמא ואזלא!) כנראה בטעות בעקבות הפסוק הדומה לו (מב,לח)|הערת ברויאר}} וַיִּוָּתֵ֨ר ה֧וּא לְבַדּ֛וֹ לְאִמּ֖וֹ וְאָבִ֥יו אֲהֵבֽוֹ׃
ספר בראשית/מד	כא	__	{{מ:פסוק|בראשית|מד|כא|עלייה=[לוי]}}	וַתֹּ֙אמֶר֙ אֶל־עֲבָדֶ֔יךָ הוֹרִדֻ֖הוּ אֵלָ֑י וְאָשִׂ֥ימָה עֵינִ֖י עָלָֽיו׃
ספר בראשית/מד	כב	__	{{מ:פסוק|בראשית|מד|כב}}	וַנֹּ֙אמֶר֙ אֶל־אֲדֹנִ֔י לֹא־יוּכַ֥ל הַנַּ֖עַר לַעֲזֹ֣ב אֶת־אָבִ֑יו וְעָזַ֥ב אֶת־אָבִ֖יו וָמֵֽת׃
ספר בראשית/מד	כג	__	{{מ:פסוק|בראשית|מד|כג}}	וַתֹּ֙אמֶר֙ אֶל־עֲבָדֶ֔יךָ אִם־לֹ֥א יֵרֵ֛ד אֲחִיכֶ֥ם הַקָּטֹ֖ן אִתְּכֶ֑ם לֹ֥א תֹסִפ֖וּן לִרְא֥וֹת פָּנָֽי׃
ספר בראשית/מד	כד	__	{{מ:פסוק|בראשית|מד|כד}}	{{נוסח|וַיְהִי֙|=ל (אין געיה)|ל1=וַֽיְהִי֙ (געיה) וברויאר תיקן על פיו}} כִּ֣י עָלִ֔ינוּ אֶֽל־עַבְדְּךָ֖ אָבִ֑י וַנַּ֨גֶּד־ל֔וֹ אֵ֖ת דִּבְרֵ֥י אֲדֹנִֽי׃
ספר בראשית/מד	כה	__	{{מ:פסוק|בראשית|מד|כה|עלייה=[ישראל]}}	וַיֹּ֖אמֶר אָבִ֑ינוּ שֻׁ֖בוּ שִׁבְרוּ־לָ֥נוּ מְעַט־אֹֽכֶל׃
ספר בראשית/מד	כו	__	{{מ:פסוק|בראשית|מד|כו}}	וַנֹּ֕אמֶר לֹ֥א נוּכַ֖ל לָרֶ֑דֶת אִם־יֵשׁ֩ אָחִ֨ינוּ הַקָּטֹ֤ן אִתָּ֙נוּ֙ וְיָרַ֔דְנוּ כִּי־לֹ֣א נוּכַ֗ל לִרְאוֹת֙ פְּנֵ֣י הָאִ֔ישׁ וְאָחִ֥ינוּ הַקָּטֹ֖ן אֵינֶ֥נּוּ אִתָּֽנוּ׃
ספר בראשית/מד	כז	__	{{מ:פסוק|בראשית|מד|כז}}	וַיֹּ֛אמֶר עַבְדְּךָ֥ אָבִ֖י אֵלֵ֑ינוּ אַתֶּ֣ם יְדַעְתֶּ֔ם כִּ֥י שְׁנַ֖יִם יָֽלְדָה־לִּ֥י אִשְׁתִּֽי׃
ספר בראשית/מד	כח	__	{{מ:פסוק|בראשית|מד|כח}}	וַיֵּצֵ֤א הָֽאֶחָד֙ מֵֽאִתִּ֔י וָאֹמַ֕ר אַ֖ךְ טָרֹ֣ף טֹרָ֑ף וְלֹ֥א רְאִיתִ֖יו עַד־הֵֽנָּה׃
ספר בראשית/מד	כט	__	{{מ:פסוק|בראשית|מד|כט}}	וּלְקַחְתֶּ֧ם גַּם־אֶת־זֶ֛ה מֵעִ֥ם פָּנַ֖י וְקָרָ֣הוּ אָס֑וֹן וְהֽוֹרַדְתֶּ֧ם אֶת־שֵׂיבָתִ֛י בְּרָעָ֖ה שְׁאֹֽלָה׃
ספר בראשית/מד	ל	__	{{מ:פסוק|בראשית|מד|ל}}	וְעַתָּ֗ה כְּבֹאִי֙ אֶל־עַבְדְּךָ֣ אָבִ֔י וְהַנַּ֖עַר אֵינֶ֣נּוּ אִתָּ֑נוּ וְנַפְשׁ֖וֹ קְשׁוּרָ֥ה בְנַפְשֽׁוֹ׃
ספר בראשית/מד	לא	__	{{מ:פסוק|בראשית|מד|לא|עלייה=שני}}	וְהָיָ֗ה כִּרְאוֹת֛וֹ כִּי־אֵ֥ין הַנַּ֖עַר וָמֵ֑ת וְהוֹרִ֨ידוּ עֲבָדֶ֜יךָ אֶת־שֵׂיבַ֨ת עַבְדְּךָ֥ אָבִ֛ינוּ בְּיָג֖וֹן שְׁאֹֽלָה׃
ספר בראשית/מד	לב	__	{{מ:פסוק|בראשית|מד|לב}}	כִּ֤י עַבְדְּךָ֙ עָרַ֣ב אֶת־הַנַּ֔עַר מֵעִ֥ם אָבִ֖י לֵאמֹ֑ר אִם־לֹ֤א אֲבִיאֶ֙נּוּ֙ אֵלֶ֔יךָ וְחָטָ֥אתִי לְאָבִ֖י כׇּל־הַיָּמִֽים׃
ספר בראשית/מד	לג	__	{{מ:פסוק|בראשית|מד|לג}}	וְעַתָּ֗ה יֵֽשֶׁב־נָ֤א עַבְדְּךָ֙ תַּ֣חַת הַנַּ֔עַר עֶ֖בֶד לַֽאדֹנִ֑י וְהַנַּ֖עַר יַ֥עַל עִם־אֶחָֽיו׃
ספר בראשית/מד	לד	__	{{מ:פסוק|בראשית|מד|לד}}	כִּי־אֵיךְ֙ אֶֽעֱלֶ֣ה אֶל־אָבִ֔י וְהַנַּ֖עַר אֵינֶ֣נּוּ אִתִּ֑י פֶּ֚ן אֶרְאֶ֣ה בָרָ֔ע אֲשֶׁ֥ר יִמְצָ֖א אֶת־אָבִֽי׃
ספר בראשית/מד	תתת	<noinclude>//{{תבנית:משתמש:Dovi/טעמי המקרא-סוף}}//{{מ:שוליים-סוף}}//==הפרק בלי מספרים==//{{תבנית:משתמש:Dovi/טעמי המקרא}}//{{#בלי קטע:{{שם הדף המלא}}|סימן}}//{{תבנית:משתמש:Dovi/טעמי המקרא-סוף}}</noinclude>		
ספר בראשית/מה	0	<noinclude>{{תבנית:טעמי המקרא באינטרנט}}//{{מ:שוליים|5}}//{{תבנית:משתמש:Dovi/טעמי המקרא}}//</noinclude>		
ספר בראשית/מה	א	{{מ:אין פרשה בתחילת פרק}}	{{מ:פסוק|בראשית|מה|א}}	וְלֹֽא־יָכֹ֨ל יוֹסֵ֜ף לְהִתְאַפֵּ֗ק לְכֹ֤ל הַנִּצָּבִים֙ עָלָ֔יו וַיִּקְרָ֕א הוֹצִ֥יאוּ כׇל־אִ֖ישׁ מֵעָלָ֑י וְלֹא־עָ֤מַד אִישׁ֙ אִתּ֔וֹ בְּהִתְוַדַּ֥ע יוֹסֵ֖ף אֶל־אֶחָֽיו׃
ספר בראשית/מה	ב	__	{{מ:פסוק|בראשית|מה|ב}}	וַיִּתֵּ֥ן אֶת־קֹל֖וֹ בִּבְכִ֑י וַיִּשְׁמְע֣וּ מִצְרַ֔יִם וַיִּשְׁמַ֖ע בֵּ֥ית פַּרְעֹֽה׃
ספר בראשית/מה	ג	__	{{מ:פסוק|בראשית|מה|ג}}	וַיֹּ֨אמֶר יוֹסֵ֤ף אֶל־אֶחָיו֙ אֲנִ֣י יוֹסֵ֔ף הַע֥וֹד אָבִ֖י חָ֑י וְלֹֽא־יָכְל֤וּ אֶחָיו֙ לַעֲנ֣וֹת אֹת֔וֹ כִּ֥י נִבְהֲל֖וּ מִפָּנָֽיו׃
ספר בראשית/מה	ד	__	{{מ:פסוק|בראשית|מה|ד}}	וַיֹּ֨אמֶר יוֹסֵ֧ף אֶל־אֶחָ֛יו גְּשׁוּ־נָ֥א אֵלַ֖י וַיִּגָּ֑שׁוּ וַיֹּ֗אמֶר אֲנִי֙ יוֹסֵ֣ף אֲחִיכֶ֔ם אֲשֶׁר־מְכַרְתֶּ֥ם אֹתִ֖י מִצְרָֽיְמָה׃
ספר בראשית/מה	ה	__	{{מ:פסוק|בראשית|מה|ה}}	וְעַתָּ֣ה{{מ:לגרמיה}}אַל־תֵּעָ֣צְב֗וּ וְאַל־יִ֙חַר֙ בְּעֵ֣ינֵיכֶ֔ם כִּֽי־מְכַרְתֶּ֥ם אֹתִ֖י הֵ֑נָּה כִּ֣י {{נוסח|לְמִֽחְיָ֔ה|=א(ס)ל <מתג? כן> ובדפוסים}} שְׁלָחַ֥נִי אֱלֹהִ֖ים לִפְנֵיכֶֽם׃
ספר בראשית/מה	ו	__	{{מ:פסוק|בראשית|מה|ו}}	"כִּי־זֶ֛ה שְׁנָתַ֥יִם הָרָעָ֖ב בְּקֶ֣רֶב הָאָ֑רֶץ וְעוֹד֙ חָמֵ֣שׁ שָׁנִ֔ים אֲשֶׁ֥ר אֵין־חָרִ֖ישׁ {{נוסח|וְקָצִֽיר|=ש1 ובדפוסים|ל=וְקָצִּֽיר (צד""י דגושה!)|הערות דותן וברויאר והמקליד}}׃"
ספר בראשית/מה	ז	__	{{מ:פסוק|בראשית|מה|ז}}	וַיִּשְׁלָחֵ֤נִי אֱלֹהִים֙ לִפְנֵיכֶ֔ם לָשׂ֥וּם לָכֶ֛ם שְׁאֵרִ֖ית בָּאָ֑רֶץ וּלְהַחֲי֣וֹת לָכֶ֔ם לִפְלֵיטָ֖ה גְּדֹלָֽה׃
ספר בראשית/מה	ח	__	{{מ:פסוק|בראשית|מה|ח|עלייה=שלישי}}	וְעַתָּ֗ה לֹֽא־אַתֶּ֞ם שְׁלַחְתֶּ֤ם אֹתִי֙ הֵ֔נָּה כִּ֖י הָאֱלֹהִ֑ים וַיְשִׂימֵ֨נִֽי לְאָ֜ב לְפַרְעֹ֗ה וּלְאָדוֹן֙ לְכׇל־בֵּית֔וֹ וּמֹשֵׁ֖ל בְּכׇל־אֶ֥רֶץ מִצְרָֽיִם׃
ספר בראשית/מה	ט	__	{{מ:פסוק|בראשית|מה|ט}}	מַהֲרוּ֮ וַעֲל֣וּ אֶל־אָבִי֒ וַאֲמַרְתֶּ֣ם אֵלָ֗יו כֹּ֤ה אָמַר֙ בִּנְךָ֣ יוֹסֵ֔ף שָׂמַ֧נִי אֱלֹהִ֛ים לְאָד֖וֹן לְכׇל־מִצְרָ֑יִם רְדָ֥ה אֵלַ֖י אַֽל־תַּעֲמֹֽד׃
ספר בראשית/מה	י	__	{{מ:פסוק|בראשית|מה|י}}	וְיָשַׁבְתָּ֣ בְאֶֽרֶץ־גֹּ֗שֶׁן וְהָיִ֤יתָ קָרוֹב֙ אֵלַ֔י אַתָּ֕ה וּבָנֶ֖יךָ וּבְנֵ֣י בָנֶ֑יךָ וְצֹאנְךָ֥ וּבְקָרְךָ֖ וְכׇל־אֲשֶׁר־לָֽךְ׃
