ספר בראשית/לז	0	<noinclude>{{תבנית:טעמי המקרא באינטרנט}}//{{מ:שוליים|5}}//{{תבנית:משתמש:Dovi/טעמי המקרא}}//</noinclude>		
ספר בראשית/מה	יא	__	{{מ:פסוק|בראשית|מה|יא}}	וְכִלְכַּלְתִּ֤י אֹֽתְךָ֙ שָׁ֔ם כִּי־ע֛וֹד חָמֵ֥שׁ שָׁנִ֖ים רָעָ֑ב פֶּן־תִּוָּרֵ֛שׁ אַתָּ֥ה וּבֵֽיתְךָ֖ וְכׇל־אֲשֶׁר־לָֽךְ׃
ספר בראשית/מה	יב	__	{{מ:פסוק|בראשית|מה|יב}}	וְהִנֵּ֤ה עֵֽינֵיכֶם֙ רֹא֔וֹת וְעֵינֵ֖י אָחִ֣י בִנְיָמִ֑ין כִּי־פִ֖י הַֽמְדַבֵּ֥ר אֲלֵיכֶֽם׃
ספר בראשית/מה	יג	__	{{מ:פסוק|בראשית|מה|יג}}	וְהִגַּדְתֶּ֣ם לְאָבִ֗י אֶת־כׇּל־כְּבוֹדִי֙ בְּמִצְרַ֔יִם וְאֵ֖ת כׇּל־אֲשֶׁ֣ר רְאִיתֶ֑ם וּמִֽהַרְתֶּ֛ם וְהוֹרַדְתֶּ֥ם אֶת־אָבִ֖י הֵֽנָּה׃
ספר בראשית/מה	יד	__	{{מ:פסוק|בראשית|מה|יד}}	וַיִּפֹּ֛ל עַל־צַוְּארֵ֥י בִנְיָמִֽן־אָחִ֖יו וַיֵּ֑בְךְּ {{נוסח|וּבִ֨נְיָמִ֔ן|=ש1 ומנהג-א ובדפוסים|ל=וּבִנְיָמִ֔ן (אין מתיגה)|הערת ברויאר}} בָּכָ֖ה עַל־צַוָּארָֽיו׃
ספר בראשית/מה	טו	__	{{מ:פסוק|בראשית|מה|טו}}	"וַיְנַשֵּׁ֥ק לְכׇל־אֶחָ֖יו וַיֵּ֣בְךְּ {{נוסח|עֲלֵהֶ֑ם|=שש1 ומסורת-ל וטברניות ורמ""ה|ל=עֲלֵיהֶ֑ם (כתיב מלא יו""ד)}} וְאַ֣חֲרֵי כֵ֔ן דִּבְּר֥וּ אֶחָ֖יו אִתּֽוֹ׃"
ספר בראשית/מה	טז	__	{{מ:פסוק|בראשית|מה|טז}}	וְהַקֹּ֣ל נִשְׁמַ֗ע בֵּ֤ית פַּרְעֹה֙ לֵאמֹ֔ר בָּ֖אוּ אֲחֵ֣י יוֹסֵ֑ף וַיִּיטַב֙ בְּעֵינֵ֣י פַרְעֹ֔ה וּבְעֵינֵ֖י עֲבָדָֽיו׃
ספר בראשית/מה	יז	__	{{מ:פסוק|בראשית|מה|יז}}	וַיֹּ֤אמֶר פַּרְעֹה֙ אֶל־יוֹסֵ֔ף אֱמֹ֥ר אֶל־אַחֶ֖יךָ זֹ֣את עֲשׂ֑וּ טַֽעֲנוּ֙ אֶת־בְּעִ֣ירְכֶ֔ם וּלְכוּ־בֹ֖אוּ אַ֥רְצָה כְּנָֽעַן׃
ספר בראשית/מה	יח	__	{{מ:פסוק|בראשית|מה|יח}}	וּקְח֧וּ אֶת־אֲבִיכֶ֛ם וְאֶת־בָּתֵּיכֶ֖ם וּבֹ֣אוּ אֵלָ֑י וְאֶתְּנָ֣ה לָכֶ֗ם אֶת־טוּב֙ אֶ֣רֶץ מִצְרַ֔יִם וְאִכְל֖וּ אֶת־חֵ֥לֶב הָאָֽרֶץ׃
ספר בראשית/מה	יט	__	{{מ:פסוק|בראשית|מה|יט|עלייה=רביעי}}	וְאַתָּ֥ה צֻוֵּ֖יתָה זֹ֣את עֲשׂ֑וּ קְחוּ־לָכֶם֩ מֵאֶ֨רֶץ מִצְרַ֜יִם עֲגָל֗וֹת לְטַפְּכֶם֙ וְלִנְשֵׁיכֶ֔ם וּנְשָׂאתֶ֥ם אֶת־אֲבִיכֶ֖ם וּבָאתֶֽם׃
ספר בראשית/מה	כ	__	{{מ:פסוק|בראשית|מה|כ}}	וְעֵ֣ינְכֶ֔ם אַל־תָּחֹ֖ס עַל־כְּלֵיכֶ֑ם כִּי־ט֛וּב כׇּל־אֶ֥רֶץ מִצְרַ֖יִם לָכֶ֥ם הֽוּא׃
ספר בראשית/מה	כא	__	{{מ:פסוק|בראשית|מה|כא}}	וַיַּֽעֲשׂוּ־כֵן֙ בְּנֵ֣י יִשְׂרָאֵ֔ל וַיִּתֵּ֨ן לָהֶ֥ם יוֹסֵ֛ף עֲגָל֖וֹת עַל־פִּ֣י פַרְעֹ֑ה וַיִּתֵּ֥ן לָהֶ֛ם צֵדָ֖ה לַדָּֽרֶךְ׃
ספר בראשית/מה	כב	__	{{מ:פסוק|בראשית|מה|כב}}	לְכֻלָּ֥ם נָתַ֛ן לָאִ֖ישׁ חֲלִפ֣וֹת שְׂמָלֹ֑ת וּלְבִנְיָמִ֤ן נָתַן֙ שְׁלֹ֣שׁ מֵא֣וֹת כֶּ֔סֶף וְחָמֵ֖שׁ חֲלִפֹ֥ת שְׂמָלֹֽת׃
ספר בראשית/מה	כג	__	{{מ:פסוק|בראשית|מה|כג}}	וּלְאָבִ֞יו שָׁלַ֤ח כְּזֹאת֙ עֲשָׂרָ֣ה חֲמֹרִ֔ים נֹשְׂאִ֖ים מִטּ֣וּב מִצְרָ֑יִם וְעֶ֣שֶׂר אֲתֹנֹ֡ת נֹֽ֠שְׂאֹ֠ת בָּ֣ר וָלֶ֧חֶם וּמָז֛וֹן לְאָבִ֖יו לַדָּֽרֶךְ׃
ספר בראשית/מה	כד	__	{{מ:פסוק|בראשית|מה|כד}}	וַיְשַׁלַּ֥ח אֶת־אֶחָ֖יו וַיֵּלֵ֑כוּ וַיֹּ֣אמֶר אֲלֵהֶ֔ם אַֽל־תִּרְגְּז֖וּ בַּדָּֽרֶךְ׃
ספר בראשית/מה	כה	__	{{מ:פסוק|בראשית|מה|כה}}	וַֽיַּעֲל֖וּ מִמִּצְרָ֑יִם וַיָּבֹ֙אוּ֙ אֶ֣רֶץ כְּנַ֔עַן אֶֽל־יַעֲקֹ֖ב אֲבִיהֶֽם׃
ספר בראשית/מה	כו	__	{{מ:פסוק|בראשית|מה|כו}}	וַיַּגִּ֨דוּ ל֜וֹ לֵאמֹ֗ר ע֚וֹד יוֹסֵ֣ף חַ֔י וְכִֽי־ה֥וּא מֹשֵׁ֖ל בְּכׇל־אֶ֣רֶץ מִצְרָ֑יִם וַיָּ֣פׇג לִבּ֔וֹ כִּ֥י לֹא־הֶאֱמִ֖ין לָהֶֽם׃
ספר בראשית/מה	כז	__	{{מ:פסוק|בראשית|מה|כז}}	וַיְדַבְּר֣וּ אֵלָ֗יו אֵ֣ת כׇּל־דִּבְרֵ֤י יוֹסֵף֙ אֲשֶׁ֣ר דִּבֶּ֣ר אֲלֵהֶ֔ם וַיַּרְא֙ אֶת־הָ֣עֲגָל֔וֹת אֲשֶׁר־שָׁלַ֥ח יוֹסֵ֖ף לָשֵׂ֣את אֹת֑וֹ וַתְּחִ֕י ר֖וּחַ יַעֲקֹ֥ב אֲבִיהֶֽם׃
ספר בראשית/מה	כח	__	{{מ:פסוק|בראשית|מה|כח|עלייה=חמישי}}	וַיֹּ֙אמֶר֙ יִשְׂרָאֵ֔ל רַ֛ב עוֹד־יוֹסֵ֥ף בְּנִ֖י חָ֑י אֵֽלְכָ֥ה וְאֶרְאֶ֖נּוּ בְּטֶ֥רֶם אָמֽוּת׃
ספר בראשית/מה	תתת	<noinclude>//{{תבנית:משתמש:Dovi/טעמי המקרא-סוף}}//{{מ:שוליים-סוף}}//==הפרק בלי מספרים==//{{תבנית:משתמש:Dovi/טעמי המקרא}}//{{#בלי קטע:{{שם הדף המלא}}|סימן}}//{{תבנית:משתמש:Dovi/טעמי המקרא-סוף}}</noinclude>		
ספר בראשית/מו	0	<noinclude>{{תבנית:טעמי המקרא באינטרנט}}//{{מ:שוליים|5}}//{{תבנית:משתמש:Dovi/טעמי המקרא}}//</noinclude>		
ספר בראשית/מו	א	{{מ:אין פרשה בתחילת פרק}}	{{מ:פסוק|בראשית|מו|א}}	וַיִּסַּ֤ע יִשְׂרָאֵל֙ וְכׇל־אֲשֶׁר־ל֔וֹ וַיָּבֹ֖א בְּאֵ֣רָה שָּׁ֑בַע וַיִּזְבַּ֣ח זְבָחִ֔ים לֵאלֹהֵ֖י אָבִ֥יו יִצְחָֽק׃
ספר בראשית/מו	ב	__	{{מ:פסוק|בראשית|מו|ב}}	וַיֹּ֨אמֶר אֱלֹהִ֤ים{{מ:פסק}}לְיִשְׂרָאֵל֙ בְּמַרְאֹ֣ת הַלַּ֔יְלָה וַיֹּ֖אמֶר יַעֲקֹ֣ב{{מ:פסק}}יַעֲקֹ֑ב וַיֹּ֖אמֶר הִנֵּֽנִי׃
ספר בראשית/מו	ג	__	{{מ:פסוק|בראשית|מו|ג}}	וַיֹּ֕אמֶר אָנֹכִ֥י הָאֵ֖ל אֱלֹהֵ֣י אָבִ֑יךָ אַל־תִּירָא֙ מֵרְדָ֣ה מִצְרַ֔יְמָה כִּֽי־לְג֥וֹי גָּד֖וֹל אֲשִֽׂימְךָ֥ שָֽׁם׃
ספר בראשית/מו	ד	__	{{מ:פסוק|בראשית|מו|ד}}	אָנֹכִ֗י אֵרֵ֤ד עִמְּךָ֙ מִצְרַ֔יְמָה וְאָנֹכִ֖י אַֽעַלְךָ֣ גַם־עָלֹ֑ה וְיוֹסֵ֕ף יָשִׁ֥ית יָד֖וֹ עַל־עֵינֶֽיךָ׃
ספר בראשית/מו	ה	__	{{מ:פסוק|בראשית|מו|ה}}	וַיָּ֥קׇם יַעֲקֹ֖ב מִבְּאֵ֣ר שָׁ֑בַע וַיִּשְׂא֨וּ בְנֵֽי־יִשְׂרָאֵ֜ל אֶת־יַעֲקֹ֣ב אֲבִיהֶ֗ם וְאֶת־טַפָּם֙ וְאֶת־נְשֵׁיהֶ֔ם בָּעֲגָל֕וֹת אֲשֶׁר־שָׁלַ֥ח פַּרְעֹ֖ה לָשֵׂ֥את אֹתֽוֹ׃
ספר בראשית/מו	ו	__	{{מ:פסוק|בראשית|מו|ו}}	וַיִּקְח֣וּ אֶת־מִקְנֵיהֶ֗ם וְאֶת־רְכוּשָׁם֙ אֲשֶׁ֤ר רָֽכְשׁוּ֙ בְּאֶ֣רֶץ כְּנַ֔עַן וַיָּבֹ֖אוּ מִצְרָ֑יְמָה יַעֲקֹ֖ב וְכׇל־זַרְע֥וֹ אִתּֽוֹ׃
ספר בראשית/מו	ז	__	{{מ:פסוק|בראשית|מו|ז}}	בָּנָ֞יו וּבְנֵ֤י בָנָיו֙ אִתּ֔וֹ בְּנֹתָ֛יו וּבְנ֥וֹת בָּנָ֖יו וְכׇל־זַרְע֑וֹ הֵבִ֥יא אִתּ֖וֹ מִצְרָֽיְמָה׃
ספר בראשית/מו	ח	//{{סס}}	{{מ:פסוק|בראשית|מו|ח}}	וְאֵ֨לֶּה שְׁמ֧וֹת בְּנֵֽי־יִשְׂרָאֵ֛ל הַבָּאִ֥ים מִצְרַ֖יְמָה יַעֲקֹ֣ב וּבָנָ֑יו בְּכֹ֥ר יַעֲקֹ֖ב רְאוּבֵֽן׃
ספר בראשית/מו	ט	__	{{מ:פסוק|בראשית|מו|ט}}	"וּבְנֵ֖י רְאוּבֵ֑ן חֲנ֥וֹךְ וּפַלּ֖וּא {{נוסח|וְחֶצְרֹ֥ן|=שש1 ומסורות טברניות ורמ""ה|ל=וְחֶצְר֥וֹן (כתיב מלא וי""ו)|הערת ברויאר}} וְכַרְמִֽי׃"
ספר בראשית/מו	י	__	{{מ:פסוק|בראשית|מו|י}}	וּבְנֵ֣י שִׁמְע֗וֹן יְמוּאֵ֧ל וְיָמִ֛ין וְאֹ֖הַד וְיָכִ֣ין וְצֹ֑חַר וְשָׁא֖וּל בֶּן־הַֽכְּנַעֲנִֽית׃
ספר בראשית/מו	יא	__	{{מ:פסוק|בראשית|מו|יא}}	וּבְנֵ֖י לֵוִ֑י גֵּרְשׁ֕וֹן קְהָ֖ת וּמְרָרִֽי׃
ספר בראשית/מו	יב	__	{{מ:פסוק|בראשית|מו|יב}}	"וּבְנֵ֣י יְהוּדָ֗ה עֵ֧ר וְאוֹנָ֛ן וְשֵׁלָ֖ה וָפֶ֣רֶץ וָזָ֑רַח וַיָּ֨מׇת עֵ֤ר וְאוֹנָן֙ בְּאֶ֣רֶץ כְּנַ֔עַן וַיִּהְי֥וּ בְנֵי־פֶ֖רֶץ {{נוסח|חֶצְרֹ֥ן|=שש1 ומסורות טברניות ורמ""ה|ל=חֶצְר֥וֹן (כתיב מלא וי""ו)|הערת ברויאר}} וְחָמֽוּל׃"
ספר בראשית/מו	יג	__	{{מ:פסוק|בראשית|מו|יג}}	"וּבְנֵ֖י {{נוסח|יִשָּׂשכָ֑ר|=ש ובדפוסים|ל=יִשָׂשכָ֑ר (אין דגש)|הערת ברויאר}} תּוֹלָ֥ע {{נוסח|וּפֻוָ֖ה|=שש1 (וכן הכריעו ברויאר ומג""ה, וכן הוא במכון ממרא); וראו גם מבדבר כו,כג|ל=וּפֻוָּ֖ה (וי""ו דגושה) וכן הוא בדפוסים ובקורן ובסימנים|הערת ברויאר}} וְי֥וֹב {{נוסח|וְשִׁמְרֹֽן|=שש1 ורמ""ה|ל=וְשִׁמְרֽוֹן (כתיב מלא וי""ו)|הערת ברויאר}}׃"
ספר בראשית/מו	יד	__	{{מ:פסוק|בראשית|מו|יד}}	"וּבְנֵ֖י {{נוסח|זְבֻל֑וּן|=ש1 ומסורת-אל וטברניות ורמ""ה (כתיב חסר וי""ו ומלא וי""ו)|ל=זְבוּלֻ֑ן (כתיב מלא וי""ו וחסר וי""ו)|הערת ברויאר}} סֶ֥רֶד וְאֵל֖וֹן וְיַחְלְאֵֽל׃"
ספר בראשית/מו	טו	__	{{מ:פסוק|בראשית|מו|טו}}	אֵ֣לֶּה{{מ:לגרמיה}}בְּנֵ֣י לֵאָ֗ה אֲשֶׁ֨ר יָֽלְדָ֤ה לְיַעֲקֹב֙ בְּפַדַּ֣ן אֲרָ֔ם וְאֵ֖ת דִּינָ֣ה בִתּ֑וֹ כׇּל־נֶ֧פֶשׁ בָּנָ֛יו וּבְנוֹתָ֖יו שְׁלֹשִׁ֥ים וְשָׁלֹֽשׁ׃
ספר בראשית/מו	טז	__	{{מ:פסוק|בראשית|מו|טז}}	וּבְנֵ֣י גָ֔ד צִפְי֥וֹן וְחַגִּ֖י שׁוּנִ֣י וְאֶצְבֹּ֑ן עֵרִ֥י וַֽאֲרוֹדִ֖י וְאַרְאֵלִֽי׃
ספר בראשית/מו	יז	__	{{מ:פסוק|בראשית|מו|יז}}	וּבְנֵ֣י אָשֵׁ֗ר יִמְנָ֧ה וְיִשְׁוָ֛ה וְיִשְׁוִ֥י וּבְרִיעָ֖ה וְשֶׂ֣רַח אֲחֹתָ֑ם וּבְנֵ֣י בְרִיעָ֔ה חֶ֖בֶר וּמַלְכִּיאֵֽל׃
ספר בראשית/מו	יח	__	{{מ:פסוק|בראשית|מו|יח}}	אֵ֚לֶּה בְּנֵ֣י זִלְפָּ֔ה אֲשֶׁר־נָתַ֥ן לָבָ֖ן לְלֵאָ֣ה בִתּ֑וֹ וַתֵּ֤לֶד אֶת־אֵ֙לֶּה֙ לְיַעֲקֹ֔ב שֵׁ֥שׁ עֶשְׂרֵ֖ה נָֽפֶשׁ׃
ספר בראשית/מו	יט	__	{{מ:פסוק|בראשית|מו|יט}}	בְּנֵ֤י רָחֵל֙ אֵ֣שֶׁת {{נוסח|יַֽעֲקֹ֔ב|=ל (בגעיה) כן בהקלדה מגירסה 4.12; רואים היטב את הגעיה מתחת לפתח למרות הטשטוש (ואולי נסיון המחיקה?)|אבל לפי ברויאר ודותן ל=יַעֲקֹ֔ב (אין געיה)}} יוֹסֵ֖ף וּבִנְיָמִֽן׃
ספר בראשית/מו	כ	__	{{מ:פסוק|בראשית|מו|כ}}	וַיִּוָּלֵ֣ד לְיוֹסֵף֮ בְּאֶ֣רֶץ מִצְרַ֒יִם֒ אֲשֶׁ֤ר יָֽלְדָה־לּוֹ֙ אָֽסְנַ֔ת בַּת־{{נוסח|פּ֥וֹטִי פֶ֖רַע|ראו הערה לעיל בפרשת מקץ (בראשית מא, מה)}}{{מ:הערה|בספרי תימן פּֽוֹטִיפֶ֖רַע בתיבה אחת}} כֹּהֵ֣ן אֹ֑ן אֶת־מְנַשֶּׁ֖ה וְאֶת־אֶפְרָֽיִם׃
ספר בראשית/מו	כא	__	{{מ:פסוק|בראשית|מו|כא}}	וּבְנֵ֣י בִנְיָמִ֗ן בֶּ֤לַע וָבֶ֙כֶר֙ וְאַשְׁבֵּ֔ל גֵּרָ֥א וְנַעֲמָ֖ן אֵחִ֣י וָרֹ֑אשׁ מֻפִּ֥ים וְחֻפִּ֖ים וָאָֽרְדְּ׃
ספר בראשית/מו	כב	__	{{מ:פסוק|בראשית|מו|כב}}	אֵ֚לֶּה בְּנֵ֣י רָחֵ֔ל אֲשֶׁ֥ר יֻלַּ֖ד לְיַעֲקֹ֑ב כׇּל־נֶ֖פֶשׁ אַרְבָּעָ֥ה עָשָֽׂר׃
ספר בראשית/מו	כג	__	{{מ:פסוק|בראשית|מו|כג}}	וּבְנֵי־דָ֖ן חֻשִֽׁים׃
ספר בראשית/מו	כד	__	{{מ:פסוק|בראשית|מו|כד}}	וּבְנֵ֖י נַפְתָּלִ֑י יַחְצְאֵ֥ל וְגוּנִ֖י וְיֵ֥צֶר וְשִׁלֵּֽם׃
ספר בראשית/מו	כה	__	{{מ:פסוק|בראשית|מו|כה}}	אֵ֚לֶּה בְּנֵ֣י בִלְהָ֔ה אֲשֶׁר־נָתַ֥ן לָבָ֖ן לְרָחֵ֣ל בִּתּ֑וֹ וַתֵּ֧לֶד אֶת־אֵ֛לֶּה לְיַעֲקֹ֖ב כׇּל־נֶ֥פֶשׁ שִׁבְעָֽה׃
ספר בראשית/מו	כו	__	{{מ:פסוק|בראשית|מו|כו}}	כׇּל־הַ֠נֶּ֠פֶשׁ הַבָּאָ֨ה לְיַעֲקֹ֤ב מִצְרַ֙יְמָה֙ יֹצְאֵ֣י יְרֵכ֔וֹ מִלְּבַ֖ד נְשֵׁ֣י בְנֵי־יַעֲקֹ֑ב כׇּל־נֶ֖פֶשׁ שִׁשִּׁ֥ים וָשֵֽׁשׁ׃
ספר בראשית/מו	כז	__	{{מ:פסוק|בראשית|מו|כז}}	וּבְנֵ֥י יוֹסֵ֛ף אֲשֶׁר־יֻלַּד־ל֥וֹ בְמִצְרַ֖יִם נֶ֣פֶשׁ שְׁנָ֑יִם כׇּל־הַנֶּ֧פֶשׁ לְבֵֽית־יַעֲקֹ֛ב הַבָּ֥אָה מִצְרַ֖יְמָה שִׁבְעִֽים׃
ספר בראשית/מו	כח	//{{נוסח|{{סס}}|ל=פרשה פתוחה}}	{{מ:פסוק|בראשית|מו|כח|סדר=מא|עלייה=ששי}}	וְאֶת־יְהוּדָ֞ה שָׁלַ֤ח לְפָנָיו֙ אֶל־יוֹסֵ֔ף לְהוֹרֹ֥ת לְפָנָ֖יו גֹּ֑שְׁנָה וַיָּבֹ֖אוּ אַ֥רְצָה גֹּֽשֶׁן׃
ספר בראשית/מו	כט	__	{{מ:פסוק|בראשית|מו|כט}}	וַיֶּאְסֹ֤ר יוֹסֵף֙ מֶרְכַּבְתּ֔וֹ וַיַּ֛עַל לִקְרַֽאת־יִשְׂרָאֵ֥ל אָבִ֖יו גֹּ֑שְׁנָה וַיֵּרָ֣א אֵלָ֗יו וַיִּפֹּל֙ עַל־צַוָּארָ֔יו וַיֵּ֥בְךְּ עַל־צַוָּארָ֖יו עֽוֹד׃
ספר בראשית/מו	ל	__	{{מ:פסוק|בראשית|מו|ל}}	וַיֹּ֧אמֶר יִשְׂרָאֵ֛ל אֶל־יוֹסֵ֖ף אָמ֣וּתָה הַפָּ֑עַם אַחֲרֵי֙ רְאוֹתִ֣י אֶת־פָּנֶ֔יךָ כִּ֥י עוֹדְךָ֖ חָֽי׃
ספר בראשית/מו	לא	__	{{מ:פסוק|בראשית|מו|לא}}	וַיֹּ֨אמֶר יוֹסֵ֤ף אֶל־אֶחָיו֙ וְאֶל־בֵּ֣ית אָבִ֔יו אֶעֱלֶ֖ה וְאַגִּ֣ידָה לְפַרְעֹ֑ה וְאֹֽמְרָ֣ה אֵלָ֔יו אַחַ֧י וּבֵית־אָבִ֛י אֲשֶׁ֥ר בְּאֶֽרֶץ־כְּנַ֖עַן בָּ֥אוּ אֵלָֽי׃
ספר בראשית/מו	לב	__	{{מ:פסוק|בראשית|מו|לב}}	וְהָאֲנָשִׁים֙ רֹ֣עֵי צֹ֔אן כִּֽי־אַנְשֵׁ֥י מִקְנֶ֖ה הָי֑וּ וְצֹאנָ֧ם וּבְקָרָ֛ם וְכׇל־אֲשֶׁ֥ר לָהֶ֖ם הֵבִֽיאוּ׃
ספר בראשית/מו	לג	__	{{מ:פסוק|בראשית|מו|לג}}	וְהָיָ֕ה כִּֽי־יִקְרָ֥א לָכֶ֖ם פַּרְעֹ֑ה וְאָמַ֖ר מַה־מַּעֲשֵׂיכֶֽם׃
ספר בראשית/מו	לד	__	{{מ:פסוק|בראשית|מו|לד}}	וַאֲמַרְתֶּ֗ם אַנְשֵׁ֨י מִקְנֶ֜ה הָי֤וּ עֲבָדֶ֙יךָ֙ מִנְּעוּרֵ֣ינוּ וְעַד־עַ֔תָּה גַּם־אֲנַ֖חְנוּ גַּם־אֲבֹתֵ֑ינוּ בַּעֲב֗וּר תֵּשְׁבוּ֙ בְּאֶ֣רֶץ גֹּ֔שֶׁן כִּֽי־תוֹעֲבַ֥ת מִצְרַ֖יִם כׇּל־רֹ֥עֵה צֹֽאן׃
ספר בראשית/מו	תתת	<noinclude>//{{תבנית:משתמש:Dovi/טעמי המקרא-סוף}}//{{מ:שוליים-סוף}}//==הפרק בלי מספרים==//{{תבנית:משתמש:Dovi/טעמי המקרא}}//{{#בלי קטע:{{שם הדף המלא}}|סימן}}//{{תבנית:משתמש:Dovi/טעמי המקרא-סוף}}//==הערות==//{{תבנית:משתמש:Dovi/טעמי המקרא}}//<references/>//{{תבנית:משתמש:Dovi/טעמי המקרא-סוף}}</noinclude>		
ספר בראשית/מז	0	<noinclude>{{תבנית:טעמי המקרא באינטרנט}}//{{מ:שוליים|5}}//{{תבנית:משתמש:Dovi/טעמי המקרא}}//</noinclude>		
ספר בראשית/מז	א	{{מ:אין פרשה בתחילת פרק}}	{{מ:פסוק|בראשית|מז|א}}	וַיָּבֹ֣א יוֹסֵף֮ וַיַּגֵּ֣ד לְפַרְעֹה֒ וַיֹּ֗אמֶר אָבִ֨י וְאַחַ֜י וְצֹאנָ֤ם וּבְקָרָם֙ וְכׇל־אֲשֶׁ֣ר לָהֶ֔ם בָּ֖אוּ מֵאֶ֣רֶץ כְּנָ֑עַן וְהִנָּ֖ם בְּאֶ֥רֶץ גֹּֽשֶׁן׃
ספר בראשית/מז	ב	__	{{מ:פסוק|בראשית|מז|ב}}	וּמִקְצֵ֣ה אֶחָ֔יו לָקַ֖ח חֲמִשָּׁ֣ה אֲנָשִׁ֑ים וַיַּצִּגֵ֖ם לִפְנֵ֥י פַרְעֹֽה׃
ספר בראשית/מז	ג	__	{{מ:פסוק|בראשית|מז|ג}}	וַיֹּ֧אמֶר פַּרְעֹ֛ה אֶל־אֶחָ֖יו מַה־מַּעֲשֵׂיכֶ֑ם וַיֹּאמְר֣וּ אֶל־פַּרְעֹ֗ה רֹעֵ֥ה צֹאן֙ עֲבָדֶ֔יךָ גַּם־אֲנַ֖חְנוּ גַּם־אֲבוֹתֵֽינוּ׃
ספר בראשית/מז	ד	__	{{מ:פסוק|בראשית|מז|ד}}	וַיֹּאמְר֣וּ אֶל־פַּרְעֹ֗ה לָג֣וּר בָּאָ֘רֶץ֮ בָּ֒אנוּ֒ כִּי־אֵ֣ין מִרְעֶ֗ה לַצֹּאן֙ אֲשֶׁ֣ר לַעֲבָדֶ֔יךָ כִּֽי־כָבֵ֥ד הָרָעָ֖ב בְּאֶ֣רֶץ כְּנָ֑עַן וְעַתָּ֛ה יֵֽשְׁבוּ־נָ֥א עֲבָדֶ֖יךָ בְּאֶ֥רֶץ גֹּֽשֶׁן׃
ספר בראשית/מז	ה	__	{{מ:פסוק|בראשית|מז|ה}}	וַיֹּ֣אמֶר פַּרְעֹ֔ה אֶל־יוֹסֵ֖ף לֵאמֹ֑ר אָבִ֥יךָ וְאַחֶ֖יךָ בָּ֥אוּ אֵלֶֽיךָ׃
ספר בראשית/מז	ו	__	{{מ:פסוק|בראשית|מז|ו}}	אֶ֤רֶץ מִצְרַ֙יִם֙ לְפָנֶ֣יךָ הִ֔וא בְּמֵיטַ֣ב הָאָ֔רֶץ הוֹשֵׁ֥ב אֶת־אָבִ֖יךָ וְאֶת־אַחֶ֑יךָ יֵשְׁבוּ֙ בְּאֶ֣רֶץ גֹּ֔שֶׁן וְאִם־יָדַ֗עְתָּ וְיֶשׁ־בָּם֙ אַנְשֵׁי־חַ֔יִל וְשַׂמְתָּ֛ם שָׂרֵ֥י מִקְנֶ֖ה עַל־אֲשֶׁר־לִֽי׃
ספר בראשית/מז	ז	__	{{מ:פסוק|בראשית|מז|ז}}	וַיָּבֵ֤א יוֹסֵף֙ אֶת־יַֽעֲקֹ֣ב אָבִ֔יו וַיַּֽעֲמִדֵ֖הוּ לִפְנֵ֣י פַרְעֹ֑ה וַיְבָ֥רֶךְ יַעֲקֹ֖ב אֶת־פַּרְעֹֽה׃
ספר בראשית/מז	ח	__	{{מ:פסוק|בראשית|מז|ח}}	וַיֹּ֥אמֶר פַּרְעֹ֖ה אֶֽל־יַעֲקֹ֑ב כַּמָּ֕ה יְמֵ֖י שְׁנֵ֥י חַיֶּֽיךָ׃
ספר בראשית/מז	ט	__	{{מ:פסוק|בראשית|מז|ט}}	וַיֹּ֤אמֶר יַעֲקֹב֙ אֶל־פַּרְעֹ֔ה יְמֵי֙ שְׁנֵ֣י מְגוּרַ֔י שְׁלֹשִׁ֥ים וּמְאַ֖ת שָׁנָ֑ה מְעַ֣ט וְרָעִ֗ים הָיוּ֙ יְמֵי֙ שְׁנֵ֣י חַיַּ֔י וְלֹ֣א הִשִּׂ֗יגוּ אֶת־יְמֵי֙ שְׁנֵי֙ חַיֵּ֣י אֲבֹתַ֔י בִּימֵ֖י מְגוּרֵיהֶֽם׃
ספר בראשית/מז	י	__	{{מ:פסוק|בראשית|מז|י}}	וַיְבָ֥רֶךְ יַעֲקֹ֖ב אֶת־פַּרְעֹ֑ה וַיֵּצֵ֖א מִלִּפְנֵ֥י פַרְעֹֽה׃
ספר בראשית/מז	יא	__	{{מ:פסוק|בראשית|מז|יא|עלייה=שביעי}}	וַיּוֹשֵׁ֣ב יוֹסֵף֮ אֶת־אָבִ֣יו וְאֶת־אֶחָיו֒ וַיִּתֵּ֨ן לָהֶ֤ם אֲחֻזָּה֙ בְּאֶ֣רֶץ מִצְרַ֔יִם בְּמֵיטַ֥ב הָאָ֖רֶץ בְּאֶ֣רֶץ רַעְמְסֵ֑ס כַּאֲשֶׁ֖ר צִוָּ֥ה פַרְעֹֽה׃
ספר בראשית/מז	יב	__	{{מ:פסוק|בראשית|מז|יב}}	וַיְכַלְכֵּ֤ל יוֹסֵף֙ אֶת־אָבִ֣יו וְאֶת־אֶחָ֔יו וְאֵ֖ת כׇּל־בֵּ֣ית אָבִ֑יו לֶ֖חֶם לְפִ֥י הַטָּֽף׃
ספר בראשית/מז	יג	__	{{מ:פסוק|בראשית|מז|יג}}	וְלֶ֤חֶם אֵין֙ בְּכׇל־הָאָ֔רֶץ כִּֽי־כָבֵ֥ד הָרָעָ֖ב מְאֹ֑ד וַתֵּ֜לַהּ אֶ֤רֶץ מִצְרַ֙יִם֙ וְאֶ֣רֶץ כְּנַ֔עַן מִפְּנֵ֖י הָרָעָֽב׃
ספר בראשית/מז	יד	__	{{מ:פסוק|בראשית|מז|יד}}	וַיְלַקֵּ֣ט יוֹסֵ֗ף אֶת־כׇּל־הַכֶּ֙סֶף֙ הַנִּמְצָ֤א בְאֶֽרֶץ־מִצְרַ֙יִם֙ וּבְאֶ֣רֶץ כְּנַ֔עַן בַּשֶּׁ֖בֶר אֲשֶׁר־הֵ֣ם שֹׁבְרִ֑ים וַיָּבֵ֥א יוֹסֵ֛ף אֶת־הַכֶּ֖סֶף בֵּ֥יתָה פַרְעֹֽה׃
ספר בראשית/מז	טו	__	{{מ:פסוק|בראשית|מז|טו}}	וַיִּתֹּ֣ם הַכֶּ֗סֶף מֵאֶ֣רֶץ מִצְרַ֘יִם֮ וּמֵאֶ֣רֶץ כְּנַ֒עַן֒ וַיָּבֹ֩אוּ֩ כׇל־מִצְרַ֨יִם אֶל־יוֹסֵ֤ף לֵאמֹר֙ הָֽבָה־לָּ֣נוּ לֶ֔חֶם וְלָ֥מָּה נָמ֖וּת נֶגְדֶּ֑ךָ כִּ֥י אָפֵ֖ס כָּֽסֶף׃
ספר בראשית/מז	טז	__	{{מ:פסוק|בראשית|מז|טז}}	וַיֹּ֤אמֶר יוֹסֵף֙ הָב֣וּ מִקְנֵיכֶ֔ם וְאֶתְּנָ֥ה לָכֶ֖ם בְּמִקְנֵיכֶ֑ם אִם־אָפֵ֖ס כָּֽסֶף׃
ספר בראשית/מז	יז	__	{{מ:פסוק|בראשית|מז|יז}}	וַיָּבִ֣יאוּ אֶת־מִקְנֵיהֶם֮ אֶל־יוֹסֵף֒ וַיִּתֵּ֣ן לָהֶם֩ יוֹסֵ֨ף לֶ֜חֶם בַּסּוּסִ֗ים וּבְמִקְנֵ֥ה הַצֹּ֛אן וּבְמִקְנֵ֥ה הַבָּקָ֖ר וּבַחֲמֹרִ֑ים וַיְנַהֲלֵ֤ם בַּלֶּ֙חֶם֙ בְּכׇל־מִקְנֵהֶ֔ם בַּשָּׁנָ֖ה הַהִֽוא׃
ספר בראשית/מז	יח	__	{{מ:פסוק|בראשית|מז|יח}}	וַתִּתֹּם֮ הַשָּׁנָ֣ה הַהִוא֒ וַיָּבֹ֨אוּ אֵלָ֜יו בַּשָּׁנָ֣ה הַשֵּׁנִ֗ית וַיֹּ֤אמְרוּ לוֹ֙ לֹֽא־נְכַחֵ֣ד מֵֽאֲדֹנִ֔י כִּ֚י אִם־תַּ֣ם הַכֶּ֔סֶף וּמִקְנֵ֥ה הַבְּהֵמָ֖ה אֶל־אֲדֹנִ֑י לֹ֤א נִשְׁאַר֙ לִפְנֵ֣י אֲדֹנִ֔י בִּלְתִּ֥י אִם־גְּוִיָּתֵ֖נוּ וְאַדְמָתֵֽנוּ׃
ספר בראשית/מז	יט	__	{{מ:פסוק|בראשית|מז|יט}}	לָ֧מָּה נָמ֣וּת לְעֵינֶ֗יךָ גַּם־אֲנַ֙חְנוּ֙ גַּ֣ם אַדְמָתֵ֔נוּ קְנֵֽה־אֹתָ֥נוּ וְאֶת־אַדְמָתֵ֖נוּ בַּלָּ֑חֶם וְנִֽהְיֶ֞ה אֲנַ֤חְנוּ וְאַדְמָתֵ֙נוּ֙ עֲבָדִ֣ים לְפַרְעֹ֔ה וְתֶן־זֶ֗רַע וְנִֽחְיֶה֙ וְלֹ֣א נָמ֔וּת וְהָאֲדָמָ֖ה לֹ֥א תֵשָֽׁם׃
ספר בראשית/מז	כ	__	{{מ:פסוק|בראשית|מז|כ}}	וַיִּ֨קֶן יוֹסֵ֜ף אֶת־כׇּל־אַדְמַ֤ת מִצְרַ֙יִם֙ לְפַרְעֹ֔ה כִּֽי־מָכְר֤וּ מִצְרַ֙יִם֙ אִ֣ישׁ שָׂדֵ֔הוּ כִּֽי־חָזַ֥ק עֲלֵהֶ֖ם הָרָעָ֑ב וַתְּהִ֥י הָאָ֖רֶץ לְפַרְעֹֽה׃
ספר בראשית/מז	כא	__	{{מ:פסוק|בראשית|מז|כא}}	וְאֶ֨ת־הָעָ֔ם הֶעֱבִ֥יר אֹת֖וֹ לֶעָרִ֑ים מִקְצֵ֥ה גְבוּל־מִצְרַ֖יִם וְעַד־קָצֵֽהוּ׃
