ספר בראשית/לז	0	<noinclude>{{תבנית:טעמי המקרא באינטרנט}}//{{מ:שוליים|5}}//{{תבנית:משתמש:Dovi/טעמי המקרא}}//</noinclude>		
ספר בראשית/לז	א	{{פפ}}//	{{מ:פסוק|בראשית|לז|א|סדר=לג|עלייה='''וישב'''|עלייה ראשונה=כן}}	וַיֵּ֣שֶׁב יַעֲקֹ֔ב בְּאֶ֖רֶץ מְגוּרֵ֣י אָבִ֑יו בְּאֶ֖רֶץ כְּנָֽעַן׃
ספר בראשית/לז	ב	__	{{מ:פסוק|בראשית|לז|ב}}	אֵ֣לֶּה{{מ:לגרמיה}}תֹּלְד֣וֹת יַעֲקֹ֗ב יוֹסֵ֞ף בֶּן־שְׁבַֽע־עֶשְׂרֵ֤ה שָׁנָה֙ הָיָ֨ה רֹעֶ֤ה אֶת־אֶחָיו֙ בַּצֹּ֔אן וְה֣וּא נַ֗עַר אֶת־בְּנֵ֥י בִלְהָ֛ה וְאֶת־בְּנֵ֥י זִלְפָּ֖ה נְשֵׁ֣י אָבִ֑יו וַיָּבֵ֥א יוֹסֵ֛ף אֶת־דִּבָּתָ֥ם רָעָ֖ה אֶל־אֲבִיהֶֽם׃
ספר בראשית/לז	ג	__	{{מ:פסוק|בראשית|לז|ג}}	וְיִשְׂרָאֵ֗ל אָהַ֤ב אֶת־יוֹסֵף֙ מִכׇּל־בָּנָ֔יו כִּֽי־בֶן־זְקֻנִ֥ים ה֖וּא ל֑וֹ וְעָ֥שָׂה ל֖וֹ כְּתֹ֥נֶת פַּסִּֽים׃
ספר בראשית/לז	ד	__	{{מ:פסוק|בראשית|לז|ד|עלייה=[לוי]}}	וַיִּרְא֣וּ אֶחָ֗יו כִּֽי־אֹת֞וֹ אָהַ֤ב אֲבִיהֶם֙ מִכׇּל־אֶחָ֔יו וַֽיִּשְׂנְא֖וּ אֹת֑וֹ וְלֹ֥א יָכְל֖וּ דַּבְּר֥וֹ לְשָׁלֹֽם׃
ספר בראשית/לז	ה	__	{{מ:פסוק|בראשית|לז|ה}}	וַיַּחֲלֹ֤ם יוֹסֵף֙ חֲל֔וֹם וַיַּגֵּ֖ד לְאֶחָ֑יו וַיּוֹסִ֥פוּ ע֖וֹד שְׂנֹ֥א אֹתֽוֹ׃
ספר בראשית/לז	ו	__	{{מ:פסוק|בראשית|לז|ו}}	וַיֹּ֖אמֶר אֲלֵיהֶ֑ם שִׁמְעוּ־נָ֕א הַחֲל֥וֹם הַזֶּ֖ה אֲשֶׁ֥ר חָלָֽמְתִּי׃
ספר בראשית/לז	ז	__	{{מ:פסוק|בראשית|לז|ז}}	וְ֠הִנֵּ֠ה אֲנַ֜חְנוּ מְאַלְּמִ֤ים אֲלֻמִּים֙ בְּת֣וֹךְ הַשָּׂדֶ֔ה וְהִנֵּ֛ה קָ֥מָה אֲלֻמָּתִ֖י וְגַם־נִצָּ֑בָה וְהִנֵּ֤ה תְסֻבֶּ֙ינָה֙ אֲלֻמֹּ֣תֵיכֶ֔ם וַתִּֽשְׁתַּחֲוֶ֖יןָ לַאֲלֻמָּתִֽי׃
ספר בראשית/לז	ח	__	{{מ:פסוק|בראשית|לז|ח|עלייה=[ישראל]}}	וַיֹּ֤אמְרוּ לוֹ֙ אֶחָ֔יו הֲמָלֹ֤ךְ תִּמְלֹךְ֙ עָלֵ֔ינוּ אִם־מָשׁ֥וֹל תִּמְשֹׁ֖ל בָּ֑נוּ וַיּוֹסִ֤פוּ עוֹד֙ שְׂנֹ֣א אֹת֔וֹ עַל־חֲלֹמֹתָ֖יו וְעַל־דְּבָרָֽיו׃
ספר בראשית/לז	ט	__	{{מ:פסוק|בראשית|לז|ט}}	וַיַּחֲלֹ֥ם עוֹד֙ חֲל֣וֹם אַחֵ֔ר וַיְסַפֵּ֥ר אֹת֖וֹ לְאֶחָ֑יו וַיֹּ֗אמֶר הִנֵּ֨ה חָלַ֤מְתִּֽי חֲלוֹם֙ ע֔וֹד וְהִנֵּ֧ה הַשֶּׁ֣מֶשׁ וְהַיָּרֵ֗חַ וְאַחַ֤ד עָשָׂר֙ כּֽוֹכָבִ֔ים מִֽשְׁתַּחֲוִ֖ים לִֽי׃
ספר בראשית/לז	י	__	{{מ:פסוק|בראשית|לז|י}}	וַיְסַפֵּ֣ר אֶל־אָבִיו֮ וְאֶל־אֶחָיו֒ וַיִּגְעַר־בּ֣וֹ אָבִ֔יו וַיֹּ֣אמֶר ל֔וֹ מָ֛ה הַחֲל֥וֹם הַזֶּ֖ה אֲשֶׁ֣ר חָלָ֑מְתָּ הֲב֣וֹא נָב֗וֹא אֲנִי֙ וְאִמְּךָ֣ וְאַחֶ֔יךָ לְהִשְׁתַּחֲוֺ֥ת לְךָ֖ אָֽרְצָה׃
ספר בראשית/לז	יא	__	{{מ:פסוק|בראשית|לז|יא}}	וַיְקַנְאוּ־ב֖וֹ אֶחָ֑יו וְאָבִ֖יו שָׁמַ֥ר אֶת־הַדָּבָֽר׃
ספר בראשית/לז	יב	__	{{מ:פסוק|בראשית|לז|יב|עלייה=שני}}	וַיֵּלְכ֖וּ אֶחָ֑יו לִרְע֛וֹת {{מ:אות מנוקדת|אֶׄתׄ־צֹ֥אן}} אֲבִיהֶ֖ם בִּשְׁכֶֽם׃
ספר בראשית/לז	יג	__	{{מ:פסוק|בראשית|לז|יג}}	וַיֹּ֨אמֶר יִשְׂרָאֵ֜ל אֶל־יוֹסֵ֗ף הֲל֤וֹא אַחֶ֙יךָ֙ רֹעִ֣ים בִּשְׁכֶ֔ם לְכָ֖ה וְאֶשְׁלָחֲךָ֣ אֲלֵיהֶ֑ם וַיֹּ֥אמֶר ל֖וֹ הִנֵּֽנִי׃
ספר בראשית/לז	יד	__	{{מ:פסוק|בראשית|לז|יד}}	וַיֹּ֣אמֶר ל֗וֹ לֶךְ־נָ֨א רְאֵ֜ה אֶת־שְׁל֤וֹם אַחֶ֙יךָ֙ וְאֶת־שְׁל֣וֹם הַצֹּ֔אן וַהֲשִׁבֵ֖נִי דָּבָ֑ר וַיִּשְׁלָחֵ֙הוּ֙ מֵעֵ֣מֶק חֶבְר֔וֹן וַיָּבֹ֖א שְׁכֶֽמָה׃
ספר בראשית/לז	טו	__	{{מ:פסוק|בראשית|לז|טו}}	וַיִּמְצָאֵ֣הוּ אִ֔ישׁ וְהִנֵּ֥ה תֹעֶ֖ה בַּשָּׂדֶ֑ה וַיִּשְׁאָלֵ֧הוּ הָאִ֛ישׁ לֵאמֹ֖ר מַה־תְּבַקֵּֽשׁ׃
ספר בראשית/לז	טז	__	{{מ:פסוק|בראשית|לז|טז}}	וַיֹּ֕אמֶר אֶת־אַחַ֖י אָנֹכִ֣י מְבַקֵּ֑שׁ הַגִּֽידָה־נָּ֣א לִ֔י אֵיפֹ֖ה הֵ֥ם רֹעִֽים׃
ספר בראשית/לז	יז	__	{{מ:פסוק|בראשית|לז|יז}}	וַיֹּ֤אמֶר הָאִישׁ֙ נָסְע֣וּ מִזֶּ֔ה כִּ֤י שָׁמַ֙עְתִּי֙ אֹֽמְרִ֔ים נֵלְכָ֖ה דֹּתָ֑יְנָה וַיֵּ֤לֶךְ יוֹסֵף֙ אַחַ֣ר אֶחָ֔יו וַיִּמְצָאֵ֖ם בְּדֹתָֽן׃
ספר בראשית/לז	יח	__	{{מ:פסוק|בראשית|לז|יח}}	וַיִּרְא֥וּ אֹת֖וֹ מֵרָחֹ֑ק וּבְטֶ֙רֶם֙ יִקְרַ֣ב אֲלֵיהֶ֔ם וַיִּֽתְנַכְּל֥וּ אֹת֖וֹ לַהֲמִיתֽוֹ׃
ספר בראשית/לז	יט	__	{{מ:פסוק|בראשית|לז|יט}}	וַיֹּאמְר֖וּ אִ֣ישׁ אֶל־אָחִ֑יו הִנֵּ֗ה בַּ֛עַל הַחֲלֹמ֥וֹת הַלָּזֶ֖ה בָּֽא׃
ספר בראשית/לז	כ	__	{{מ:פסוק|בראשית|לז|כ}}	וְעַתָּ֣ה{{מ:לגרמיה}}לְכ֣וּ וְנַֽהַרְגֵ֗הוּ וְנַשְׁלִכֵ֙הוּ֙ בְּאַחַ֣ד הַבֹּר֔וֹת וְאָמַ֕רְנוּ חַיָּ֥ה רָעָ֖ה אֲכָלָ֑תְהוּ וְנִרְאֶ֕ה מַה־יִּהְי֖וּ חֲלֹמֹתָֽיו׃
ספר בראשית/לז	כא	__	{{מ:פסוק|בראשית|לז|כא}}	וַיִּשְׁמַ֣ע רְאוּבֵ֔ן וַיַּצִּלֵ֖הוּ מִיָּדָ֑ם וַיֹּ֕אמֶר לֹ֥א נַכֶּ֖נּוּ נָֽפֶשׁ׃
ספר בראשית/לז	כב	__	{{מ:פסוק|בראשית|לז|כב}}	וַיֹּ֨אמֶר אֲלֵהֶ֣ם{{מ:פסק}}רְאוּבֵן֮ אַל־תִּשְׁפְּכוּ־דָם֒ הַשְׁלִ֣יכוּ אֹת֗וֹ אֶל־הַבּ֤וֹר הַזֶּה֙ אֲשֶׁ֣ר בַּמִּדְבָּ֔ר וְיָ֖ד אַל־תִּשְׁלְחוּ־ב֑וֹ לְמַ֗עַן הַצִּ֤יל אֹתוֹ֙ מִיָּדָ֔ם לַהֲשִׁיב֖וֹ אֶל־אָבִֽיו׃
ספר בראשית/לז	כג	__	{{מ:פסוק|בראשית|לז|כג|עלייה=שלישי}}	{{נוסח|וַֽיְהִ֕י|ל=וַֽיְהִ֕י בגעיה ימנית|ל1=וַיְהִ֕י (אין געיה) וברויאר תיקן על פיו}} {{נוסח|כַּֽאֲשֶׁר־בָּ֥א|ל=כַּֽאֲשֶׁר־בָּ֥א בגעיה ימנית}} יוֹסֵ֖ף אֶל־אֶחָ֑יו וַיַּפְשִׁ֤יטוּ אֶת־יוֹסֵף֙ אֶת־כֻּתׇּנְתּ֔וֹ אֶת־כְּתֹ֥נֶת הַפַּסִּ֖ים אֲשֶׁ֥ר עָלָֽיו׃
ספר בראשית/לז	כד	__	{{מ:פסוק|בראשית|לז|כד}}	וַיִּ֨קָּחֻ֔הוּ וַיַּשְׁלִ֥כוּ אֹת֖וֹ הַבֹּ֑רָה וְהַבּ֣וֹר רֵ֔ק אֵ֥ין בּ֖וֹ מָֽיִם׃
ספר בראשית/לז	כה	__	{{מ:פסוק|בראשית|לז|כה}}	וַיֵּשְׁבוּ֮ לֶֽאֱכׇל־לֶ֒חֶם֒ וַיִּשְׂא֤וּ עֵֽינֵיהֶם֙ וַיִּרְא֔וּ וְהִנֵּה֙ אֹרְחַ֣ת יִשְׁמְעֵאלִ֔ים בָּאָ֖ה מִגִּלְעָ֑ד וּגְמַלֵּיהֶ֣ם נֹֽשְׂאִ֗ים נְכֹאת֙ וּצְרִ֣י וָלֹ֔ט הוֹלְכִ֖ים לְהוֹרִ֥יד מִצְרָֽיְמָה׃
ספר בראשית/לז	כו	__	{{מ:פסוק|בראשית|לז|כו}}	וַיֹּ֥אמֶר יְהוּדָ֖ה אֶל־אֶחָ֑יו מַה־בֶּ֗צַע כִּ֤י נַהֲרֹג֙ אֶת־אָחִ֔ינוּ וְכִסִּ֖ינוּ אֶת־דָּמֽוֹ׃
ספר בראשית/לז	כז	__	{{מ:פסוק|בראשית|לז|כז}}	לְכ֞וּ וְנִמְכְּרֶ֣נּוּ לַיִּשְׁמְעֵאלִ֗ים וְיָדֵ֙נוּ֙ אַל־תְּהִי־ב֔וֹ כִּֽי־אָחִ֥ינוּ בְשָׂרֵ֖נוּ ה֑וּא וַֽיִּשְׁמְע֖וּ אֶחָֽיו׃
ספר בראשית/לז	כח	__	{{מ:פסוק|בראשית|לז|כח}}	וַיַּֽעַבְרוּ֩ אֲנָשִׁ֨ים מִדְיָנִ֜ים סֹֽחֲרִ֗ים וַֽיִּמְשְׁכוּ֙ וַיַּֽעֲל֤וּ אֶת־יוֹסֵף֙ מִן־הַבּ֔וֹר וַיִּמְכְּר֧וּ אֶת־יוֹסֵ֛ף לַיִּשְׁמְעֵאלִ֖ים בְּעֶשְׂרִ֣ים כָּ֑סֶף וַיָּבִ֥יאוּ אֶת־יוֹסֵ֖ף מִצְרָֽיְמָה׃
ספר בראשית/לז	כט	__	{{מ:פסוק|בראשית|לז|כט}}	וַיָּ֤שׇׁב רְאוּבֵן֙ אֶל־הַבּ֔וֹר וְהִנֵּ֥ה אֵין־יוֹסֵ֖ף בַּבּ֑וֹר וַיִּקְרַ֖ע אֶת־בְּגָדָֽיו׃
ספר בראשית/לז	ל	__	{{מ:פסוק|בראשית|לז|ל}}	וַיָּ֥שׇׁב אֶל־אֶחָ֖יו וַיֹּאמַ֑ר הַיֶּ֣לֶד אֵינֶ֔נּוּ וַאֲנִ֖י אָ֥נָה אֲנִי־בָֽא׃
ספר בראשית/לז	לא	__	{{מ:פסוק|בראשית|לז|לא}}	וַיִּקְח֖וּ אֶת־כְּתֹ֣נֶת יוֹסֵ֑ף וַֽיִּשְׁחֲטוּ֙ שְׂעִ֣יר עִזִּ֔ים וַיִּטְבְּל֥וּ אֶת־הַכֻּתֹּ֖נֶת בַּדָּֽם׃
ספר בראשית/לז	לב	__	{{מ:פסוק|בראשית|לז|לב}}	וַֽיְשַׁלְּח֞וּ אֶת־כְּתֹ֣נֶת הַפַּסִּ֗ים וַיָּבִ֙יאוּ֙ אֶל־אֲבִיהֶ֔ם וַיֹּאמְר֖וּ זֹ֣את מָצָ֑אנוּ {{נוסח|הַכֶּר־נָ֗א|=א(ס)ל <גרשיים? אינו כן אלא ברביע>|דפוסים=הַכֶּר־נָ֞א (גרשיים)}} הַכְּתֹ֧נֶת בִּנְךָ֛ הִ֖וא אִם־לֹֽא׃
ספר בראשית/לז	לג	__	{{מ:פסוק|בראשית|לז|לג}}	וַיַּכִּירָ֤הּ וַיֹּ֙אמֶר֙ כְּתֹ֣נֶת בְּנִ֔י חַיָּ֥ה רָעָ֖ה אֲכָלָ֑תְהוּ טָרֹ֥ף טֹרַ֖ף יוֹסֵֽף׃
ספר בראשית/לז	לד	__	{{מ:פסוק|בראשית|לז|לד}}	וַיִּקְרַ֤ע יַעֲקֹב֙ שִׂמְלֹתָ֔יו וַיָּ֥שֶׂם שַׂ֖ק בְּמׇתְנָ֑יו וַיִּתְאַבֵּ֥ל עַל־בְּנ֖וֹ יָמִ֥ים רַבִּֽים׃
ספר בראשית/לז	לה	__	{{מ:פסוק|בראשית|לז|לה}}	וַיָּקֻ֩מוּ֩ כׇל־בָּנָ֨יו וְכׇל־בְּנֹתָ֜יו לְנַחֲמ֗וֹ וַיְמָאֵן֙ לְהִתְנַחֵ֔ם וַיֹּ֕אמֶר כִּֽי־אֵרֵ֧ד אֶל־בְּנִ֛י אָבֵ֖ל שְׁאֹ֑לָה וַיֵּ֥בְךְּ אֹת֖וֹ אָבִֽיו׃
ספר בראשית/לז	לו	__	{{מ:פסוק|בראשית|לז|לו}}	וְהַ֨מְּדָנִ֔ים מָכְר֥וּ אֹת֖וֹ אֶל־מִצְרָ֑יִם לְפֽוֹטִיפַר֙ סְרִ֣יס פַּרְעֹ֔ה שַׂ֖ר הַטַּבָּחִֽים׃
ספר בראשית/לז	תתת	<noinclude>//{{תבנית:משתמש:Dovi/טעמי המקרא-סוף}}//{{מ:שוליים-סוף}}//==הפרק בלי מספרים==//{{תבנית:משתמש:Dovi/טעמי המקרא}}//{{#בלי קטע:{{שם הדף המלא}}|סימן}}//{{תבנית:משתמש:Dovi/טעמי המקרא-סוף}}</noinclude>		
ספר בראשית/לח	0	<noinclude>{{תבנית:טעמי המקרא באינטרנט}}//{{מ:שוליים|5}}//{{תבנית:משתמש:Dovi/טעמי המקרא}}//</noinclude>		
ספר בראשית/לח	א	{{פפ}}//	{{מ:פסוק|בראשית|לח|א|סדר=לד|עלייה=רביעי}}	וַֽיְהִי֙ בָּעֵ֣ת הַהִ֔וא וַיֵּ֥רֶד יְהוּדָ֖ה מֵאֵ֣ת אֶחָ֑יו וַיֵּ֛ט עַד־אִ֥ישׁ עֲדֻלָּמִ֖י וּשְׁמ֥וֹ חִירָֽה׃
ספר בראשית/לח	ב	__	{{מ:פסוק|בראשית|לח|ב}}	וַיַּרְא־שָׁ֧ם יְהוּדָ֛ה בַּת־אִ֥ישׁ כְּנַעֲנִ֖י וּשְׁמ֣וֹ שׁ֑וּעַ וַיִּקָּחֶ֖הָ וַיָּבֹ֥א אֵלֶֽיהָ׃
ספר בראשית/לח	ג	__	{{מ:פסוק|בראשית|לח|ג}}	וַתַּ֖הַר וַתֵּ֣לֶד בֵּ֑ן וַיִּקְרָ֥א אֶת־שְׁמ֖וֹ עֵֽר׃
ספר בראשית/לח	ד	__	{{מ:פסוק|בראשית|לח|ד}}	וַתַּ֥הַר ע֖וֹד וַתֵּ֣לֶד בֵּ֑ן וַתִּקְרָ֥א אֶת־שְׁמ֖וֹ אוֹנָֽן׃
ספר בראשית/לח	ה	__	{{מ:פסוק|בראשית|לח|ה}}	וַתֹּ֤סֶף עוֹד֙ וַתֵּ֣לֶד בֵּ֔ן וַתִּקְרָ֥א אֶת־שְׁמ֖וֹ שֵׁלָ֑ה וְהָיָ֥ה בִכְזִ֖יב בְּלִדְתָּ֥הּ אֹתֽוֹ׃
ספר בראשית/לח	ו	__	{{מ:פסוק|בראשית|לח|ו}}	וַיִּקַּ֧ח יְהוּדָ֛ה אִשָּׁ֖ה לְעֵ֣ר בְּכוֹר֑וֹ וּשְׁמָ֖הּ תָּמָֽר׃
ספר בראשית/לח	ז	__	{{מ:פסוק|בראשית|לח|ז}}	וַיְהִ֗י עֵ֚ר בְּכ֣וֹר יְהוּדָ֔ה רַ֖ע בְּעֵינֵ֣י יְהֹוָ֑ה וַיְמִתֵ֖הוּ יְהֹוָֽה׃
ספר בראשית/לח	ח	__	{{מ:פסוק|בראשית|לח|ח}}	וַיֹּ֤אמֶר יְהוּדָה֙ לְאוֹנָ֔ן בֹּ֛א אֶל־אֵ֥שֶׁת אָחִ֖יךָ וְיַבֵּ֣ם אֹתָ֑הּ וְהָקֵ֥ם זֶ֖רַע לְאָחִֽיךָ׃
ספר בראשית/לח	ט	__	{{מ:פסוק|בראשית|לח|ט}}	"וַיֵּ֣דַע אוֹנָ֔ן כִּ֛י {{נוסח|לֹּ֥א|=ל (למ""ד דגושה) ועל פיו בדותן, ברויאר ומג""ה (וכן בקורן)|אין דגש ברוב הדפוסים|הערת המקליד לניקוד חריג בכתי""ל}} ל֖וֹ יִהְיֶ֣ה הַזָּ֑רַע וְהָיָ֞ה אִם־בָּ֨א אֶל־אֵ֤שֶׁת אָחִיו֙ וְשִׁחֵ֣ת אַ֔רְצָה לְבִלְתִּ֥י נְתׇן־זֶ֖רַע לְאָחִֽיו׃"
ספר בראשית/לח	י	__	{{מ:פסוק|בראשית|לח|י}}	וַיֵּ֛רַע בְּעֵינֵ֥י יְהֹוָ֖ה אֲשֶׁ֣ר עָשָׂ֑ה וַיָּ֖מֶת גַּם־אֹתֽוֹ׃
ספר בראשית/לח	יא	__	{{מ:פסוק|בראשית|לח|יא}}	"וַיֹּ֣אמֶר יְהוּדָה֩ לְתָמָ֨ר כַּלָּת֜וֹ שְׁבִ֧י אַלְמָנָ֣ה בֵית־אָבִ֗יךְ עַד־יִגְדַּל֙ שֵׁלָ֣ה {{נוסח|בְנִ֔י|=ש ובדפוסים|ל=בְנְ֔י (נו""ן בשתי נקודות שווא!)|הערת דותן}} כִּ֣י אָמַ֔ר פֶּן־יָמ֥וּת גַּם־ה֖וּא כְּאֶחָ֑יו וַתֵּ֣לֶךְ תָּמָ֔ר וַתֵּ֖שֶׁב בֵּ֥ית אָבִֽיהָ׃"
ספר בראשית/לח	יב	__	{{מ:פסוק|בראשית|לח|יב}}	וַיִּרְבּוּ֙ הַיָּמִ֔ים וַתָּ֖מׇת בַּת־שׁ֣וּעַ אֵֽשֶׁת־יְהוּדָ֑ה וַיִּנָּ֣חֶם יְהוּדָ֗ה וַיַּ֜עַל {{נוסח|עַל־גֹּֽזְזֵ֤י|=ש ובדפוסים|ל=עַל־גֹּֽזֲזֵ֤י (חטף)|הערת ברויאר}} צֹאנוֹ֙ ה֗וּא וְחִירָ֛ה רֵעֵ֥הוּ הָעֲדֻלָּמִ֖י תִּמְנָֽתָה׃
ספר בראשית/לח	יג	__	{{מ:פסוק|בראשית|לח|יג}}	וַיֻּגַּ֥ד לְתָמָ֖ר לֵאמֹ֑ר הִנֵּ֥ה חָמִ֛יךְ עֹלֶ֥ה תִמְנָ֖תָה לָגֹ֥ז צֹאנֽוֹ׃
ספר בראשית/לח	יד	__	{{מ:פסוק|בראשית|לח|יד}}	וַתָּ֩סַר֩ בִּגְדֵ֨י אַלְמְנוּתָ֜הּ מֵֽעָלֶ֗יהָ וַתְּכַ֤ס בַּצָּעִיף֙ וַתִּתְעַלָּ֔ף וַתֵּ֙שֶׁב֙ בְּפֶ֣תַח עֵינַ֔יִם אֲשֶׁ֖ר עַל־דֶּ֣רֶךְ תִּמְנָ֑תָה כִּ֤י רָאֲתָה֙ כִּֽי־גָדַ֣ל שֵׁלָ֔ה וְהִ֕וא לֹֽא־נִתְּנָ֥ה ל֖וֹ לְאִשָּֽׁה׃
ספר בראשית/לח	טו	__	{{מ:פסוק|בראשית|לח|טו}}	וַיִּרְאֶ֣הָ יְהוּדָ֔ה {{נוסח|וַֽיַּחְשְׁבֶ֖הָ|ל=וַֽיַּחְשְׁבֶ֖הָ בגעיה ימנית}} לְזוֹנָ֑ה כִּ֥י כִסְּתָ֖ה פָּנֶֽיהָ׃
ספר בראשית/לח	טז	__	{{מ:פסוק|בראשית|לח|טז}}	"וַיֵּ֨ט אֵלֶ֜יהָ אֶל־הַדֶּ֗רֶךְ וַיֹּ֙אמֶר֙ {{נוסח|הָֽבָה־נָּא֙|=ל (""הבה"" מוקפת)|דפוסים=הָ֤בָה נָּא֙ (""הבה"" בטעם מהפך)}} אָב֣וֹא אֵלַ֔יִךְ כִּ֚י לֹ֣א יָדַ֔ע כִּ֥י כַלָּת֖וֹ הִ֑וא וַתֹּ֙אמֶר֙ {{נוסח|מַה־תִּתֶּן־לִ֔י|=ש ומ""ש|ל=מַה־תִּתֶּן־לִּ֔י (למ""ד דגושה)|הערות ברויאר והמקליד}} כִּ֥י תָב֖וֹא אֵלָֽי׃"
ספר בראשית/לח	יז	__	{{מ:פסוק|בראשית|לח|יז}}	וַיֹּ֕אמֶר אָנֹכִ֛י אֲשַׁלַּ֥ח גְּדִֽי־עִזִּ֖ים מִן־הַצֹּ֑אן וַתֹּ֕אמֶר אִם־תִּתֵּ֥ן עֵרָב֖וֹן עַ֥ד שָׁלְחֶֽךָ׃
ספר בראשית/לח	יח	__	{{מ:פסוק|בראשית|לח|יח}}	"וַיֹּ֗אמֶר מָ֣ה {{נוסח|הָעֵֽרָבוֹן֮|ראו רשימת ברויאר ב""ספיקות שאין להם הכרע"", הערה 8 ובספר טעמי המקרא פרק ח (וכן בקורן ובמג""ה).|ל=הָֽעֵרָבוֹן֮ (! ובגעיה ימנית) וכן אצל ברויאר.|ל1=הָעֵרָבוֹן֮}} אֲשֶׁ֣ר {{נוסח|אֶתֶּן־לָךְ֒|=שש1(?) ובדפוסים|ל=אֶתֶּן־לָּךְ֒ (למ""ד דגושה)|הערת ברויאר}} וַתֹּ֗אמֶר חֹתָֽמְךָ֙ וּפְתִילֶ֔ךָ וּמַטְּךָ֖ אֲשֶׁ֣ר בְּיָדֶ֑ךָ {{נוסח|וַיִּתֶּן־לָ֛הּ|=שש1 ובדפוסים|ל=וַיִּתֶּן־לָּ֛הּ (למ""ד דגושה)|הערת ברויאר}} וַיָּבֹ֥א אֵלֶ֖יהָ וַתַּ֥הַר לֽוֹ׃"
ספר בראשית/לח	יט	__	{{מ:פסוק|בראשית|לח|יט}}	וַתָּ֣קׇם וַתֵּ֔לֶךְ וַתָּ֥סַר צְעִיפָ֖הּ מֵעָלֶ֑יהָ וַתִּלְבַּ֖שׁ בִּגְדֵ֥י אַלְמְנוּתָֽהּ׃
ספר בראשית/לח	כ	__	{{מ:פסוק|בראשית|לח|כ}}	וַיִּשְׁלַ֨ח יְהוּדָ֜ה אֶת־גְּדִ֣י הָֽעִזִּ֗ים בְּיַד֙ רֵעֵ֣הוּ הָֽעֲדֻלָּמִ֔י לָקַ֥חַת הָעֵרָב֖וֹן מִיַּ֣ד הָאִשָּׁ֑ה וְלֹ֖א מְצָאָֽהּ׃
ספר בראשית/לח	כא	__	{{מ:פסוק|בראשית|לח|כא}}	וַיִּשְׁאַ֞ל אֶת־אַנְשֵׁ֤י מְקֹמָהּ֙ לֵאמֹ֔ר אַיֵּ֧ה הַקְּדֵשָׁ֛ה הִ֥וא בָעֵינַ֖יִם עַל־הַדָּ֑רֶךְ וַיֹּ֣אמְר֔וּ לֹא־הָיְתָ֥ה בָזֶ֖ה קְדֵשָֽׁה׃
ספר בראשית/לח	כב	__	{{מ:פסוק|בראשית|לח|כב}}	וַיָּ֙שׇׁב֙ אֶל־יְהוּדָ֔ה וַיֹּ֖אמֶר לֹ֣א מְצָאתִ֑יהָ וְגַ֨ם אַנְשֵׁ֤י הַמָּקוֹם֙ אָֽמְר֔וּ לֹא־הָיְתָ֥ה בָזֶ֖ה קְדֵשָֽׁה׃
ספר בראשית/לח	כג	__	{{מ:פסוק|בראשית|לח|כג}}	וַיֹּ֤אמֶר יְהוּדָה֙ תִּֽקַּֽח־לָ֔הּ פֶּ֖ן נִהְיֶ֣ה לָב֑וּז הִנֵּ֤ה שָׁלַ֙חְתִּי֙ הַגְּדִ֣י הַזֶּ֔ה וְאַתָּ֖ה לֹ֥א מְצָאתָֽהּ׃
ספר בראשית/לח	כד	__	{{מ:פסוק|בראשית|לח|כד}}	וַיְהִ֣י{{מ:לגרמיה}}כְּמִשְׁלֹ֣שׁ חֳדָשִׁ֗ים וַיֻּגַּ֨ד לִֽיהוּדָ֤ה {{נוסח|לֵֽאמֹר֙|=ל (לֵֽאמֹר֙ בגעיה ימנית)|ל1=לֵאמֹר֙ (אין געיה) וברויאר תיקן על פיו}} זָֽנְתָה֙ תָּמָ֣ר כַּלָּתֶ֔ךָ וְגַ֛ם הִנֵּ֥ה הָרָ֖ה לִזְנוּנִ֑ים וַיֹּ֣אמֶר יְהוּדָ֔ה הוֹצִיא֖וּהָ וְתִשָּׂרֵֽף׃
ספר בראשית/לח	כה	__	{{מ:פסוק|בראשית|לח|כה}}	הִ֣וא מוּצֵ֗את וְהִ֨יא שָׁלְחָ֤ה אֶל־חָמִ֙יהָ֙ לֵאמֹ֔ר לְאִישׁ֙ אֲשֶׁר־אֵ֣לֶּה לּ֔וֹ אָנֹכִ֖י הָרָ֑ה וַתֹּ֙אמֶר֙ הַכֶּר־נָ֔א לְמִ֞י הַחֹתֶ֧מֶת וְהַפְּתִילִ֛ים וְהַמַּטֶּ֖ה הָאֵֽלֶּה׃
ספר בראשית/לח	כו	__	{{מ:פסוק|בראשית|לח|כו}}	"וַיַּכֵּ֣ר יְהוּדָ֗ה וַיֹּ֙אמֶר֙ צָֽדְקָ֣ה מִמֶּ֔נִּי כִּֽי־עַל־כֵּ֥ן לֹא־נְתַתִּ֖יהָ לְשֵׁלָ֣ה בְנִ֑י וְלֹֽא־יָסַ֥ף ע֖וֹד {{נוסח|לְדַעְתָּֽהּ|=ש ובדפוסים|ל=לְדַעְתָּֽה (חסרה נקודת מפיק בה""א)|הערות ברויאר ודותן והמקליד}}׃"
ספר בראשית/לח	כז	__	{{מ:פסוק|בראשית|לח|כז}}	וַיְהִ֖י בְּעֵ֣ת לִדְתָּ֑הּ וְהִנֵּ֥ה תְאוֹמִ֖ים בְּבִטְנָֽהּ׃
ספר בראשית/לח	כח	__	{{מ:פסוק|בראשית|לח|כח}}	וַיְהִ֥י בְלִדְתָּ֖הּ וַיִּתֶּן־יָ֑ד וַתִּקַּ֣ח הַמְיַלֶּ֗דֶת וַתִּקְשֹׁ֨ר עַל־יָד֤וֹ שָׁנִי֙ לֵאמֹ֔ר זֶ֖ה יָצָ֥א רִאשֹׁנָֽה׃
ספר בראשית/לח	כט	__	{{מ:פסוק|בראשית|לח|כט}}	וַיְהִ֣י{{מ:לגרמיה}}כְּמֵשִׁ֣יב יָד֗וֹ וְהִנֵּה֙ יָצָ֣א אָחִ֔יו וַתֹּ֕אמֶר מַה־פָּרַ֖צְתָּ עָלֶ֣יךָ פָּ֑רֶץ וַיִּקְרָ֥א שְׁמ֖וֹ פָּֽרֶץ׃
ספר בראשית/לח	ל	__	{{מ:פסוק|בראשית|לח|ל}}	וְאַחַר֙ יָצָ֣א אָחִ֔יו אֲשֶׁ֥ר עַל־יָד֖וֹ הַשָּׁנִ֑י וַיִּקְרָ֥א שְׁמ֖וֹ זָֽרַח׃
ספר בראשית/לח	תתת	<noinclude>//{{תבנית:משתמש:Dovi/טעמי המקרא-סוף}}//{{מ:שוליים-סוף}}//==הפרק בלי מספרים==//{{תבנית:משתמש:Dovi/טעמי המקרא}}//{{#בלי קטע:{{שם הדף המלא}}|סימן}}//{{תבנית:משתמש:Dovi/טעמי המקרא-סוף}}</noinclude>		
ספר בראשית/לט	0	<noinclude>{{תבנית:טעמי המקרא באינטרנט}}//{{מ:שוליים|5}}//{{תבנית:משתמש:Dovi/טעמי המקרא}}//</noinclude>		
ספר בראשית/לט	א	{{סס}}	{{מ:פסוק|בראשית|לט|א|סדר=לה|עלייה=חמישי}}	וְיוֹסֵ֖ף הוּרַ֣ד מִצְרָ֑יְמָה וַיִּקְנֵ֡הוּ פּוֹטִיפַר֩ סְרִ֨יס פַּרְעֹ֜ה שַׂ֤ר הַטַּבָּחִים֙ אִ֣ישׁ מִצְרִ֔י מִיַּד֙ הַיִּשְׁמְעֵאלִ֔ים אֲשֶׁ֥ר הוֹרִדֻ֖הוּ שָֽׁמָּה׃
ספר בראשית/לט	ב	__	{{מ:פסוק|בראשית|לט|ב}}	"וַיְהִ֤י יְהֹוָה֙ אֶת־יוֹסֵ֔ף וַיְהִ֖י אִ֣ישׁ מַצְלִ֑יחַ וַיְהִ֕י {{נוסח|בְּבֵ֖ית אֲדֹנָ֥יו|=לשש1 (טפחא ומרכא)|דפוסים=בְּבֵ֥ית אֲדֹנָ֖יו (מרכא וטפחא) וכן בהקלדה (כנראה בטעות ע""פ BHS)}} הַמִּצְרִֽי׃"
ספר בראשית/לט	ג	__	{{מ:פסוק|בראשית|לט|ג}}	וַיַּ֣רְא אֲדֹנָ֔יו כִּ֥י יְהֹוָ֖ה אִתּ֑וֹ וְכֹל֙ אֲשֶׁר־ה֣וּא עֹשֶׂ֔ה יְהֹוָ֖ה מַצְלִ֥יחַ בְּיָדֽוֹ׃
ספר בראשית/לט	ד	__	{{מ:פסוק|בראשית|לט|ד}}	וַיִּמְצָ֨א יוֹסֵ֥ף חֵ֛ן בְּעֵינָ֖יו וַיְשָׁ֣רֶת אֹת֑וֹ וַיַּפְקִדֵ֙הוּ֙ עַל־בֵּית֔וֹ וְכׇל־יֶשׁ־ל֖וֹ נָתַ֥ן בְּיָדֽוֹ׃
ספר בראשית/לט	ה	__	{{מ:פסוק|בראשית|לט|ה}}	וַיְהִ֡י מֵאָז֩ הִפְקִ֨יד אֹת֜וֹ בְּבֵית֗וֹ וְעַל֙ כׇּל־אֲשֶׁ֣ר יֶשׁ־ל֔וֹ וַיְבָ֧רֶךְ יְהֹוָ֛ה אֶת־בֵּ֥ית הַמִּצְרִ֖י בִּגְלַ֣ל יוֹסֵ֑ף וַיְהִ֞י בִּרְכַּ֤ת יְהֹוָה֙ בְּכׇל־אֲשֶׁ֣ר יֶשׁ־ל֔וֹ בַּבַּ֖יִת וּבַשָּׂדֶֽה׃
ספר בראשית/לט	ו	__	{{מ:פסוק|בראשית|לט|ו}}	וַיַּעֲזֹ֣ב כׇּל־אֲשֶׁר־לוֹ֮ בְּיַד־יוֹסֵף֒ וְלֹא־יָדַ֤ע אִתּוֹ֙ מְא֔וּמָה כִּ֥י אִם־הַלֶּ֖חֶם אֲשֶׁר־ה֣וּא אוֹכֵ֑ל וַיְהִ֣י יוֹסֵ֔ף יְפֵה־תֹ֖אַר וִיפֵ֥ה מַרְאֶֽה׃
